review_user_id,app_id,app_version,rating,review_text,review_source,language,sentiment,complaint_category,developer_reply,thumbs_up_count,review_date,developer_reply_date,positive_review,negative_review
2153,5,,1,"S#+$&@#&#@ punye apps.same tengin dgn maybnk.sebab dah xboley updatelah user install kat fon baru,then Suh login jugak² dulu kat fon lame,before bole gune kat fon baru.",Google Play,English,Neutral,General,True,1,2026-06-25 10:49:47,2026-06-26 08:26:08,False,False
2154,5,1.9.51,1,"dalam banyak2 apps bank, cimb paling slow. Nak tunggu no tac berjam.",Google Play,English,Negative,General,True,0,2026-06-25 10:31:55,2026-06-26 08:22:02,False,True
2155,5,1.9.33,1,"Dear CIMB, I'm using an old phone and my operating system is unable to update anymore, and i cannot use the cimb octo and I need to buy a new phone, please reconsider your application requirements, I believe a lot of people not only me having the same problem.",Google Play,English,Negative,General,True,1,2026-06-25 09:46:16,2026-06-26 08:20:58,False,True
2156,5,,1,Kenapa tak boleh update? Incompatible device pula. Sebelum ni okay,Google Play,English,Neutral,General,True,1,2026-06-25 09:37:05,2026-06-25 09:51:46,False,False
2157,5,1.9.51,2,in the latest version (updated on 25/6) the accounts page loads extremely slow and keep getting blocked by popup about multicurrency downtime. This is bad design as it should not block normal user from viewing its normal account balance,Google Play,English,Negative,General,True,2,2026-06-25 08:17:09,2026-06-25 09:43:36,False,True
2158,5,1.9.51,1,"App takes a while load. Normally this is not an issue, but when you need to approve tac, then that's a problem. Slow start is one thing, then when you open the tac approval thing you still have to wait 10 more seconds. Then the app close when you fail to approve tac in time. then you have to go through the whole slow start again. Not very smart design choice.",Google Play,English,Negative,General,True,4,2026-06-25 07:54:33,2026-06-25 09:40:28,False,True
2159,5,1.6.3,1,suddenly my octa app cannot use. its say doesn't support. why?? why?? i uninstall octa app and try to reinstall that octo app but failed. why? its run smooth before. what im gonna now?,Google Play,English,Negative,General,False,1,2026-06-25 04:22:08,,True,True
2160,5,1.9.51,1,to slow,Google Play,English,Negative,General,False,0,2026-06-25 03:44:08,,False,True
2161,5,1.9.33,5,this app is not compatible to my phone anymore..I try to upgrade the version but it says already new version..what should I do?,Google Play,English,Neutral,General,False,0,2026-06-25 02:56:05,,False,False
2162,5,1.9.51,1,"This apps should notify incompatibility a few months before total abrupt disconnection. This is a case for Bank Negara to look into. A total disservice to the customer. It happens all of a sudden at the most inconvenient time. The contention here is not the change but without sufficient notification. The bank owes a ""duty of care"" to it's customers which is not limited to apps security but also provide accessibility to the apps and a means to use their accounts for payment to meet obligations.",Google Play,English,Positive,General,True,6,2026-06-24 23:30:32,2026-06-24 07:09:44,True,False
1605,5,1.9.51,5,"This app is reliable and easy to use. It allows me to manage my finances, transfer funds, and pay bills without any hassle.",Google Play,English,Positive,General,True,1,2026-06-24 22:49:23,2026-06-25 09:39:10,True,False
2163,5,1.9.33,5,"i want use this cimb click to new phone,how can I register",Google Play,English,Neutral,General,True,0,2026-06-24 22:08:36,2026-06-25 09:37:29,False,False
2164,5,1.9.51,1,Why is it I cannot open the apps after updating,Google Play,English,Neutral,General,True,0,2026-06-24 21:54:13,2026-06-25 09:31:22,False,False
2165,5,,5,"I have no install this apps, why?",Google Play,English,Neutral,General,True,0,2026-06-24 21:43:11,2026-06-25 09:29:55,False,False
1607,5,,5,Reliable banking platform with smooth transactions and helpful financial management features.,Google Play,English,Positive,General,True,0,2026-06-24 21:29:09,2026-06-25 09:28:26,True,False
2166,5,,1,menyusahkan....apabila bertukar telefon dan terpaksa menutup di telefon satu lagi baru dapat buka di telefon satu lagi....,Google Play,English,Neutral,General,True,0,2026-06-24 21:09:33,2026-06-25 08:52:50,False,False
2167,5,,5,"I was skeptical about moving away from the classic CIMB Clicks app, but the OCTO app has honestly been great for me. The interface looks so much cleaner and modern. DuitNow QR and instant transfers work smoothly without any hiccups. Plus, the SecureTAC notification pops up fast, which makes approving web transactions super convenient. Solid 5 stars!",Google Play,English,Positive,General,True,0,2026-06-24 20:58:20,2026-06-25 08:47:58,True,False
1613,5,1.9.51,1,"Why i cant open my cimb click, its told me to update but my device cannot update, so disappointed...",Google Play,English,Neutral,General,True,0,2026-06-24 20:09:00,2026-06-25 08:40:35,False,False
2168,5,1.9.51,1,Cannot use anymore withmy phone,Google Play,English,Neutral,General,True,0,2026-06-24 19:58:59,2026-06-25 08:39:27,False,False
2169,5,1.9.33,2,"aplikasi Tiba-tiba bermasaalah dan tidak dapat di Update, sekarang langsung tidak dapat digunakan",Google Play,English,Neutral,General,True,0,2026-06-24 19:34:48,2026-06-25 08:38:44,False,False
2170,5,,1,It says my phone is not compatible with the new os update. Does a customer need to change a well functioning hp just yo use your app?,Google Play,English,Neutral,General,True,0,2026-06-24 19:07:26,2026-06-25 08:04:31,False,False
2171,5,1.9.33,5,excellent,Google Play,English,Positive,General,True,0,2026-06-24 19:00:45,2026-06-25 08:00:03,True,False
2172,5,1.9.51,3,can you do something enable use more that one smartphone,Google Play,English,Neutral,General,True,0,2026-06-24 18:47:42,2026-06-25 07:52:18,False,False
2173,5,,3,"If my device not compertable, any lower version for old device, tq",Google Play,English,Neutral,General,True,0,2026-06-24 18:41:27,2026-06-25 07:51:12,False,False
2174,5,1.9.33,1,App stopped working on Android 10 without any prior notice or alternative provided. Please improve communication and consider offering a compatible version or clear upgrade path for affected users,Google Play,English,Neutral,General,True,1,2026-06-24 18:37:34,2026-06-25 07:49:48,False,False
2175,5,,1,Wdym is no longer compatible in my device? I can't update it... Please read this developers..,Google Play,English,Neutral,General,True,0,2026-06-24 17:51:20,2026-06-25 07:43:14,False,False
2176,5,1.9.33,1,"It's not right to ask people to buy new hp, just because you upgraded your app. By right you should make it more user friendly for your clients.",Google Play,English,Neutral,General,True,1,2026-06-24 17:45:46,2026-06-25 07:42:11,False,False
2177,5,1.9.51,2,"force update, feel kinda harassment",Google Play,English,Neutral,General,True,0,2026-06-24 17:31:19,2025-01-23 02:23:40,False,False
2178,5,1.9.33,1,kena tukar henset baru lama dh xsuppirt..menyusahkannnnn betulll,Google Play,English,Neutral,General,True,0,2026-06-24 17:25:57,2026-06-25 07:40:17,False,False
2179,5,1.9.33,5,make me very comfort n my problem. can settle easier..,Google Play,English,Negative,General,True,0,2026-06-24 17:23:21,2026-06-25 07:38:36,False,True
2180,5,1.9.33,1,"unable to update software, unable to move to new device, nice cimb, smartest IT in the world",Google Play,English,Neutral,General,True,0,2026-06-24 16:39:13,2026-06-25 07:23:18,False,False
2181,5,1.6.8,2,"krg memuaskan,huawei sentiasa update, version lama X blh install",Google Play,English,Neutral,General,True,0,2026-06-24 16:17:15,2026-06-25 07:22:10,False,False
2182,5,1.9.51,5,easy to transfer money and all,Google Play,English,Positive,General,True,0,2026-06-24 16:07:25,2026-06-25 07:18:14,True,False
1612,5,1.9.51,5,cimb octo to me is an educated bank link that provided all infos necessary,Google Play,English,Neutral,General,True,0,2026-06-24 15:44:08,2026-06-25 07:17:42,False,False
2183,5,1.9.51,1,cannot work on honor tab. camera unable to take ic. although permission allowed,Google Play,English,Neutral,General,True,0,2026-06-24 15:41:13,2026-06-25 07:17:17,False,False
2184,5,1.9.51,5,love it to use and nice for payment.,Google Play,English,Positive,General,True,0,2026-06-24 15:30:29,2026-06-25 07:15:57,True,False
2185,5,1.9.51,1,What hapen to this app already can't be download for my phone Huawei nova 5t YAL-L21 ANDROID 12..I KEEP ON TRYING BUT IT FAILED TO BE DOWNLOADED PLEASE DO SOMETHING.. AM A CURRENT USER FOR CIMB APP,Google Play,English,Negative,General,True,0,2026-06-24 15:09:18,2026-06-25 07:25:38,False,True
2186,5,,1,"Suddenly can't use with my old Huawei, the bank said need to buy new phone, but if I don't want to, can't use my bank account",Google Play,English,Neutral,General,True,0,2026-06-24 13:54:26,2026-06-25 07:10:49,False,False
2187,5,,1,My phone cannot support new cimb octo even phone version up to date,Google Play,English,Neutral,General,True,0,2026-06-24 12:22:00,2026-06-25 06:23:58,False,False
2188,5,1.9.33,2,Why Redmi 9A cannot be used this app any more? Other options?,Google Play,English,Neutral,General,True,0,2026-06-24 11:56:51,2026-06-25 07:26:55,False,False
2189,5,,1,"Can't use, ask to update and it's show my phone devise is not compatible with apps version. Any solutions? Hv to change phone?",Google Play,English,Neutral,General,True,1,2026-06-24 11:11:46,2026-06-25 07:27:14,False,False
2190,5,,1,"Very bad service CIMB. APP CANNOT BE USED!! Very angry as a preferred customer of CIMB. Lousy lousy and lousy. Even CIMB Singapore can support old version of OS. You are definitely losing customers for your stupid and inflexible implementation of new updates! Other Msian banks still allow older OS, why CIMB Msia did something that bothers so many customers. To change phone for your stupid system? Come on!?!?",Google Play,English,Negative,General,True,0,2026-06-24 11:09:27,2026-06-25 06:20:00,False,True
2191,5,1.9.33,3,Phone saya dah tak boleh guna app ni sebab tak compatible.. Sebelum ni boleh guna tapi baru2 ni kena update tetapi phone tak compatible pulak.. Apa nak buat?,Google Play,English,Neutral,General,True,0,2026-06-24 11:06:00,2026-06-25 07:27:36,False,False
2192,5,,5,Good,Google Play,English,Positive,General,True,0,2026-06-24 10:11:29,2026-06-25 06:14:28,True,False
2193,5,,1,My Hp Huawei P30 Pro cannot download this version.... 😭😭😭,Google Play,English,Neutral,General,True,0,2026-06-24 09:17:13,2026-06-25 07:28:08,False,False
2194,5,1.9.33,1,"no longer functioning on my phone.. my phone is operating android 12 and still meets requirement as per stated, for Android to have at least android 11..please check your statement!",Google Play,English,Neutral,General,True,0,2026-06-24 09:15:04,2026-06-25 06:13:19,False,False
2195,5,1.9.33,1,"Unable to update due to I am using Huawei Mate 20 Pro? And my CIMB app unable to function while I need to transfer fund urgently in the midnight. Hence, I need to buy a new phone just for CIMB app? Eventho but current phone still well functioning?",Google Play,English,Neutral,General,True,0,2026-06-24 09:13:35,2026-06-25 06:11:41,False,False
2196,5,,1,给一颗星是因为p30 pro没能update，现在我用不了,Google Play,English,Neutral,General,True,0,2026-06-24 09:05:23,2026-06-25 07:28:46,False,False
2197,5,1.9.33,1,always not available to old phone.We cannot be changing phones always,Google Play,English,Neutral,General,True,1,2026-06-24 08:21:03,2026-06-25 06:08:34,False,False
77,5,,1,Cannot update latest apps,Google Play,English,Neutral,General,True,1,2026-06-23 23:51:00,2026-06-24 07:21:42,False,False
2198,5,1.9.33,1,"Su*k. When I update this apps, I can use it.",Google Play,English,Neutral,General,True,0,2026-06-23 23:39:03,2026-06-24 07:20:58,False,False
2199,5,,1,"tak semua mampu beli smartphone mahal, takkan tiada cimb octo apps untuk Android 10? lecehlah macam ni..",Google Play,English,Neutral,General,True,0,2026-06-23 22:58:53,2026-06-24 07:19:35,False,False
2200,5,,1,Can't use this apps make my life susah,Google Play,English,Neutral,General,True,0,2026-06-23 22:52:23,2026-06-24 07:18:14,False,False
2201,5,1.6.6,5,My cimb octo suddenly stop,Google Play,English,Neutral,General,True,1,2026-06-23 22:45:44,2024-10-17 02:12:46,False,False
2202,5,1.9.0,1,This is BS! even Maybank app do not require android 11. Now I have no choice but to stop using CIMB,Google Play,English,Neutral,General,True,1,2026-06-23 22:39:54,2026-06-24 07:16:53,False,False
2203,5,1.9.51,1,"My old phone, your new app so can't use. Now have to get another device so I can use app. Totally pulling my hair.",Google Play,English,Neutral,General,True,1,2026-06-23 22:31:55,2026-06-24 07:15:56,False,False
2204,5,1.9.33,1,"I have been using this apps for more than the years i can count and suddenly today it requested me to update the apps and won't allow me to use without update, which is still fine. But only to show me that my phone is no longer compatible? How am i suppose to approve the TAC now on? Am i suppose to get a new phone with certain minimum advanced spec now just to use your bank? I certainly don't have any issue with MBB and HLB apps at this point of time as I typed this feedback.",Google Play,English,Negative,General,True,0,2026-06-23 22:17:15,2026-06-24 07:08:10,False,True
2205,5,1.9.0,5,ok,Google Play,English,Neutral,General,True,0,2026-06-23 21:23:35,2026-06-24 07:01:47,False,False
2206,5,1.9.33,1,Ingatkan sorg2 jerr yg apps no longer compatible dkt fon ... rupanya ramai senasib ... tggu petik daun dkt pokok lah ye tukar fon supaya dpt guna apps balik 😊😊,Google Play,English,Neutral,General,False,0,2026-06-23 21:06:23,,False,False
2207,5,,1,it say my device as I'm using Samsung note 9 not compatible with this apps.,Google Play,English,Neutral,General,True,0,2026-06-23 20:41:46,2026-06-24 06:56:40,False,False
2208,5,1.9.51,1,Apps dah tak boleh guna..kena update hp semua urusan terganggu,Google Play,English,Neutral,General,True,0,2026-06-23 20:15:04,2026-06-24 06:56:24,False,False
2209,5,1.9.0,5,Why I cannot install this apps,Google Play,English,Neutral,General,True,0,2026-06-23 20:12:12,2026-06-24 06:55:58,False,False
2210,5,1.6.6,5,"Very bad app.. After completed installation, cannot open until now.. Useless app",Google Play,English,Negative,General,True,0,2026-06-23 19:52:34,2026-06-24 06:54:27,False,True
2211,5,1.9.33,1,suruh update tapi tak boleh. nampak gayanye dia suruh beli hanphone yg version lebih tinggi baru boleh update baru. kalau tak tak boleh guna. problem betul lah cimb ni. ingat orang banyak duit ke nak beli handphone baru dh lah sekarang minyak mahal nak jugak tambah beban pengguna. kasi lah buat app mesra pengguna yang semua jenis version android/iPhone boleh download tanpa masalah. ni sekarang dah menyusahkan.,Google Play,English,Negative,General,True,0,2026-06-23 19:39:27,2026-06-24 06:52:56,False,True
2212,5,,4,Im using Redmi Note 7 why there are no this apps?,Google Play,English,Neutral,General,True,0,2026-06-23 19:28:45,2026-06-24 06:51:44,False,False
2213,5,1.9.33,5,superb,Google Play,English,Neutral,General,True,0,2026-06-23 19:19:19,2026-06-24 06:50:57,False,False
2214,5,1.7.2,5,👍,Google Play,English,Neutral,General,False,0,2026-06-23 19:01:30,,False,False
2215,5,,1,old phone cannot support,Google Play,English,Neutral,General,True,0,2026-06-23 18:48:59,2026-06-24 06:50:33,False,False
2216,5,1.9.51,1,maybe give heads up like a week prior if updates are mandatory.,Google Play,English,Neutral,General,True,0,2026-06-23 18:44:56,2026-06-24 06:50:08,False,False
2217,5,1.9.51,1,Huawei nova 4 can't download this apk !Your device isn't compatible with this version! Please refix that,Google Play,English,Neutral,General,True,1,2026-06-23 18:21:53,2026-06-24 06:49:07,False,False
2218,5,,1,this apps not compatible with samsung note 9. not user friendly.. really annoying.,Google Play,English,Neutral,General,True,1,2026-06-23 18:15:55,2026-06-24 06:48:13,False,False
2219,5,1.9.51,1,Useless app,Google Play,English,Neutral,General,True,0,2026-06-23 17:55:16,2026-06-24 06:47:54,False,False
2220,5,,5,my need this apps in this device please give me again instole..🙏,Google Play,English,Neutral,General,True,0,2026-06-23 17:27:30,2026-06-24 06:46:29,False,False
2221,5,1.9.51,2,Kenapa tak dapat download aplkasi ni,Google Play,English,Neutral,General,True,0,2026-06-23 17:24:28,2026-06-24 06:45:27,False,False
2222,5,,5,Hello CMB Bank Theme Why can't I download the CMB Bank application on my phone? It was It was accidentally deleted from my phone and I want to install it now,Google Play,English,Neutral,General,True,0,2026-06-23 17:20:44,2026-06-24 06:44:03,False,False
2223,5,,5,app ni bagus.. tpi device saya x support.. bagaimana saya kembalikan app octo,Google Play,English,Neutral,General,True,0,2026-06-23 17:19:39,2026-06-24 06:43:14,False,False
2224,5,1.9.0,1,Disgrace,Google Play,English,Neutral,General,False,0,2026-06-23 16:14:38,,False,False
2225,5,1.9.0,1,my phone not support anymore😞,Google Play,English,Neutral,General,True,0,2026-06-23 16:03:02,2026-06-24 06:38:17,False,False
2226,5,1.9.0,1,"I use Android 10 for so long and has no problem with it. Other banks put their apps on minimum Android 10 to use their service but not for CIMB Octo app. Just because your developer is incompetent and can't write a code efficiently doesn't mean I can't use a service that has no problem with me for so long. Bye bye CIMB, tomorrow I'll draw out all my money and put it on Maybank. So stupid la you orang.",Google Play,English,Negative,General,True,1,2026-06-23 15:55:54,2026-06-24 06:37:48,False,True
2227,5,,1,Cannot use after update. reason because my phone not compatible with this app. Sepatutnya apps ni menyenangkan pengguna bukan menyusahkan pengguna. very disappointed 🙄🙄😡,Google Play,English,Neutral,General,True,1,2026-06-23 15:27:30,2026-06-24 06:36:40,False,False
2228,5,1.9.33,1,what hapen cenot open now so stupid,Google Play,English,Neutral,General,True,0,2026-06-23 15:25:04,2026-06-24 06:36:20,False,False
2229,5,1.9.0,1,"HW Mate 20 here. Running on Android 12 here but app say it's not compitable for my phone anymore, unable to top up TNG or pay for any govt service, not even able to access for cc approval from website now. Wth is going on??",Google Play,English,Neutral,General,True,0,2026-06-23 14:43:00,2026-06-24 06:32:14,False,False
2230,5,1.9.33,4,ok,Google Play,English,Neutral,General,True,0,2026-06-23 14:38:24,2026-06-24 06:30:29,False,False
2231,5,1.9.0,5,ok,Google Play,English,Neutral,General,True,0,2026-06-23 14:33:29,2026-06-24 06:29:57,False,False
2232,5,,5,it's good ...,Google Play,English,Positive,General,True,0,2026-06-23 14:31:40,2026-06-24 06:29:41,True,False
2233,5,,1,Official website says it still support android 10 but googlr play says it is not compatible with my p30 pro.,Google Play,English,Neutral,General,True,0,2026-06-23 14:30:44,2026-06-24 06:29:21,False,False
2234,5,1.9.0,1,Why cimb octo got so many problem after updated the apps? I can't opened at all my apps!! How to use then? .22/6/26- and now my phone not compatible for this apps for update. whatttt. so can't update ?,Google Play,English,Negative,General,True,0,2026-06-23 14:24:56,2024-10-11 04:50:57,False,True
2235,5,1.9.33,1,"With the latest update, the app is not available for my Android Version anymore. How to pay bills etc now? Every transaction i need to confirm with securetac. I can not pay school fees. I am using android 12. Pls make it available asap.",Google Play,English,Positive,General,True,0,2026-06-23 14:22:51,2026-06-24 05:37:41,True,False
2236,5,1.9.33,1,"I cannot use the app today. It shows ""Something is not right!"". After click ""OK"", it shows ""Update required"". After click ""Update now"", it shows ""This app is no longer compatible with your device"". My phone was Android 10 and cannot upgrade anymore. I don't want to buy new phone just for this. Now I cannot do online transaction as I cannot receive the TAC. Please maintain the old version or provide other way to receive the TAC such as SMS or Whatsapp.",Google Play,English,Neutral,General,True,4,2026-06-23 14:09:12,2026-06-24 05:36:02,False,False
2237,5,1.9.33,1,"making my app obselete because of my older phones, im changing banks from now on",Google Play,English,Neutral,General,True,1,2026-06-23 13:56:34,2026-06-24 05:18:28,False,False
2238,5,,1,problem setiap kli nk kene update version baru,Google Play,English,Negative,General,True,0,2026-06-23 13:28:25,2026-06-24 05:17:46,False,True
2239,5,1.9.33,1,Ekyc camera blank... Come on.. You force me to change phone for your app but now can't use. Camera blank. So many comment from other user but still no improvement!,Google Play,English,Neutral,General,True,1,2026-06-23 13:13:32,2026-06-24 05:17:07,False,False
2240,5,1.9.33,4,losing the app compatibility to my device - with the sudden change kind of forcing too. please check as this will impact users significantly,Google Play,English,Neutral,General,True,1,2026-06-23 12:54:50,2026-06-24 05:13:52,False,False
2241,5,1.9.51,5,trusted app for my daily banking. security good and I feel safe using it for payments.,Google Play,English,Positive,General,True,0,2026-06-23 12:37:16,2026-06-24 05:12:06,True,False
2242,5,,1,"why i cant install and update cimb octo in my phone huawei, before i can use but now i have problem to update and install",Google Play,English,Negative,General,True,1,2026-06-23 12:09:19,2026-06-24 05:00:56,False,True
2243,5,1.9.51,1,"UPDATE: it's 2026, this app still doesn't support Bitwarden and simple copy-paste function. Developer remains to be incompetent in cyber security. Can't use Bitwarden or any other password manager. Bad security practice! CIMB, your app is plague with outdated practice, please find a competent developer! Don't outsource it to low skill engineers. Full of technical debts!",Google Play,English,Negative,General,True,0,2026-06-23 12:06:54,2024-09-12 03:09:21,False,True
2244,5,1.9.33,5,Friendly used,Google Play,English,Neutral,General,True,0,2026-06-23 11:51:57,2026-06-24 04:56:37,False,False
2245,5,1.9.33,1,Phone aku padu kot,Google Play,English,Neutral,General,True,0,2026-06-23 11:51:00,2026-06-24 04:56:17,False,False
2246,5,1.9.51,1,How to change device if can't even open from this phone nova 5t dev please provide a temporary login app to change devices this also applies to other nova 5t usera,Google Play,English,Neutral,General,True,0,2026-06-23 11:49:13,2026-06-24 04:55:43,False,False
2247,5,1.9.33,4,it's safer to use...quite reliable,Google Play,English,Neutral,General,True,0,2026-06-23 11:03:22,2026-06-24 04:52:23,False,False
2248,5,,1,app cannot be used because my phone can no longer support new android version so app no longer working for me pls fix,Google Play,English,Neutral,General,True,0,2026-06-23 10:43:35,2026-06-24 04:51:41,False,False
2249,5,1.9.33,1,"My device only can use up to Android 10, currently I can no longer Access SecureTAC because the app no longer supports 10, because of this I had to make cancellations of online invoices due to no longer having app access to approve the payment. I have a perfectly well working Device, why not have some backwards compatibility? You expect me to buy a whole new phone just to use your app, my entire financial flow is disrupted due to these changes, no more access to QR aswell, bad bad service.",Google Play,English,Negative,General,True,3,2026-06-23 10:25:58,2026-06-24 04:51:03,True,True
2250,5,,1,Can't use,Google Play,English,Neutral,General,True,0,2026-06-23 10:16:03,2026-06-24 04:49:30,False,False
2251,5,1.9.33,1,"After the latest update of the app, it's suddenly not compatible with my phone anymore and I can't even open the app. My phone isn't even an ancient model. I'm using Huawei P30, which came out in 2019.",Google Play,English,Neutral,General,True,0,2026-06-23 10:02:29,2026-06-24 04:48:39,False,False
2252,5,1.9.33,5,app is logger,Google Play,English,Neutral,General,True,0,2026-06-23 09:55:51,2026-06-24 04:48:07,False,False
2253,5,,5,good,Google Play,English,Positive,General,True,0,2026-06-23 09:37:27,2026-06-24 04:47:03,True,False
2254,5,1.9.33,1,"I have suddenly unable to use this apps stated that my device is outdated, Fine, maybe my device is outdated by please inform in advance. This is my money and you guys treat client like u guys are the king. I had enough of CIMB unprofessional services. This is the last straw",Google Play,English,Neutral,General,True,0,2026-06-23 09:34:13,2026-06-24 04:46:44,False,False
2255,5,,1,cannot open the app... have to updte but cannot update... how come?,Google Play,English,Neutral,General,True,0,2026-06-23 09:22:48,2026-06-24 04:46:00,False,False
2256,5,1.9.33,1,My phone already update latest version. But still ask for update. I use Huawei Y9 Prime,Google Play,English,Neutral,General,True,0,2026-06-23 09:17:05,2026-06-24 04:45:02,False,False
2257,5,,1,this apps the most troublesome because it always has to be updated and the slowest in all processes. now it has to be updated but no longer compatible in my device. should i say good bye cimb?,Google Play,English,Negative,General,True,0,2026-06-23 09:09:28,2026-06-24 04:44:26,True,True
2258,5,1.9.33,1,This app is not compatible with your mobile?!!! Tak kan i kene tukar hp pulak😡😤❌‼️⁉️ My hp is updated. What to update lagi??!! I cant even open up cimb apps😡😤,Google Play,English,Neutral,General,True,0,2026-06-23 09:07:14,2026-06-24 04:43:34,False,False
2259,5,1.9.33,2,Latest update dah tak boleh update.. Sruh beli HP br plak.. Adoiii..,Google Play,English,Neutral,General,True,0,2026-06-23 08:50:30,2026-06-24 04:38:55,False,False
2260,5,1.9.33,1,my device is no longer compatible with cimb app? why?,Google Play,English,Neutral,General,True,0,2026-06-23 08:38:02,2026-06-24 04:31:50,False,False
