review_user_id,app_id,app_version,rating,review_text,review_source,language,sentiment,complaint_category,developer_reply,thumbs_up_count,review_date,developer_reply_date,positive_review,negative_review
2065,5,1.9.51,5,"CIMB Clicks delivers intuitive mobile banking with robust security features and diverse financial services. Fund transfers are instant, bill payments are straightforward, and the interface is clean and responsive. Excellent for managing finances on the go. Highly recommended. CIMB Clicks delivers intuitive mobile banking with robust security features and diverse financial services. Fund transfers are instant, bill payments are straightforward, and the interface is clean and responsive. Excellent",Google Play,English,Positive,General,True,0,2026-06-28 19:23:44,2026-06-29 03:32:16,True,False
2066,5,1.9.51,5,"""The CIMB OCTO app is user-friendly, secure, and convenient for everyday banking. Fund transfers, bill payments, and account management are quick and easy to access. The app runs smoothly and makes managing finances simple anytime, anywhere. Highly recommended!""",Google Play,English,Positive,General,True,0,2026-06-28 18:57:56,2026-06-29 03:32:11,True,False
2067,5,1.9.33,5,this app is very easy to use,Google Play,English,Positive,General,True,0,2026-06-28 18:23:13,2026-06-29 03:32:08,True,False
2068,5,1.9.33,4,Hi im using huawei p30 pro. It seems its no longer support the app. Is there any other version or support for p30 pr0,Google Play,English,Neutral,General,True,0,2026-06-28 18:04:01,2026-06-29 03:36:36,False,False
1568,5,1.9.51,5,"CIMB’s app is fast and really user-friendly. DuitNow transfers, bill payments, QR Pay, and reloads are all instant. I like how everything is on the OCTO app now — checking balance, cards, loans, and investments in one place.",Google Play,English,Positive,General,True,1,2026-06-28 17:50:35,2026-06-29 03:31:52,True,False
1569,5,1.9.51,5,"This app is a useful banking app that makes daily transactions simple and easy. Users can manage daily payments and transfer money easily. Overall, it is a helpful app for quick and smoothing online banking.",Google Play,English,Positive,General,True,1,2026-06-28 16:54:45,2026-06-29 03:31:45,True,False
1570,5,1.9.51,5,A very reliable banking app that gets the job done without a bunch of unnecessary clutter. The instant push notifications for every single card transaction give me great peace of mind against unauthorized usage.,Google Play,English,Positive,General,True,0,2026-06-28 16:49:54,2026-06-29 03:31:39,True,False
2069,5,1.9.51,1,Too slow and too many step. Not friendly user.,Google Play,English,Negative,General,True,2,2026-06-28 16:40:21,2026-06-29 03:40:32,False,True
1571,5,,5,Reliable online banking app with smooth performance. It makes managing my finances simple and convenient.,Google Play,English,Positive,General,True,0,2026-06-28 16:38:44,2026-06-29 03:31:33,True,False
1572,5,1.9.51,5,"Reliable and handy for everyday banking. Transfers, bill payments, and account management are quick and secure.",Google Play,English,Positive,General,True,0,2026-06-28 16:05:53,2026-06-29 03:35:35,True,False
2070,5,,5,very easy app,Google Play,English,Positive,General,True,0,2026-06-28 15:58:53,2026-06-29 03:31:26,True,False
2071,5,1.9.51,1,app runs slow. also get rid of the pop ups that open EVERY TIME I open the app. thanks ✌️,Google Play,English,Negative,General,True,2,2026-06-28 15:55:47,2026-06-29 03:42:47,False,True
2072,5,1.9.51,5,Thank you so much for the amazing service 😊 Really appreciate your help and support. Very satisfied with everything ❤️,Google Play,English,Neutral,General,True,0,2026-06-28 15:43:02,2026-06-29 03:31:16,False,False
2073,5,1.9.33,1,when an update makes an app OBSOLETE on a device to pay any kind of bills is atrocious.,Google Play,English,Neutral,General,True,2,2026-06-28 15:39:35,2026-06-29 03:42:29,False,False
2074,5,,1,"Hello. This app is cannot open anymore in my phone because of outdated. So, how to unlink the old device if I cannot open the apps? It's ridiculous. Please reply me ASAP soon",Google Play,English,Neutral,General,True,1,2026-06-28 14:34:27,2026-06-29 03:35:19,False,False
2075,5,,5,Good service,Google Play,English,Positive,General,True,0,2026-06-28 13:02:13,2026-06-29 03:31:07,True,False
2076,5,1.9.33,1,"really stupid, making old android obsolete! stupid decision!",Google Play,English,Neutral,General,True,2,2026-06-28 12:11:24,2026-06-29 03:42:22,False,False
2077,5,1.9.33,1,why suddenly it is not compatible with my fone???,Google Play,English,Neutral,General,True,2,2026-06-28 11:37:04,2026-06-29 03:42:12,False,False
2078,5,1.9.51,1,"semasa cimb click masih ada,segala urusan berjalan dengan lancar.tetapi dah masuk cimb octo yg ntah pa ntah merapu bagai.nak android 11 keatas.terus tak bpleh buat apa2.bodoh sangat yang buat apps tu.syok sendiri.tak fikirakn pengguna.warga b40 banyak yang tak mampu nak tukar tukar phone.mudahn je bankrap cimb lepas ni.macam lah tak dapt setting android 10 kebawah.move on dari cimb lepas ni.guna touch and go je lepas ni..",Google Play,English,Neutral,General,True,2,2026-06-28 08:39:44,2026-06-29 03:37:55,False,False
2079,5,,1,why cant open.. i always use in my this device huawei nova 5t,Google Play,English,Neutral,General,True,0,2026-06-28 06:59:44,2026-06-29 03:34:51,False,False
2080,5,,5,good,Google Play,English,Positive,General,True,0,2026-06-28 01:20:42,2026-06-29 03:30:51,True,False
1579,5,1.9.51,5,CIMB Clicks enables secure banking transactions with a clean and simple interface. Performance may slow during peak usage periods.,Google Play,English,Negative,General,True,1,2026-06-27 23:18:34,2026-06-29 03:53:05,True,True
2081,5,1.9.33,1,With the new updates. Now my phone no longer compatible to open this app. Well done.,Google Play,English,Neutral,General,True,1,2026-06-27 23:13:44,2026-06-29 03:51:31,False,False
1580,5,1.9.50,5,"Solid banking app. The biometric login works instantly, checking account balances takes two seconds, and approving SecureTAC transactions is totally seamless. The interface looks modern and clean compared to the old one. Definitely a smooth experience so far.",Google Play,English,Positive,General,True,1,2026-06-27 22:38:38,2026-06-29 03:53:02,True,False
2082,5,1.7.1,1,Using old phone cannot use it anymore lah aiyooo,Google Play,English,Neutral,General,True,1,2026-06-27 22:16:34,2026-06-29 03:51:38,False,False
2083,5,,5,"I've been using this CIMB app for daily banking like to check my account balance, make transaction also pay bills. Overall easy to use.",Google Play,English,Positive,General,True,1,2026-06-27 22:05:48,2026-06-27 07:20:43,True,False
2084,5,1.9.51,1,"Stupid secure tac, i need to change my password due to multiple failed logins? After changing my password to a new one, i need to accept it via SECURE TAC??? HELLO? I CAN'T EVEN LOG IN!!! make it impossible for me to do it on my own!! fix it so we can use our phone number as the 2nd option to receive the code/tac!! need to waste my time to go to the bank ahh??? STRESSSSSSS",Google Play,English,Negative,General,True,0,2026-06-27 20:01:36,2026-06-29 03:52:26,True,True
2085,5,1.9.0,4,for me it's ok good for ease of payment,Google Play,English,Positive,General,True,0,2026-06-27 18:40:16,2026-06-29 03:26:18,True,False
2086,5,,5,Best website,Google Play,English,Positive,General,True,0,2026-06-27 18:17:05,2026-06-29 03:26:13,True,False
2087,5,1.9.51,5,All in one trnsfer money easy to use and very useful ♥️,Google Play,English,Positive,General,True,1,2026-06-27 18:15:44,2026-06-29 03:26:07,True,False
2088,5,,1,Cimb Bank octo my very problem la,Google Play,English,Negative,General,True,1,2026-06-27 16:12:11,2026-06-29 03:25:22,False,True
2089,5,1.9.51,5,It is the main app to do CIMB transaction😊,Google Play,English,Neutral,General,True,0,2026-06-27 16:07:57,2026-06-29 03:24:58,False,False
2090,5,1.9.33,5,"heloo, can you make the app available on Android 10. Because my phone update can't upgrade to android 11 :(. since this is the only bank i have and use this really mean a lot to me if you could help :(",Google Play,English,Neutral,General,True,1,2026-06-27 16:00:51,2026-06-29 03:24:09,False,False
2091,5,1.9.33,1,"Suddenly the app cannot work due to phone being outdated. Focus too much on phone app while nothing for website. Should have an option for approval via website, rather than solely relying on phone app.",Google Play,English,Neutral,General,True,2,2026-06-27 14:36:50,2026-06-29 03:22:57,False,False
2092,5,1.9.33,2,it keep asking for updates and now it said my device are incompatible 😭 is my phone that old?,Google Play,English,Neutral,General,True,3,2026-06-27 13:48:07,2026-06-27 06:41:26,False,False
2093,5,,3,always force closed,Google Play,English,Neutral,General,True,1,2026-06-27 13:25:52,2026-06-27 07:16:15,False,False
2094,5,1.9.51,2,kenapa setiap Kali nak QR direct mesti tidak sukses .. mesti naik overlimit padahal baru 1st time Qr utk that day walaupon bayar utk rm10 Apps tu lain Kali bg mesra pelanggan .. kadang kami n x bawa banyak cash.,Google Play,English,Neutral,General,True,1,2026-06-27 13:18:47,2026-06-29 03:49:28,False,False
2095,5,,1,My CIMB apps is no longer can be used. I am having so much difficulty during these few weeks. It keeps asking me to update my Web browser to a new version. All my phone systems are up to date. Do CIMB expect me to get new phone? So much causing trouble. Why can't CIMB make their apps compatible to all.,Google Play,English,Neutral,General,True,2,2026-06-27 12:30:45,2026-06-29 03:48:55,False,False
2096,5,,1,your device isn't compatible with this version,Google Play,English,Neutral,General,True,1,2026-06-27 07:33:50,2026-06-27 07:54:37,False,False
2097,5,1.9.33,1,Forced to change new phone just to use the apps. Now I can't even open the app to setup account on new phone!!! Please see what other banks are doing for the convenience of their customers. Even using website transfer to TnG also need go tru the apps. Very troublesome. Changing my primary bank to others. Bye,Google Play,English,Neutral,General,True,2,2026-06-27 07:32:09,2026-06-27 07:56:39,False,False
2098,5,1.9.33,5,Why my device connot to update,Google Play,English,Neutral,General,True,0,2026-06-27 01:30:36,2026-06-27 07:53:36,False,False
1584,5,,5,fastest and responsive,Google Play,English,Positive,General,True,0,2026-06-27 00:38:03,2026-06-27 07:52:47,True,False
2099,5,1.9.51,1,Simply update and can't use in my phone,Google Play,English,Neutral,General,True,0,2026-06-27 00:02:13,2026-06-27 07:51:55,False,False
2100,5,1.9.51,1,"Very annoying, I have to reset the password if I have 2 failed attempts to enter the password. Even after resetting, it still make the same error. But when I tried to reset it again I have to wait for 12 hour cool down. This system is no benefit only waste of time and a hassle.",Google Play,English,Negative,General,True,0,2026-06-26 23:17:07,2026-06-27 07:50:34,False,True
1586,5,1.9.51,5,"Great banking app! Fast, secure, and very convenient for managing my finances.",Google Play,English,Positive,General,True,0,2026-06-26 22:36:23,2026-06-27 07:49:04,True,False
2101,5,1.9.50,5,good...easy to use,Google Play,English,Positive,General,True,0,2026-06-26 22:07:55,2026-06-27 07:57:17,True,False
2102,5,,1,how about people who can't afford to buy a new phone yet ? they will have problem with online transactions just because they can't download the apps because of some upgrade if their android version is 12 and below💆🏻‍♀️,Google Play,English,Negative,General,True,2,2026-06-26 21:53:07,2026-06-27 07:59:11,False,True
2103,5,1.9.33,2,2nd time not working on this phone,Google Play,English,Neutral,General,True,0,2026-06-26 21:51:26,2026-06-27 07:48:15,False,False
2104,5,1.9.51,1,cimb dah expired kt hp lama sbb android 10..x sempat nk log out dah xblh buka.. bila bt kat hp baru kena log out hp lama dulu.. masalahnya kat hp lama cimb dah x berfungsi.. mcm mana ni,Google Play,English,Neutral,General,True,3,2026-06-26 20:12:10,2026-06-27 07:46:19,False,False
2105,5,1.9.51,1,"This is stupid. Android version too old cannot update. Try to install it on new phone, the app says to update it on old phone, log in, remove the device first before they allow u to install it on new phone. U tell me how? Do also die, don't do also die. Please at least have the decency to leave the option open so that we can remove it from the old phone without having to update the app. Don't block it completely and leave us hanging.",Google Play,English,Neutral,General,True,4,2026-06-26 19:48:47,2026-06-27 07:45:43,False,False
2106,5,1.9.0,1,updates after updates with no improvements on loading time ..AND NOW ANDROID 12 USERS CANNOT USE THIS STUPID APP!!! MY MOM IS 70 YEARS OLD AND NOW SHE CANT USE AT ALL 😠😠😠. used to be a 1st class app now it's below a common app.dev do something.i know it's passing all the wirewalls and what not but it's snail slow 😡😡😡,Google Play,English,Negative,General,True,3,2026-06-26 19:44:43,2026-01-26 07:17:51,False,True
2107,5,1.9.33,2,"Look man, this is the only device my late father ever gave me, and I'm not ready to replace or upgrade it yet. The Android 11 requirement has put me in a really difficult situation. Please, just let me keep using this app",Google Play,English,Neutral,General,True,2,2026-06-26 18:20:44,2026-06-27 07:42:07,False,False
2108,5,1.9.33,1,stupid can used my phone now need an upgrade. they should make app that backwards os compatible,Google Play,English,Neutral,General,True,2,2026-06-26 17:30:11,2026-06-27 07:40:42,False,False
2109,5,1.9.32,1,"Not everyone are afford to buy a new phone again again and again, since android 10 no longer can support the apps,so I need to buy a new phone??? absurd!why no issue with other online banks except from yours? you made me stuck in TAC and QR since this is my main account!!!! Do something about that regardless the android 10 or what!!",Google Play,English,Negative,General,True,2,2026-06-26 15:50:43,2026-06-27 07:40:04,False,True
2110,5,1.9.51,1,kenapa susah sangat nak angkat bila customer call centre utk maklum masalah! Dalam masa 10 minit menunggu masih tidak respon. Bukan sekali dua cuba call. 10 Minit + 10 minit...+..+. 😪PLEASE TAKE ACTION!!!,Google Play,English,Neutral,General,True,2,2026-06-26 15:38:13,2026-06-27 07:39:07,False,False
2111,5,1.9.51,2,Hari ni.. Jumaat 26/6/26. 3 kali cuba bercakap dengan CS....Tapi tiga2 kali semua CS ckp putus. sebelum sambung dengan CS...kena layan suara dr mesin aja hampir 6 minit. Dan suara dr mesin tu elok aja pulak. Hampeh.,Google Play,English,Neutral,General,True,1,2026-06-26 15:37:05,2026-06-27 07:37:49,False,False
2112,5,1.9.51,5,"""UI Octo lawa & senang guna. Transfer DuitNow QR laju, takde sangkut. Jauh beza dari Clicks lama. 5 bintang!""",Google Play,English,Neutral,General,True,0,2026-06-26 14:09:02,2026-06-27 07:36:06,False,False
2113,5,,1,why app cimb octa my not support android 10.. why cimb sg and vn still can download.. can u solve the problem please... i cant use this app because of your update system.. android 10 cant use.. because of this i need to change phone....,Google Play,English,Negative,General,True,2,2026-06-26 13:26:27,2026-06-27 07:34:13,False,True
2114,5,1.9.33,3,takes a long time to get OTP,Google Play,English,Neutral,General,True,0,2026-06-26 13:21:54,2026-06-27 07:33:28,False,False
2115,5,1.9.33,5,👍,Google Play,English,Neutral,General,False,0,2026-06-26 13:04:56,,False,False
2116,5,,1,Old handphone didn't the support the new version of this apps . Not compatible . So disappointing,Google Play,English,Neutral,General,True,2,2026-06-26 12:12:27,2026-06-27 07:32:41,False,False
1593,5,,5,"""Saya berpuas hati dengan CIMB Clicks kerana ia selamat, stabil dan mempunyai ciri keselamatan yang baik untuk melindungi maklumat pengguna.""",Google Play,English,Neutral,General,True,0,2026-06-26 12:11:02,2026-06-27 07:28:48,False,False
2117,5,1.8.10,5,Saya pengguna HUAWEI MATE 30 Pro. Sekarang dah tak boleh pakai apps ni sebab ada updating dari app developer. Mohon bantuan.,Google Play,English,Neutral,General,True,0,2026-06-26 11:12:10,2026-06-27 07:28:25,False,False
2118,5,1.9.33,1,tidak mesra pelanggan,Google Play,English,Neutral,General,True,1,2026-06-26 11:11:23,2026-06-27 07:26:58,False,False
2119,5,1.9.51,1,paksa update tapi limitkan android versi..korang nak belanja aku phone baru ke apa??menyusahkan betul,Google Play,English,Neutral,General,True,2,2026-06-26 10:56:01,2026-06-27 07:24:51,False,False
2120,5,1.9.0,1,"why is your app not compatible to my phone? I thought your app is user friendly. you expect me to change to a new phone? is cimb sponsoring s new phone for me? pls don't make life difficult for senior citizens. despite your so called updated apps, still scammers can cheat us. I will shift to other bank.",Google Play,English,Neutral,General,True,1,2026-06-26 10:33:37,2026-06-27 07:23:26,False,False
2121,5,,1,i giving one star because of my phone can't support the new update until it can't open. how to make this easy to people who are dont like to change phone? i usually use it to check my balance or top up my wallet because of the new update i cant open up already the app. it make my life more difficult. please make sure the new update are suitable to everyone.,Google Play,English,Positive,General,True,1,2026-06-26 09:56:01,2026-06-27 07:22:24,True,False
2122,5,1.9.51,5,Tolong bagi support semua jenis Phone.. Cannot download ni.. Aku pakai Huawei,Google Play,English,Neutral,General,True,0,2026-06-26 09:34:58,2026-06-27 07:21:15,False,False
2123,5,1.9.33,1,update telefon baru boleh pakai,Google Play,English,Neutral,General,False,0,2026-06-26 06:16:45,,False,False
2124,5,1.9.33,1,Can't update latest version,Google Play,English,Neutral,General,True,0,2026-06-26 05:42:31,2026-06-27 07:18:57,False,False
2125,5,1.9.51,5,Good financial apps,Google Play,English,Positive,General,True,0,2026-06-26 05:21:10,2026-06-27 07:18:13,True,False
2126,5,,1,This is stupid.. A banking app does doesn't support older mobile OS..,Google Play,English,Neutral,General,True,0,2026-06-26 00:17:44,2026-06-27 07:17:48,False,False
1591,5,,5,"i love using CIMB OCTO because it easy, simple and very useful to me. im able to do any transaction without worry",Google Play,English,Positive,General,True,0,2026-06-25 23:15:19,2026-06-27 07:16:40,True,False
2127,5,,1,Bodoh,Google Play,English,Neutral,General,False,1,2026-06-25 22:29:46,,False,False
2128,5,,1,"serius la kene tukar phone baru semata2 nak guna apps ni??seharian susah hati sebab tiba2 dah tak boleh guna..dah satu hal kene pegi bank,kedai fon ingatkan nak kene repair sebab dah update software pun still tak boleh rupanya kene tukar phone? seriously 😒 nmpak komen di facebook yang suggest untuk lower kan transaction limit atau downgrade jelah ape2 servis tu untuk user os 10 dan below..pihak cimb takde ke yang boleh come out idea yang lebih baik macam mereka?",Google Play,English,Neutral,General,True,1,2026-06-25 22:23:09,2026-06-27 07:14:20,False,False
2129,5,,1,kenapa saya tak dapat update new version cimb ni?sedangakan dari dulu dah pakai apps ni tapi sekarang nak update tiba dia cakap tak dapat update kat hp ni?,Google Play,English,Neutral,General,True,0,2026-06-25 21:59:47,2026-06-27 07:11:05,False,False
2130,5,1.9.0,1,"Before this, the app works smoothly, but recently it updated and now it is not compatible with my phone anymore (Oppo A9 2020). Is there other choice other than buying new phone as my current phone work perfectly fine.",Google Play,English,Positive,General,True,0,2026-06-25 21:57:05,2026-06-27 07:10:22,True,False
2131,5,1.9.51,5,ok,Google Play,English,Neutral,General,True,0,2026-06-25 21:31:36,2026-06-27 07:08:33,False,False
2132,5,,5,"easy to use,secure and very helpful for daily banking",Google Play,English,Positive,General,True,0,2026-06-25 21:20:28,2026-06-27 07:07:24,True,False
2133,5,1.9.51,5,"I use this apps because I get scholarship, and very helpful",Google Play,English,Neutral,General,True,0,2026-06-25 20:42:44,2026-06-27 07:06:42,False,False
2134,5,,1,Many time reinstall the app the camera for id verification show black not able do ekyc. Already 3 days reinstall this app but result still sam.,Google Play,English,Neutral,General,True,0,2026-06-25 18:50:46,2026-06-27 07:00:24,False,False
2135,5,1.9.51,1,This app sucks I have been using this app on my phone for quite some number of years now suddenly I can't even use or download the app cause of their new stupid update with the os requirement of android 11 and above where mine is 10. Stupid. I can't even use it on my new phone straight away because I have to deactivate it on the app on my old phone an app i can no longer use or download btw and I'm forced to contact their snobby customer service. Absolute rubbish,Google Play,English,Neutral,General,True,3,2026-06-25 18:07:30,2026-06-27 06:57:35,False,False
2136,5,1.9.33,1,"At this current economy, getting a new phone is mostly not feasible action. The fact that this app requires Android 11 to run without alternative support for older phones makes things annoying for the older users. Please re-enable support for at least Android 10 at the very least, Please!",Google Play,English,Neutral,General,True,2,2026-06-25 17:52:31,2026-06-27 06:54:31,False,False
2137,5,1.9.0,5,good to everything,Google Play,English,Positive,General,True,0,2026-06-25 17:47:06,2026-06-27 06:52:54,True,False
2138,5,,5,Good,Google Play,English,Positive,General,True,0,2026-06-25 17:36:00,2026-06-27 06:52:32,True,False
2139,5,1.9.51,5,Memudahkan transaksi perbankan secara dalam talian. Antara muka yang baik dan proses transaksi yang lancar.,Google Play,English,Neutral,General,True,0,2026-06-25 17:25:05,2026-06-27 06:52:11,False,False
2140,5,1.9.33,1,This CIMB OCTO prompt msg said my apps outdated asking me to update but when I click update then it come out with my Device not supported the latest version??!!!!!! Then how? I have to keep buying new phone with latest software to support the apps????? This is making me inconvenient!!!,Google Play,English,Positive,General,True,1,2026-06-25 17:25:02,2026-06-27 06:51:48,True,False
2141,5,1.9.51,1,"I download CIMB on my tablet since on my old device refused to let me update for new version because i saw it need to be 'android 11/ios' it annoying because after i tried to login using my tablet instead the app still refused to let me login because the original account obviously in my old device, so it stuck there and it tells me that i need to remove new device login, and now you tell me, how am i suppose to do that now when the app itself won't let me use it anymore???",Google Play,English,Neutral,General,True,1,2026-06-25 16:30:19,2026-06-27 06:48:36,False,False
2142,5,,1,Cannot use it anymore as it not compatible with my device,Google Play,English,Neutral,General,True,1,2026-06-25 16:23:25,2026-06-27 06:45:52,False,False
2143,5,1.9.51,5,"The CIMB Bank app makes my daily banking easier. I can transfer money, check account balances and pay bills quickly without having to go to a branch. The app design is very modern and easy to understand. Every transaction is also processed smoothly and quickly. Overall, this application provides a very good experience and makes it easier for me to manage my finances every day.",Google Play,English,Positive,General,True,0,2026-06-25 15:02:40,2026-06-27 06:43:01,True,False
2144,5,1.9.33,1,"The apps now enforce user to change phone as the apps update and become not compatible to a number of device. Among all bank in Malaysia, only public bank and cimb not compatible for my phone but public bank provide workaround by provide physical token device while CIMB CS told me to change phone and no workaround provided. Im aware some bank have fall back workaround by using sms OTP but CIMB said no... Not user friendly.",Google Play,English,Neutral,General,True,2,2026-06-25 14:01:57,2026-06-27 06:40:38,False,False
2145,5,1.9.33,1,Pain. Forcing me to get a new phone. Seriously then how about people who want to change phones? Also when using a new phone it says go to old phone to disconnect and how foolish we can even access the app on the old phone. What a useless bank to be a preferred member off,Google Play,English,Neutral,General,True,2,2026-06-25 13:53:21,2026-06-24 05:17:59,False,False
2146,5,1.9.51,1,aku msuk kn ktlaluan/id btul tpi ckp salah...aku buat ktlaluan baru ttp tk dpt login jgk...apa lh mslh cimb ni,Google Play,English,Neutral,General,True,1,2026-06-25 13:43:58,2026-06-27 06:35:14,False,False
2147,5,,1,my phone can't download this app. I'm using Android phone,Google Play,English,Neutral,General,True,1,2026-06-25 13:43:01,2026-06-27 06:32:03,False,False
1600,5,1.9.51,5,CIMB Clicks offer secure and convenient online banking services. The app allows me to manage my finances efficiently wherever I am.,Google Play,English,Positive,General,True,0,2026-06-25 13:21:33,2026-06-27 06:30:20,True,False
2148,5,,1,Cant download on huawei nova7. suck,Google Play,English,Neutral,General,True,2,2026-06-25 13:10:41,2026-06-27 06:29:35,False,False
2149,5,,1,Huawei nova 7se cannot installing this devices after update,Google Play,English,Neutral,General,True,2,2026-06-25 12:43:15,2026-06-27 06:22:40,False,False
2150,5,1.9.33,1,"why suddenly block android 10 phone? how do I pay stuff, I don't carry money? why did you do this thing.",Google Play,English,Neutral,General,True,2,2026-06-25 11:48:24,2026-06-27 06:20:47,False,False
2151,5,,1,The latest version of the CIMB Octo app v1.9.51 is not backward compatible with Huawei Mate20 with EMUI v12. This is not acceptable.,Google Play,English,Neutral,General,True,2,2026-06-25 11:20:49,2026-06-27 06:17:45,False,False
2152,5,1.9.51,1,slow,Google Play,English,Negative,General,True,1,2026-06-25 11:04:51,2026-06-27 06:11:54,False,True
