review_user_id,app_id,app_version,rating,review_text,review_source,language,sentiment,complaint_category,developer_reply,thumbs_up_count,review_date,developer_reply_date,positive_review,negative_review
2261,5,1.9.0,4,problem app,Google Play,English,Negative,General,True,0,2026-06-23 08:35:33,2026-06-24 04:31:06,False,True
2262,5,1.9.33,5,👍,Google Play,English,Neutral,General,True,0,2026-06-23 08:29:37,2026-06-24 04:18:35,False,False
2263,5,1.9.33,5,good,Google Play,English,Positive,General,True,0,2026-06-23 07:49:44,2026-06-24 04:00:58,True,False
2264,5,,1,Suddenly my phone can't use this app. Do you think everybody have money to buy latest phone juat so people can use your app. Worst service ever,Google Play,English,Negative,General,True,0,2026-06-23 05:58:56,2026-06-24 04:00:26,False,True
2265,5,1.9.33,2,"I have been using this app since my hubby went back to Australia, I can pay the bills n checked my account..etc. Suddenly comes the biometric system, only Android phone 11 onwards can support all this new technology...my phone for 6-7 years is out of it. Now I am force to buy a new handphone...I am very disappointed with all this issues. Very upsetting.....",Google Play,English,Negative,General,True,1,2026-06-23 03:07:54,2026-06-24 03:45:22,False,True
2266,5,,5,tak boleh download,Google Play,English,Neutral,General,True,1,2026-06-23 01:54:43,2026-06-24 03:38:01,False,False
2267,5,1.9.33,1,"literally can't update anymore just because I have an older device. I don't think a banking application should need newer devices just to be accessible. Not saying you shouldn't update your app, I'm saying you should still make them usable even for older devices.",Google Play,English,Neutral,General,True,1,2026-06-23 01:41:32,2026-06-24 03:37:18,False,False
2268,5,,1,apps cannot support my phone,Google Play,English,Neutral,General,True,1,2026-06-23 01:32:50,2026-06-24 03:28:01,False,False
1620,5,1.9.51,5,Great functionality and smooth performance. Highly recommended!,Google Play,English,Positive,General,True,1,2026-06-23 01:18:31,2026-06-24 03:12:31,True,False
2269,5,,1,I cant open the app. I ve been using it for years. suddenly it said app is not compatible with my phone. my phone is using Android 11. where minimum version req is ver 10. They asked to update . but in google play no option for update. I got fedup with this app. I cant do transfer. cant do QR n cant check account details. Cimb octo pls do something. not to make people difficult,Google Play,English,Neutral,General,True,0,2026-06-23 01:07:13,2026-06-24 03:11:23,False,False
2270,5,1.9.51,2,Suddenly it says my device is not compatible with this version. I've been using this app for so long till now. Can help to adjust the system requirements? My device is up to date n I've tried to clear cache n data but it still doesn't work. I can't even open this app on other device coz it's still on this device but I can't open it.,Google Play,English,Neutral,General,True,3,2026-06-23 00:46:07,2026-06-24 03:08:58,False,False
2271,5,1.9.51,1,lousy.. cant do KYC within the app even with a valid Malaysian IC..,Google Play,English,Neutral,General,True,0,2026-06-23 00:42:01,2026-06-24 03:07:06,False,False
2272,5,,1,"what happened to this App.? Keep Notified for an Update, but there is no such Update available. I am unable to use this completely today, and this App no longer available in Apps Store. please do something",Google Play,English,Neutral,General,True,0,2026-06-23 00:29:02,2026-06-24 03:00:24,False,False
2273,5,1.9.33,5,"I encountered good experiences and services in phone banking,keep it ups!",Google Play,English,Positive,General,True,0,2026-06-23 00:06:39,2026-06-24 02:58:52,True,False
2274,5,1.9.51,1,"My main phone Poco F1 no longer supported this apps. When I install this on another phone, they want me to open this apps to manage device when It no longer can't open.",Google Play,English,Neutral,General,True,0,2026-06-22 23:57:41,2026-06-24 02:32:34,False,False
2275,5,,1,"It suddenly says its unavailable for my device now, does anyone know how to fix this?",Google Play,English,Neutral,General,True,1,2026-06-22 23:43:15,2026-06-24 01:59:49,False,False
2047,5,1.9.33,1,I can't log in because your app is no longer compatible with my Android phone. Do you seriously expect everyone to buy a new phone just because you've updated the app? This is ridiculous.,Google Play,English,Neutral,General,True,1,2026-06-22 23:30:57,2026-06-24 01:59:20,False,False
2276,5,1.8.10,1,suruh updated yang latest dekat appstore tapi xboleh,Google Play,English,Neutral,General,True,1,2026-06-22 23:19:20,2026-06-24 01:53:31,False,False
2277,5,,1,Its no longer work on older android 10! My father cannot longer use cimb octo on his old phone after update latest version. Spend 2 hours of trying alternative playstore and its all the same result. You don't even inform users about this! Such a bad services! What if he faced emergency and need money!? He cannot even pay his bills now!,Google Play,English,Negative,General,True,1,2026-06-22 23:14:59,2026-06-24 01:51:10,False,True
2278,5,1.7.1,1,"suddenly my cimb octo app on my Samsung cannot be open, tried to uninstall but cannot install back! Playstation said app is not compatible with my device Samsung S20 plus. I really need to use my account but this is really frustrating. please solve this issue for me ASAP! I",Google Play,English,Negative,General,True,1,2026-06-22 22:51:52,2026-06-24 01:47:26,False,True
2279,5,1.9.0,1,tak dapat untuk update the apps,Google Play,English,Neutral,General,True,1,2026-06-22 22:36:47,2026-06-24 01:43:41,False,False
2280,5,1.8.6,1,my device isn't compatible with this version,Google Play,English,Neutral,General,True,2,2026-06-22 22:33:44,2026-06-24 01:40:52,False,False
2281,5,1.8.10,1,This updated version is not compatible with my phone. Now am having a problem to approve TAC.,Google Play,English,Negative,General,True,1,2026-06-22 22:27:55,2026-06-24 01:37:54,False,True
2282,5,1.9.33,5,Good,Google Play,English,Positive,General,True,0,2026-06-22 22:09:15,2026-06-24 01:35:03,True,False
2283,5,1.9.33,1,Why should have the banking app's minimum requirement are Android 11? It would make all the users who can't afford better smartphone having difficulties to install the app.,Google Play,English,Neutral,General,True,1,2026-06-22 21:39:53,2026-06-24 01:28:49,False,False
2284,5,,1,This apps for rich people. Some people cannot use this apps because phone not suitable for this version.,Google Play,English,Neutral,General,True,0,2026-06-22 21:39:40,2026-06-24 01:24:14,False,False
2285,5,1.9.0,1,I cannot use the app anymore. Useless,Google Play,English,Neutral,General,True,1,2026-06-22 21:09:45,2026-06-24 01:15:56,False,False
2286,5,1.9.0,1,1,Google Play,English,Neutral,General,True,0,2026-06-22 20:58:08,2026-06-24 01:10:56,False,False
2287,5,1.9.51,1,tak boleh download ! menyusahkan orang !,Google Play,English,Neutral,General,True,1,2026-06-22 20:57:03,2026-06-24 01:09:22,False,False
2288,5,,1,bodoh la cimb nie... apps xlh support kt fon pulak... jadi kje pulak kne g bank...,Google Play,English,Neutral,General,True,0,2026-06-22 20:34:03,2026-06-24 01:06:47,False,False
2289,5,1.9.0,1,phone version sedia ada tak support. takkan perlu tukar phone baru semata nak update apps? sekarang takleh buat any transactions.,Google Play,English,Neutral,General,True,0,2026-06-22 20:33:27,2026-06-24 01:04:15,False,False
2290,5,1.9.33,1,I CAN'T update the phone system on my Huawei mate 20x. So now I can't use the apps. Pls advice.,Google Play,English,Neutral,General,True,0,2026-06-22 20:26:59,2024-10-12 05:18:54,False,False
2291,5,,1,"Help me, I can't use this apps because not support new version",Google Play,English,Neutral,General,True,1,2026-06-22 19:59:21,2026-06-24 01:01:49,False,False
2292,5,,1,I can't use or reinstall the app. why?,Google Play,English,Neutral,General,True,0,2026-06-22 19:50:39,2026-06-24 01:00:24,False,False
2293,5,,1,"Saya menggunakan OPPO A5 2020 (CPH1931), Android 10, ColorOS 7.1. Sebelum ini CIMB OCTO berfungsi dengan baik. Selepas aplikasi meminta kemas kini, saya uninstall kerana kemas kini gagal. Kini Google Play Store memaparkan ""Your device isn't compatible with this version"", jadi saya tidak boleh memasang semula aplikasi. Telefon saya tidak pernah di-root dan Play Protect menunjukkan ""Device is certified"". Mohon pihak CIMB semak isu keserasian ini kerana saya tidak dapat menggunakan aplikasi lagi.",Google Play,English,Neutral,General,True,0,2026-06-22 19:21:05,2026-06-24 00:53:50,False,False
2294,5,1.9.33,1,phone lama.. tak dapat nak update sebab version tak support.. nak tukar phone baru x berkemampuan.. ada tak cara lain untuk mudahkan pengguna macam saya..,Google Play,English,Neutral,General,True,0,2026-06-22 19:20:54,2026-06-24 00:53:02,False,False
2295,5,1.8.10,1,I am not able to download it. It force me to buy a newer version phone just to access to the app. Very unhappy about this,Google Play,English,Neutral,General,True,1,2026-06-22 19:10:48,2026-06-24 00:51:28,False,False
2296,5,,1,cannot download the cimb octo my apps,Google Play,English,Neutral,General,True,1,2026-06-22 18:57:17,2026-06-24 00:49:46,False,False
2297,5,1.9.33,5,good 👍,Google Play,English,Positive,General,True,0,2026-06-22 18:51:29,2026-06-24 00:47:32,True,False
2298,5,1.9.33,3,the app is good even though there's some issues sometime.. and I can't update this app as it said that this app are not compatible with my device anymore.. can you please rectify it? if it's about the os its already the latest version of it and it's android 10.,Google Play,English,Negative,General,True,1,2026-06-22 18:48:03,2026-06-24 00:46:52,True,True
2299,5,,1,Laaa... Whats wrong this app? Suddenly it said my phone not compatible.. N now i cant even used my cimb!!!!!!,Google Play,English,Neutral,General,True,1,2026-06-22 18:46:16,2026-06-24 00:45:53,False,False
2300,5,,1,was able to use it.. for a few years but now i can't use it due to device incompatible been using the same device all those years Edit: add support for android 10 please,Google Play,English,Neutral,General,True,1,2026-06-22 18:17:37,2026-06-24 00:43:38,False,False
2301,5,,4,Good,Google Play,English,Positive,General,True,1,2026-06-22 18:15:19,2026-06-24 00:42:05,True,False
2302,5,1.9.51,1,Very slow after update the app,Google Play,English,Negative,General,True,1,2026-06-22 18:07:11,2026-06-24 00:40:36,False,True
77,5,1.9.0,1,Kurang memuaskan,Google Play,English,Neutral,General,True,1,2026-06-22 17:43:56,2026-06-24 00:19:53,False,False
2303,5,,1,ok,Google Play,English,Neutral,General,True,1,2026-06-22 17:26:18,2026-06-24 00:18:20,False,False
2304,5,,5,good,Google Play,English,Positive,General,True,0,2026-06-22 17:21:52,2026-06-24 00:17:56,True,False
2305,5,,5,great apps but too much maintenance & error.,Google Play,English,Negative,General,True,0,2026-06-22 17:19:42,2026-06-23 22:35:37,True,True
2306,5,1.9.33,1,cannot update and open as the app are not compatible for my device now..please help.,Google Play,English,Neutral,General,True,1,2026-06-22 17:05:26,2026-06-23 22:32:11,False,False
2307,5,1.9.33,5,This app is good,Google Play,English,Positive,General,True,0,2026-06-22 17:04:30,2026-06-23 22:30:58,True,False
2308,5,1.9.33,5,good job,Google Play,English,Positive,General,True,0,2026-06-22 16:54:41,2026-06-23 22:20:49,True,False
2309,5,,1,why i cannot access my CIMB??? is it becouse im using older handphone?,Google Play,English,Neutral,General,True,1,2026-06-22 16:36:07,2026-06-23 22:19:48,False,False
2310,5,1.9.33,1,"bodohhhh,,,menyusahkan orang jaaa",Google Play,English,Neutral,General,True,1,2026-06-22 16:33:02,2026-06-23 21:48:34,False,False
2311,5,,5,good app,Google Play,English,Positive,General,True,0,2026-06-22 16:12:07,2026-06-23 21:47:53,True,False
2312,5,1.9.33,5,good apps,Google Play,English,Positive,General,True,0,2026-06-22 15:10:08,2026-06-23 21:40:25,True,False
2313,5,1.9.33,5,Giid,Google Play,English,Neutral,General,False,0,2026-06-22 14:59:04,,False,False
2314,5,1.9.33,5,Good,Google Play,English,Positive,General,True,0,2026-06-22 14:43:31,2026-06-23 21:37:22,True,False
2315,5,1.9.33,5,straightforward and convenient,Google Play,English,Positive,General,True,0,2026-06-22 14:32:00,2026-06-23 21:35:57,True,False
1623,5,,5,"Highly intuitive navigation makes managing my finances effortless. Security measures feel extremely robust, and bill payments are processed in seconds.",Google Play,English,Neutral,General,True,0,2026-06-22 13:48:44,2026-06-23 21:35:35,False,False
2316,5,1.9.51,1,veryyy sloww and problem always,Google Play,English,Negative,General,True,0,2026-06-22 13:18:48,2026-06-23 21:35:07,False,True
2317,5,1.9.51,1,can't even get through the upload id part. it's my actual id from the government but it's saying invalid,Google Play,English,Neutral,General,True,0,2026-06-22 11:33:40,2026-06-23 21:30:24,False,False
2318,5,1.9.51,3,cimb octo apps xBlh guna,Google Play,English,Neutral,General,True,1,2026-06-22 10:09:14,2026-06-23 21:28:30,False,False
2319,5,1.9.33,1,can't getting install,Google Play,English,Neutral,General,True,1,2026-06-22 09:54:48,2026-06-23 21:26:51,False,False
1624,5,1.9.51,5,Easy way to do transfers. Just one click,Google Play,English,Positive,General,True,0,2026-06-22 08:35:41,2026-06-23 21:25:48,True,False
2320,5,1.9.0,1,I have older phone and i cant update the app. Can i still use this apps?,Google Play,English,Neutral,General,True,1,2026-06-22 01:54:21,2026-06-23 06:55:27,False,False
2321,5,1.9.51,1,The cimb just blocks any transaction just because they change the account type from Petronas Saver to normal account due to uncollected debit card. I didn't request this account type change. It brings me difficulties in paying housing loan and credit card debt. It is a direct violation of BNM Fair treatment of Financial Consumers guidelines. This forced me to take half day leave to cross from Singapore to Malaysia and transport cost to settle this issue.,Google Play,English,Negative,General,True,0,2026-06-22 01:27:53,2026-06-22 01:21:39,False,True
41,5,1.9.51,5,"Overall Details Rating: 82% — cleaner and more modern than old-school banking apps, but still not “perfect stable” level.",Google Play,English,Neutral,General,True,3,2026-06-21 21:53:47,2025-08-19 04:56:12,False,False
2322,5,1.9.33,5,updaye for what,Google Play,English,Neutral,General,True,0,2026-06-21 21:30:47,2026-06-22 01:20:28,False,False
1625,5,1.9.51,5,bank app..friendy user for make any payment,Google Play,English,Neutral,General,True,0,2026-06-21 19:59:20,2026-06-22 01:20:54,False,False
1626,5,,5,user friendly and support international transaction,Google Play,English,Neutral,General,True,0,2026-06-21 18:06:25,2026-06-22 01:21:15,False,False
2323,5,1.9.50,5,CIMB Clicks is an efficient and practical banking app that makes everyday financial management much easier and more convenient.,Google Play,English,Positive,General,True,1,2026-06-21 15:30:56,2026-06-22 01:21:50,True,False
2324,5,,1,"Well apparently, my android is no longer compatible with the new update so i can't use it anymore or reinstall it. And since i can't afford to buy myself a new phone, so i'll just switch banks. Thanks.",Google Play,English,Neutral,General,True,1,2026-06-21 15:13:24,2026-06-22 01:16:18,False,False
2325,5,,1,masalahnya login dan selalu block. dah cuba berapa kali password mesti tak boleh.,Google Play,English,Neutral,General,True,0,2026-06-21 14:24:05,2026-06-22 01:17:35,False,False
2326,5,1.9.33,1,"Stupid apps, do you think everyone rich can buy new phone every year? Why can't you make the app compatible with older phone version? Pakyuuuu..",Google Play,English,Neutral,General,True,3,2026-06-21 11:36:41,2024-04-17 03:23:28,False,False
2327,5,1.9.0,5,Cimb octo is very helpful for me,Google Play,English,Neutral,General,True,0,2026-06-21 10:28:51,2026-06-22 01:19:28,False,False
2328,5,,5,nice,Google Play,English,Neutral,General,True,0,2026-06-21 08:45:11,2026-06-22 01:19:38,False,False
2329,5,,5,good bank,Google Play,English,Positive,General,True,0,2026-06-20 21:16:21,2026-06-22 01:13:43,True,False
561,5,1.9.33,5,I like it👍 easy to use.,Google Play,English,Positive,General,True,0,2026-06-20 18:33:38,2026-06-22 01:14:41,True,False
2330,5,1.9.50,1,menyusahkan. suruh verify ic last2 xdpt baca ic org. kita pulak yg kena pegi bank.,Google Play,English,Neutral,General,True,0,2026-06-20 17:18:28,2026-06-22 01:15:22,False,False
2331,5,1.9.51,4,Very convenient to use,Google Play,English,Positive,General,True,1,2026-06-20 17:05:53,2026-06-22 01:15:33,True,False
2332,5,1.9.33,5,Faster,Google Play,English,Positive,General,True,0,2026-06-20 16:53:31,2026-06-22 00:25:30,True,False
2333,5,1.9.51,5,getting better for daily use,Google Play,English,Neutral,General,True,0,2026-06-20 16:48:07,2026-06-22 00:25:43,False,False
2334,5,,1,Cant update on my phone dunno why hurmm,Google Play,English,Neutral,General,True,0,2026-06-20 15:45:16,2026-06-22 00:26:23,False,False
2335,5,1.9.51,1,I forgot my password and tried to reset it. Done filling all the needed info in and then I was required to enter a TAC and the TAC is sent through the app! And in order for me to view the TAC number sent through push notification I need to login to the app?? Which I can't because I forgot my password?? How am I supposed to view the TAC number when I can't even login because I forgot my password hence why I needed to reset it in the first place? What kind of roundabout security is this??,Google Play,English,Neutral,General,True,0,2026-06-20 15:34:34,2026-06-22 00:27:40,False,False
2336,5,1.9.0,5,easy to use..user friendly and QR area are easy to scan.,Google Play,English,Positive,General,True,0,2026-06-20 12:14:19,2026-06-22 00:29:29,True,False
2337,5,1.9.33,1,"kenapa app CIMB octo my saya dia tulis "" this is no longer compatible with your device"" . tak boleh nak buka dari PlayStore... app ini tak support phone saya",Google Play,English,Neutral,General,True,1,2026-06-20 09:52:11,2026-06-22 00:14:42,False,False
2337,5,,1,harap pihak CIMB dapat ubah semula sistem devices semua phone... ini phone lama tak dapat nak guna app tersebut...,Google Play,English,Neutral,General,True,1,2026-06-20 09:51:27,2026-06-22 00:21:58,False,False
1638,5,1.9.51,5,"Stable mobile banking app, easy to do transfers, bills, and check balances anytime.",Google Play,English,Positive,General,True,0,2026-06-20 08:47:21,2026-06-22 00:22:31,True,False
2338,5,1.9.33,4,"Hi, the app keeps asking me to update saying its no longer compatible with my device... But my device is updated on the latest software... When I go to Google Play.. I can't update...",Google Play,English,Neutral,General,True,1,2026-06-20 08:17:42,2026-06-22 00:23:47,False,False
2339,5,1.9.51,1,tak boleh nak tambah nilai kenape eh,Google Play,English,Neutral,General,True,0,2026-06-20 07:31:10,2026-06-22 00:24:43,False,False
1641,5,1.9.50,5,"Secure with OCTA, transfers are fast. Lots of CIMB card promos right in the app. Easy to manage cards - block, set limits, all can be done.",Google Play,English,Positive,General,True,1,2026-06-20 00:59:13,2026-06-20 05:18:18,True,False
2340,5,1.9.33,5,i love this app,Google Play,English,Positive,General,True,0,2026-06-19 21:23:31,2026-06-20 05:17:50,True,False
2341,5,1.9.33,5,Good app,Google Play,English,Positive,General,True,1,2026-06-19 20:01:23,2024-07-03 06:02:12,True,False
1647,5,1.9.0,5,"Memang puas hati guna CIMB Bank. Semak baki, transfer duit dan bayar bil semuanya cepat serta mudah. Sangat disyorkan",Google Play,English,Neutral,General,True,1,2026-06-19 16:16:48,2026-06-20 05:15:51,False,False
2342,5,1.9.33,1,"new updates is the worse update, i been using this app for years now they want me to change my phone so i can use online transactions? why don't just stick with android 10 and above? you think everyone is rich person who can buy phone every single month?",Google Play,English,Neutral,General,True,3,2026-06-19 15:29:31,2026-06-20 05:16:45,False,False
2343,5,1.9.50,5,"very seeelllllllowwwwwww lately. what happen cimb?. you are still my favorite....kemonnnnnn....19 jun 2026, dah ok....i give 5 star back...good jobbb team",Google Play,English,Positive,General,True,0,2026-06-19 10:39:48,2026-06-18 03:36:38,True,False
1648,5,1.9.50,5,I used its for many years.. I love this app very much.. Its very easy tu used,Google Play,English,Positive,General,True,0,2026-06-19 07:54:08,2026-06-20 05:16:18,True,False
1649,5,,5,okayy forr applicationn bank 🔥,Google Play,English,Neutral,General,False,0,2026-06-19 03:50:39,,False,False
1650,5,1.9.50,5,"Cimb bank is a reliable banking app for managing accounts, transfers and daily finances easily.",Google Play,English,Neutral,General,False,1,2026-06-19 00:04:56,,False,False
2344,5,1.9.50,5,Convenient banking app with fast transactions and user-friendly design. Very helpful for daily banking.,Google Play,English,Positive,General,False,2,2026-06-18 21:13:31,,True,False
97,5,1.9.50,5,"The app provides convenient access to banking services and makes daily transactions easier to manage. Overall, the experience has been smooth.",Google Play,English,Positive,General,False,1,2026-06-18 20:53:10,,True,False
1656,5,1.9.50,5,"senang boleh transfer dengan kawan"" dgn family",Google Play,English,Neutral,General,False,0,2026-06-18 19:37:49,,False,False
1657,5,1.9.50,5,"very easier to use, for online payment and others. very good 👍🏻",Google Play,English,Positive,General,False,1,2026-06-18 18:44:48,,True,False
1659,5,1.9.33,5,"“Overall, CIMB Clicks is a practical and efficient mobile banking app that helps users manage their money anytime and anywhere with ease.”",Google Play,English,Neutral,General,False,0,2026-06-18 14:18:23,,False,False
2345,5,1.9.50,2,Kenapa setiap kali scan QR pertama kali mesti keypad tak keluar. Kena 2-3 kali baru keluar. Ada masa tak keluar langsung keypad. Masalah device ke masalah app....kalau berterusan bole kena uninstall ni...,Google Play,English,Neutral,General,False,0,2026-06-18 13:24:48,,False,False
1661,5,1.9.0,5,very good this app . transfer money very faster,Google Play,English,Positive,General,False,0,2026-06-18 11:46:44,,True,False
1664,5,1.9.50,5,"Great banking app with a smooth interface, fast transactions, and useful features. Easy to use and highly recommended!",Google Play,English,Positive,General,False,0,2026-06-18 07:58:08,,True,False
2346,5,1.9.50,1,qr scan kind a slow to appear,Google Play,English,Negative,General,False,0,2026-06-18 07:45:20,,False,True
2347,5,1.9.50,5,have been using cimb as my daily transaction. I'm satisfied with the service especially for the oversea transfer. it takes 2 day only for it to success.,Google Play,English,Neutral,General,True,1,2026-06-18 01:33:42,2026-06-18 03:38:00,False,False
2348,5,1.9.50,5,"The user interface for CIMB Banking App is simple and it makes transactions fast and effective. Usually, payments and transactions happen smoothly without any problem. Maintenance done on weekly basis one time only.It is different from other bank apps whereby from 12 am, transaction cannot be made, but not for CIMB Banking.",Google Play,English,Negative,General,True,4,2026-06-18 00:36:25,2026-06-18 03:37:53,True,True
1668,5,1.9.50,5,nice apps,Google Play,English,Neutral,General,True,0,2026-06-17 19:43:19,2026-06-18 03:37:45,False,False
1669,5,1.9.50,5,cimb very useful application for nowadays u can finance very easy way,Google Play,English,Positive,General,True,0,2026-06-17 18:29:58,2026-06-18 03:37:40,True,False
1676,5,1.9.50,5,"CIMB Clicks remains one of the best and most reliable mobile banking apps in Malaysia and Southeast Asia in 2026. It delivers fast, secure, and comprehensive banking services that make managing money effortless and convenient right from your phone.",Google Play,English,Positive,General,False,0,2026-06-17 15:04:38,,True,False
1677,5,,5,"CIMB Bank app is a convenient and secure mobile banking platform. It makes it easy to check balances, transfer money, and pay bills anytime. The interface is simple and user-friendly, and transactions are generally fast and reliable.",Google Play,English,Positive,General,False,0,2026-06-17 14:16:53,,True,False
2349,5,1.9.50,1,lag af,Google Play,English,Neutral,General,True,0,2026-06-17 09:52:15,2026-06-18 03:36:42,False,False
1681,5,1.9.50,5,"Cimb bank,it is really helpful and stress free digital banking. It is also good security measures especially against fraud.",Google Play,English,Positive,General,True,1,2026-06-17 01:39:50,2026-06-18 03:36:14,True,False
2350,5,1.9.33,5,easy and fast,Google Play,English,Positive,General,True,0,2026-06-16 18:43:30,2026-06-18 03:35:54,True,False
2351,5,1.9.33,2,can you stop the pop up when I'm trying to pay? it's so annoying,Google Play,English,Neutral,General,True,0,2026-06-16 14:05:37,2026-06-18 03:34:29,False,False
2352,5,1.9.50,3,"TAC request problem /bug. When u request then link to octo or cimbclicks web, freeze on the page cant even proceed on the approved button",Google Play,English,Negative,General,True,0,2026-06-16 08:41:40,2026-06-18 03:35:19,False,True
1832,5,1.7.2,1,boleh tak stop bg iklan sebelum log in ? mcm bodoh kau taw.,Google Play,English,Neutral,General,True,0,2026-06-16 08:21:49,2026-06-18 03:34:42,False,False
2353,5,1.9.33,5,good,Google Play,English,Positive,General,True,0,2026-06-16 02:16:23,2026-06-18 03:33:47,True,False
1684,5,1.9.33,5,Transfer money become easy,Google Play,English,Positive,General,True,0,2026-06-16 01:49:31,2026-06-18 03:33:42,True,False
2354,5,1.9.33,1,App crashes. Good god.,Google Play,English,Negative,General,True,1,2026-06-16 00:14:50,2026-06-18 03:32:58,True,True
2355,5,1.9.33,5,Long Time with this bank,Google Play,English,Neutral,General,True,0,2026-06-15 22:30:15,2026-06-18 03:33:17,False,False
2356,5,1.9.50,1,always maintenance,Google Play,English,Neutral,General,True,0,2026-06-15 21:21:06,2026-06-18 03:32:50,False,False
