review_user_id,app_id,app_version,rating,review_text,review_source,language,sentiment,complaint_category,developer_reply,thumbs_up_count,review_date,developer_reply_date,positive_review,negative_review
1488,4,,5,senang untuk simpanan duit tabungn,Google Play,English,Neutral,None,False,0,2026-07-05 21:13:57,,False,False
1489,4,0.9.47,5,MONEY 🤑🤑🤑🤑💰💰💰💰,Google Play,English,Neutral,None,False,0,2026-07-05 20:48:17,,False,False
1490,4,0.9.47,2,notification sometimes got sometimes not. how I know If I already received and make payment. everytime the notification came after 3 or 4 hour,Google Play,English,Neutral,None,False,0,2026-07-05 20:36:05,,False,False
1491,4,,5,"Convenient, secure, and reliable banking app.",Google Play,English,Positive,None,False,0,2026-07-05 18:27:00,,True,False
1492,4,0.9.47,1,What happen to this app? Just 1 time per day only i can share transaction receipt? What's going on?,Google Play,English,Neutral,None,False,0,2026-07-05 16:57:45,,False,False
1493,4,0.9.47,5,"Managing personal finances is completely effortless with this updated banking software. The biological biometric login acts swiftly, and completing QR payments at local merchant stalls takes just a fraction of a second. The account dashboard displays balances cleanly, making it very straightforward to keep a close eye on monthly expenditures.",Google Play,English,Neutral,None,False,0,2026-07-05 16:04:03,,False,False
1494,4,0.9.47,3,"Too tight security and you will push customers away. a simple screenshot of my history is disabled. I will slowly phase out from MBB to CIMB, goodbye",Google Play,English,Negative,Performance,False,0,2026-07-05 15:16:58,,True,True
1495,4,0.9.47,2,ada problem? asyik system down ja nie.... susah nk pkai .huhu... mohon diperbaiki... dari minggu lepas nie,Google Play,English,Negative,Other,False,0,2026-07-05 13:22:50,,False,True
1496,4,0.9.47,1,apps got problem??? Maybank please check it that my apps can't use for transfer transaction.,Google Play,English,Negative,Transfer Issues,False,0,2026-07-05 10:11:41,,False,True
1497,4,,5,Good,Google Play,English,Positive,None,False,0,2026-07-05 01:10:38,,True,False
1498,4,0.9.47,3,"There are a lot of problems with the online system, for example, if you don't pay the bills, you can't pay the bills Can't let go.",Google Play,English,Negative,Payment Issues,False,0,2026-07-04 11:18:01,,False,True
915,4,0.9.47,4,Aplikasi bagus. Tapi boleh fix app? Late respond aplikasinya.,Google Play,English,Neutral,None,False,0,2026-07-04 09:28:04,,False,False
1499,4,0.9.47,5,nice,Google Play,English,Neutral,None,False,0,2026-07-03 21:28:18,,False,False
1500,4,0.9.47,4,good,Google Play,English,Positive,None,False,0,2026-07-03 19:05:19,,True,False
1501,4,0.9.47,1,kenapa MAE tak boleh guna,Google Play,English,Neutral,None,False,0,2026-07-03 16:53:14,,False,False
1502,4,0.9.47,5,Safe and convenient banking app. Managing my finances and making transfers is simple and efficient.,Google Play,English,Positive,None,False,0,2026-07-03 14:26:47,,True,False
1503,4,0.9.47,5,Npa x dpt notis.. Perbayar.. Bil.. Shopper.. ... Alhamdulillah maybank sudah tolong..,Google Play,English,Neutral,None,True,0,2026-07-03 11:13:23,2026-06-29 16:09:03,False,False
1504,4,0.9.47,5,best,Google Play,English,Positive,None,False,0,2026-07-03 10:54:46,,True,False
1505,4,0.9.47,1,can't open app,Google Play,English,Neutral,None,False,0,2026-07-03 09:07:27,,False,False
1506,4,0.9.47,1,"DUIT SAYA DIDALAM MAE TIDAK BISA DIAMBIL,DIKARENAKAN AKUN E WALLET SAYA TELAH DIBLOKIR TIDAK TAU SALAHNYA DIMANA TIBA TIBA AKUN TIDAK BISA DIGUNAKAN KEMBALI",Google Play,English,Neutral,None,True,0,2026-07-03 06:46:34,2026-07-05 17:54:30,False,False
1507,4,0.9.47,5,Easy to use Smooth app not heavy when opening the app fast and easy to make online payments and QR payments 🥰,Google Play,English,Positive,None,True,0,2026-07-02 21:44:07,2026-07-05 17:51:16,True,False
1508,4,0.9.47,5,"The Maybank2u app is reliable, secure, and easy to use. It makes banking convenient with smooth fund transfers, bill payments, and account management. The interface is user-friendly, and transactions are completed quickly.",Google Play,English,Positive,None,True,0,2026-07-02 21:06:40,2026-07-05 17:50:17,True,False
1509,4,,5,"Very reliable banking app. Transfers, bill payments, and account management are quick and convenient.",Google Play,English,Positive,None,True,0,2026-07-02 20:00:47,2026-07-05 17:49:20,True,False
1510,4,0.9.47,3,"asyik crash je masa nk transfer verification, semak betul la",Google Play,English,Negative,Transfer Issues,True,0,2026-07-02 13:10:16,2026-07-05 17:46:58,False,True
1511,4,0.9.47,2,It was a great app with good ui journey. But woke up to a app supported on rooted devices error. Updated every phone software and everything is official. Some conflict with UI 8.5? false positive? Sent email to app support but no response.,Google Play,English,Negative,Performance,True,0,2026-07-02 12:30:48,2026-07-05 17:45:37,True,True
1512,4,0.9.47,5,"This is one of the most convenient banking apps, making it very easy to connect and manage transactions, including overseas payments. I find it simple to use and reliable for everyday banking needs, such as checking balances, transferring money, and making payments securely anytime.",Google Play,English,Positive,None,True,0,2026-07-02 11:39:12,2026-07-05 17:43:30,True,False
1513,4,,5,good app and fast service,Google Play,English,Positive,None,True,0,2026-07-02 10:36:02,2026-07-05 17:40:57,True,False
1514,4,0.9.47,5,best app,Google Play,English,Positive,None,True,0,2026-07-02 09:32:45,2026-07-05 17:40:01,True,False
1515,4,0.9.47,5,"""Maybank2u makes banking simple and secure. Transfers are quick, bill payments are hassle-free, and the interface is clean and easy to navigate. Login is smooth with strong security features. Reliable banking on the go.",Google Play,English,Positive,None,True,0,2026-07-02 01:50:57,2026-07-05 17:38:14,True,False
1516,4,0.9.47,5,no bug,Google Play,English,Negative,Performance,True,0,2026-07-01 23:55:40,2026-07-05 17:36:50,False,True
1517,4,,1,buggy after latest updates. app stops responding when u switch,Google Play,English,Negative,Performance,True,0,2026-07-01 23:31:17,2026-07-05 17:35:31,False,True
1518,4,0.9.47,1,why the loading page is very slow right now when we are trying to verify ourselves before make a transfer?,Google Play,English,Negative,Transfer Issues,True,0,2026-07-01 22:59:36,2026-07-05 17:34:20,False,True
1519,4,,5,"Makes banking much easier. I can transfer money, pay bills and check my account anytime without needing to visit the bank.",Google Play,English,Neutral,None,True,0,2026-07-01 22:43:52,2026-07-05 17:33:16,False,False
1520,4,0.9.47,5,"Secure, reliable, and makes banking transactions quick and convenient.",Google Play,English,Positive,None,True,0,2026-07-01 22:36:51,2026-07-05 17:32:25,True,False
1521,4,,5,"I can transfer money, pay bills, and check my account balance in just a few taps. The app is straight forward, reliable and saves me a lot of time.",Google Play,English,Neutral,None,True,0,2026-07-01 22:31:37,2026-07-05 17:31:02,False,False
1522,4,0.9.47,1,"there is no leave feedback option to report bugs in app, click support -> leave feedback it force you to fill in marketing survey about your financial status and plans...",Google Play,English,Negative,Performance,True,0,2026-07-01 20:25:29,2026-07-05 17:27:16,False,True
1523,4,0.9.47,1,Poor customer service that only waste time just to wait for activation for transactions. The only advantages I think is only restrict owner for not to transfer any money through the app. Poor customer service ever had in bank,Google Play,English,Neutral,None,True,0,2026-07-01 20:19:25,2026-07-05 17:22:42,False,False
1524,4,0.9.47,1,"why everytime nak bayar bil, dah proceed untuk 2 step verification tiba2 kat maybank2u pop up tak keluar apa2? whats the prkblem with you MAE????",Google Play,English,Neutral,None,True,0,2026-07-01 20:04:39,2026-07-05 17:20:57,False,False
1525,4,0.9.47,5,"maybank2u is an excellent banking app! Fast, secure, and easy to use. I can transfer money, pay bills, and manage my accounts without any hassle. Highly recommended",Google Play,English,Positive,None,True,0,2026-07-01 19:56:32,2026-07-05 17:18:57,True,False
1526,4,,5,"Maybank2u makes banking convenient and secure. I can transfer money, pay bills, and check my account anytime. The app is reliable and easy to navigate.",Google Play,English,Positive,None,True,0,2026-07-01 18:34:22,2026-07-05 17:15:27,True,False
1527,4,,5,"⭐⭐⭐⭐⭐ Very convenient banking app 🏦 easy to check balance, transfer money, and manage everything in one place!",Google Play,English,Positive,None,True,0,2026-07-01 17:53:40,2026-07-05 17:14:31,True,False
1528,4,0.9.47,5,the best👍💯 l love my Maybank,Google Play,English,Positive,None,True,0,2026-07-01 15:34:04,2026-07-05 17:11:34,True,False
1529,4,0.9.47,1,poor apps,Google Play,English,Neutral,None,True,0,2026-07-01 15:02:18,2026-07-05 17:10:59,False,False
1530,4,,5,good,Google Play,English,Positive,None,True,0,2026-07-01 13:59:19,2026-07-05 17:10:08,True,False
1531,4,0.9.47,1,Sakitnya hati nak bayar pun susah! Kenapa eh susah sangat nak approve? Noti dah keluar tapi bila tekan x de yg keluar utk approve. Sakitnya hati! 😡,Google Play,English,Neutral,None,True,1,2026-07-01 12:46:15,2026-07-05 17:09:41,False,False
1532,4,0.9.47,1,"secure to you gone when i open it, what's the problem bro? i cant pay my rent, and online shopping",Google Play,English,Negative,Account Access,True,0,2026-07-01 11:27:14,2026-07-05 17:07:29,True,True
1533,4,0.9.47,3,"Time nak tekan approve and letak pin number jadi lag teruk sangat kenapa. I thought my phone was broken but then time buka apps lain elok ja. lama sangat loading, rindu Mae yang version lama, laju ja. Dahla timing tak sampai 5 minit, dengan nak tekan approve tak boleh, number pin pun tknak lekat",Google Play,English,Neutral,None,True,0,2026-07-01 07:06:23,2026-07-05 17:00:33,False,False
1534,4,0.9.47,5,"When I'm became a student, this is the first bank i will choose, because of how fast it is to just scan, pay and transfer. The benchmark for mobile banking convenience. It is incredibly reliable, easy to navigate, and features like MAE make tracking expenses and scanning QR payments effortless. It handles daily financial tasks perfectly. You also can make many accounts to save many for future, foods, trip and manyy more very convenient and easy",Google Play,English,Positive,None,True,2,2026-07-01 06:57:44,2026-07-05 16:59:38,True,False
1535,4,0.9.47,1,good job,Google Play,English,Positive,None,True,0,2026-07-01 03:25:52,2026-07-05 16:50:14,True,False
1536,4,,5,"Excellent app! It's easy to use, fast, and has a clean design. Highly recommended.",Google Play,English,Positive,None,True,0,2026-07-01 03:21:13,2026-07-05 16:49:37,True,False
1537,4,,5,this app makes banking so easy and stress free,Google Play,English,Positive,None,True,0,2026-07-01 02:50:09,2026-07-05 16:48:47,True,False
1538,4,0.9.47,5,maybank is easy to cheak balamce transfer everything..its so easy and benificial apps,Google Play,English,Positive,None,True,0,2026-07-01 00:10:49,2026-07-05 16:48:09,True,False
1539,4,0.9.46,5,"Maybank2u makes online banking very easy. I can transfer money, pay bills, and check my account anytime. The app is simple, secure, and reliable.",Google Play,English,Positive,None,True,0,2026-06-30 21:33:10,2026-07-05 11:19:10,True,False
1540,4,0.9.47,5,Maybank2u is great. It is easy to navigate and has features that make it more convenient to me. It makes my banking experience easier.,Google Play,English,Positive,None,True,0,2026-06-30 21:00:55,2026-07-05 11:18:28,True,False
1541,4,,5,i have account in this apps and its really help me to saving my money cause they have future that you can create your own tabung . they help you to learn how to saving even with small amount.,Google Play,English,Neutral,None,True,0,2026-06-30 19:52:02,2026-07-05 11:17:02,False,False
1542,4,0.9.47,5,"Maybank2u makes banking so incredibly convenient! Transfers, bill payments, and account management are all just a few taps away. The security features give me complete confidence, and the app loads quickly without any glitches. Banking has never been this smooth and hassle-free!",Google Play,English,Positive,None,True,0,2026-06-30 19:04:52,2026-07-05 11:15:28,True,False
1543,4,0.9.47,1,pls update it. I search treats in mae app. want to redeem then in mae they ask me to authorize it.. how come as I is in MAE not other apps like Celcom live or else that link to Maybank online. Quite a stupid experience from the best bank in Malaysia,Google Play,English,Positive,None,True,0,2026-06-30 18:27:11,2026-07-05 13:22:54,True,False
1544,4,0.9.47,5,"Maybank2u is a convenient and efficient banking app. It allows users to transfer funds, pay bills, and manage finances securely. The interface is clean, making everyday banking simple and hassle-free.",Google Play,English,Positive,None,True,0,2026-06-30 14:51:26,2026-07-05 11:08:18,True,False
1545,4,0.9.47,1,I am having a lot of transactions approval issues. Even though I have already uninstalled and reinstalled MAE app. Is very frustrating because i cannot do payment for Adacash. Maybank please buck up your IT services. It's really annoying because I did more than 10 times also the approval transactions failed.,Google Play,English,Negative,Payment Issues,True,1,2026-06-30 14:45:57,2026-07-05 11:07:32,False,True
1546,4,0.9.47,1,aku nk screenshot dekat transaction tak dpt benda yg penting kot apahal nk buat mcm tu??,Google Play,English,Neutral,None,True,0,2026-06-30 12:46:31,2026-07-05 10:55:12,False,False
1547,4,,5,"Maybank2u makes banking so easy and convenient. I can check balances, transfer money, and pay bills anytime, anywhere. The app is user-friendly, secure, and rarely has downtime. Definitely my go-to banking app!",Google Play,English,Positive,None,True,0,2026-06-30 11:32:46,2026-07-05 10:54:35,True,False
1548,4,0.9.47,5,Excellent service,Google Play,English,Positive,None,True,0,2026-06-30 11:15:40,2026-07-05 10:53:43,True,False
1549,4,0.9.47,1,kembalikan semula boleh screenshot. supaya mesra pengguna.,Google Play,English,Neutral,None,True,0,2026-06-30 10:07:36,2026-07-05 10:53:03,False,False
1550,4,0.9.47,3,"cannot customise quick action to minimum, remove clutter",Google Play,English,Neutral,None,True,0,2026-06-30 08:00:50,2026-07-05 10:51:44,False,False
1551,4,,5,a great app to safeguard Ur money without any transfer limit,Google Play,English,Positive,None,True,0,2026-06-30 05:19:53,2026-07-05 10:50:16,True,False
1552,4,0.9.47,5,Great app,Google Play,English,Positive,None,True,0,2026-06-30 01:29:09,2026-07-05 10:45:01,True,False
1553,4,0.9.47,1,"This app sends more than one notifications in the middle of the night to promote their stuffs. It just so happens that I will not turn off the notification, you manipulate that function. What a disgrace.",Google Play,English,Neutral,None,True,0,2026-06-29 23:17:45,2026-07-05 10:43:06,False,False
1554,4,0.9.47,2,Always can't open the apps.,Google Play,English,Neutral,None,True,0,2026-06-29 20:51:27,2026-07-05 10:32:40,False,False
1555,4,0.9.47,3,So far so good,Google Play,English,Positive,None,True,0,2026-06-29 20:28:21,2026-07-05 10:31:15,True,False
1556,4,0.9.47,5,updated features incredibly powerful!! easy to access when i need to do a transaction,Google Play,English,Positive,None,True,0,2026-06-29 17:05:50,2026-07-05 10:22:46,True,False
1557,4,0.9.47,1,please asal tabung dekat mae tak boleh buka ni adooi. bila tekan jer dia tulis something wrong please lah fix. ke memang buat tabung mae ni untuk rembat duit customer yang simpan dalam tbung ni.,Google Play,English,Neutral,None,True,0,2026-06-29 16:39:00,2026-07-05 10:20:51,False,False
1558,4,0.9.46,5,rasldl Miki,Google Play,English,Neutral,None,True,0,2026-06-29 16:21:15,2026-07-05 10:19:55,False,False
1559,4,0.9.47,5,"maybank2u is a smart and convenient banking app that makes financial management easier. From checking balances to making payments, everything can be done quickly and safely. it truly saves time and makes banking more accessible.",Google Play,English,Positive,None,True,0,2026-06-29 16:14:15,2026-07-05 10:19:17,True,False
1560,4,,1,useless,Google Play,English,Neutral,None,True,0,2026-06-29 15:38:26,2026-06-29 16:05:01,False,False
1561,4,,5,bagusss,Google Play,English,Neutral,None,True,0,2026-06-29 14:32:56,2026-06-29 16:07:00,False,False
1562,4,,5,"When talk about banking, Maybank is my choice when if goes to easy and user friendly app. i can all my transactions as easy as 123. paying bills also automated.",Google Play,English,Positive,None,True,0,2026-06-29 14:17:31,2026-06-29 16:08:04,True,False
1563,4,0.9.47,1,"my Mae can't scan qr to pay,but TNG ok,help me realest new version asap",Google Play,English,Neutral,None,True,0,2026-06-29 12:53:53,2026-06-29 16:10:37,False,False
1564,4,0.9.47,5,keep popping secure2u even already done. every 5 minutes got notification. please update this bug.,Google Play,English,Negative,Account Access,True,0,2026-06-29 12:09:10,2026-06-29 16:11:38,True,True
1565,4,0.9.47,5,most best bank app among other😁,Google Play,English,Positive,None,True,0,2026-06-29 08:02:20,2026-06-29 16:13:17,True,False
1566,4,,5,"Very convenient banking app. Transactions are fast, secure, and simple to manage. Got tabung option for saving too!! great apps!",Google Play,English,Positive,None,True,0,2026-06-28 23:41:07,2026-06-29 16:16:10,True,False
1567,4,0.9.46,5,good. tq,Google Play,English,Positive,None,True,0,2026-06-28 21:13:20,2026-06-29 16:17:44,True,False
1568,4,0.9.47,5,"Maybank’s MAE app makes banking effortless. DuitNow transfers are instant, bill payments and top-ups are all in one place, and the QR Pay features.",Google Play,English,Neutral,None,True,0,2026-06-28 17:45:33,2026-06-29 16:23:34,False,False
1569,4,0.9.47,5,"This app is convenient and reliable banking app for managing money easily. It allows users to check balance, transfer funds, pay bills and track transactions anytime. This app is user friendly and makes online banking faster and secure",Google Play,English,Positive,None,True,0,2026-06-28 16:52:45,2026-06-29 16:24:25,True,False
1570,4,0.9.47,5,Update is regular and the biometric login makes checking my balance incredibly fast. Paying via Scan & Pay at night markets is so quick that I rarely carry physical wallets anymore.,Google Play,English,Positive,None,True,0,2026-06-28 16:43:51,2026-06-29 16:25:06,True,False
1571,4,,5,"Very convenient banking app. Transactions are secure, fast, and the interface is clean and user-friendly.",Google Play,English,Positive,None,True,0,2026-06-28 16:38:04,2026-06-29 16:25:45,True,False
1572,4,0.9.47,5,"A dependable banking app that makes handling money pretty straightforward. The interface is easy to use, and transactions are fast and secure",Google Play,English,Positive,None,True,0,2026-06-28 16:08:00,2026-06-29 16:27:31,True,False
1573,4,0.9.47,2,"I gave this app a chance it works up until they restricted apps with accessibility access. Only found out about this because of my vision impaired friend who needs third party apps to properly use their phone, this app restricted the access to the app mid-way of trying to pay for something. A banking app should not have the control over this, as far as I'm concerned a warning is more than enough to protect user safety and security. I find the usage block extreme unnecessary and malicious.",Google Play,English,Neutral,None,True,6,2026-06-28 11:33:30,2026-06-29 16:32:10,False,False
1574,4,0.9.47,1,"Can't reload my phone credit through FPX, notification for secure2u showed up after timeout",Google Play,English,Positive,None,True,0,2026-06-28 09:28:59,2026-06-29 16:33:36,True,False
1575,4,,1,if we have an award for most weak stupid nonsense online banking...... it would definitely goes to Maybank. Always has their updates that causes the cancellation of online transactions which has NO DIFFERENCE on currently features at all,Google Play,English,Neutral,None,True,0,2026-06-28 04:16:31,2026-06-29 16:35:18,False,False
1576,4,,5,very easy. i like it,Google Play,English,Positive,None,True,0,2026-06-28 01:01:37,2026-06-29 16:39:06,True,False
1577,4,0.9.47,1,"Damn worst! Everytime I try to make Online payment 9/10 times can't even received app opt to approve that payment...& my bank transfer almost ever show ""you transactions can't display this time???"" 0/10 rate",Google Play,English,Negative,Payment Issues,True,1,2026-06-28 00:37:14,2026-06-29 16:40:29,False,True
1578,4,0.9.47,1,"two time qr payment timeout, but still deduct the money.. and its two transaction....",Google Play,English,Neutral,None,True,0,2026-06-27 23:48:54,2026-06-29 16:41:14,False,False
1579,4,0.9.47,5,"Maybank2u offers secure online banking with convenient fund transfers, bill payments, and account management. Occasional maintenance periods may temporarily limit access.",Google Play,English,Positive,None,True,0,2026-06-27 23:16:44,2026-06-29 16:42:18,True,False
1580,4,,5,"Easy to transfer money. The interface is very straighforward, less useless button, and more importantly usable almost anywhere.",Google Play,English,Positive,None,True,0,2026-06-27 22:36:52,2026-06-29 16:43:08,True,False
1581,4,0.9.47,1,Cannot withdraw money from tabung. I'm desperately need to use my own money.,Google Play,English,Neutral,None,True,0,2026-06-27 18:25:55,2026-06-29 16:45:33,False,False
1582,4,0.9.47,3,poor connection? guna web boleh plak,Google Play,English,Neutral,None,True,0,2026-06-27 16:45:25,2026-06-29 16:49:54,False,False
1583,4,0.9.47,1,to activate secure2u need to get a new debit card again. Why so many card needed. what for? I got a Mae card but cannot activate my secure2u. need to wait till Monday to Maybank branch and apply for a debit card. what a waste of Time and Trouble Some.,Google Play,English,Positive,None,True,0,2026-06-27 10:26:56,2026-06-29 11:07:53,True,False
1584,4,0.9.47,5,it doesn't crash easily it's best for the transaction.,Google Play,English,Negative,Performance,True,0,2026-06-27 00:35:56,2026-06-29 16:53:10,True,True
1585,4,0.9.47,5,good,Google Play,English,Positive,None,True,0,2026-06-26 23:29:03,2026-06-28 22:47:05,True,False
1586,4,,5,"Maybank2u is a reliable and easy-to-use banking app. I can transfer money, pay bills, reload my phone, and manage my accounts anytime. The app is secure, fast, and very convenient for daily banking.",Google Play,English,Positive,None,True,0,2026-06-26 22:40:04,2026-06-28 22:49:27,True,False
1587,4,,1,"Apps ni melibatkan duit yang disimpan pelanggan dan sepatutnya memudahkan pelanggan berurusan. Apa yang berlaku adalah app tak recognise pin number malah biometrik yang didaftarkan. Selama beberapa bulan menggunakan apps ni okay jer. Reset di atm pakai temporary PIN, bejaya tukar password. Bila log in password baru, masih tak recognise, cakap invalid!!!. Berapa kali nak kena tukar/reset password kat ATM!!!? Ni bukan memudahkan pelanggan, menyusahkan adalah....!!!",Google Play,English,Neutral,None,True,0,2026-06-26 21:58:17,2026-06-28 22:56:54,False,False
1588,4,0.9.47,1,brp kali nk transfer xblh.secuare2 expired saja,Google Play,English,Neutral,None,True,1,2026-06-26 12:28:26,2026-06-28 23:03:37,False,False
1589,4,0.9.47,1,"Whenever I try to make an online payment through Maybank, there's always a problem.Was Maybank designed to have problems??????",Google Play,English,Negative,Payment Issues,True,1,2026-06-26 10:44:08,2026-06-28 23:04:34,False,True
1590,4,0.9.47,2,"since last update i have difficulties open the apps, i have to try many times before i can open the apps. sometimes i have to restart my phone. its a hassle especially when i want to do a quick qr pay.",Google Play,English,Neutral,None,True,0,2026-06-26 10:17:07,2026-06-28 23:06:49,False,False
1591,4,,5,"Maybank2u is an apps that i had been using long time ago. i can do any transaction from here. top up my credit, payment any bills, buy gold and many more.",Google Play,English,Neutral,None,True,0,2026-06-25 23:23:16,2026-06-28 23:10:26,False,False
1592,4,0.9.47,3,okay qr semua okay . yang tak okay Nye kenapa tetiber hang masa nak buat bayaran pastu dia suruh guna jari dah guna tetiber tak dapat pastu keypad dia bersepah. pastu kata tak dapat transfer tapi duit tetap transfer. pastu bila guna nak bayar guna qr tetiber kata system busy lah,Google Play,English,Neutral,None,True,0,2026-06-25 22:13:37,2026-06-28 23:12:23,False,False
1593,4,0.9.47,5,Apps M2u sangatlah bagus dan memudahkan urusan harian.. dengan pelbagai features yang sangat berguna. saya sebagai pengguna boleh melabur dan menabung melalui apps ini.,Google Play,English,Neutral,None,True,0,2026-06-25 21:11:41,2026-06-28 23:16:32,False,False
1594,4,0.9.47,5,aweeombe,Google Play,English,Neutral,None,True,0,2026-06-25 20:18:19,2026-06-28 23:18:51,False,False
1595,4,0.9.47,1,"My MAE always crash... when open the apps, its only show the logo and closed by its own",Google Play,English,Negative,Performance,True,0,2026-06-25 19:13:19,2026-06-28 23:20:01,False,True
1596,4,0.9.47,1,app paling sampah aku biasa guna. kalu bole bg 0 start aku bg 0 start dh. worse experience ever. aku nih jarang bg rating kt org tp aku buat pengecualian utk app sampah nih,Google Play,English,Neutral,None,True,1,2026-06-25 19:01:13,2026-06-28 23:21:23,False,False
1597,4,0.9.47,1,"Cannot transfer to Mae, try many days already but keep failed and no reason 😕",Google Play,English,Negative,Transfer Issues,True,1,2026-06-25 16:09:29,2026-06-28 23:26:06,False,True
