review_id,user_name,review_text,rating,thumbs_up_count,app_version,review_date,developer_reply_text,developer_reply_date,developer_reply,review_length,positive_review,negative_review,app_id,review_source,language,sentiment,complaint_category,review_user_id
9d9d104e-c0b7-423d-b4d3-a64598edf6ea,Elinen Parker,"Tap Track Win Cashback interface has been ""Get ready for something new"" since last month, cleared cache - restart phone - uninstall - reinstalled but still same, what's happening?",1,0,0.9.47,2026-06-14 20:31:38,"Thank you for reaching out and we sincerely apologize for the inconvenience caused. We would greatly appreciate it if you could contact us should the issue still persist. You may reach us via Maybank Facebook PM, X (Twitter), Instagram DM, M2U Live Chat, or email us at mgcc@maybank.com.my for further assistance.",2026-06-16 02:50:14,True,179,False,False,4,Google Play,English,Neutral,General,1693
cc353a4d-fee0-4727-8d15-7326fa3f9bfd,Yyg,"Maybank2u is easy to use, secure, and convenient. It helps me manage my banking needs anytime and anywhere. I am happy with my experience.",5,0,0.9.47,2026-06-14 19:25:29,"We sincerely appreciate you taking the time to share your experience. It is great to hear that our service has met your expectations. Thank you for your valuable feedback and support.
",2026-06-16 02:46:24,True,138,True,False,4,Google Play,English,Positive,General,1694
01e2f1fe-4e82-44ef-a51e-d3f43065b038,Kim Hyana,"The Maybank2u app is convenient, efficient, and easy to navigate. It allows me to manage my banking needs anytime, from transferring funds to paying bills. The app runs smoothly and provides a seamless banking experience. Definitely a reliable app for everyday financial transactions. 👍📱✨",5,0,0.9.47,2026-06-14 18:20:05,We sincerely appreciate you taking the time to share your experience. It is great to hear that our service has met your expectations. Thank you for your valuable feedback and support.,2026-06-16 02:45:24,True,288,True,False,4,Google Play,English,Positive,General,1695
f180545d-a5dd-4012-a251-f5279665ed54,Syafiqah Zamri,"“Maybank2u is the best banking app I’ve used. It saves me so much time and works perfectly for online transactions. Secure, fast, and very convenient.”",5,0,,2026-06-14 17:32:59,"We are indeed delighted to note that the services rendered were up to your expectations. Thank you for rating and reviewing us.
",2026-06-16 02:41:10,True,151,True,False,4,Google Play,English,Positive,General,1696
f4e72573-0314-4691-9f4b-818c28e7f459,Fairuz,setiap hari nak maintainance ke?,1,0,0.9.47,2026-06-14 13:49:44,"Maaf atas kesulitan yang dialami.Harap maklum bahawa aplikasi MAE sedang beroperasi seperti biasa pada ketika ini.Sekiranya anda masih mengalami isu yang sama,kami amat menghargai jika anda dapat menghubungi kami melalui Facebook PM Maybank, X (Twitter), Instagram DM, M2U Live Chat atau emel ke mgcc@maybank.com.my untuk bantuan lanjut.Terima kasih.",2026-06-16 02:35:52,True,32,False,False,4,Google Play,English,Neutral,General,1697
270a4f23-3f41-4f46-bbc4-c3612b1fd5d8,nuryadawiyyah Mohd nizam,good for online banking,5,0,0.9.46,2026-06-14 09:49:43,"Your support means a lot to us and motivates us to continue improving our services. Thank you for choosing Maybank! 💛
",2026-06-16 02:30:40,True,23,True,False,4,Google Play,English,Positive,General,1698
96d5505e-d9e3-49d6-9090-ea7049eb8b57,Anuar Safian,I can open other bank apps except this Maybank apps. it always shutdowns automatically after a few seconds after I click to open this apps,1,0,0.9.47,2026-06-13 19:49:03,"Hi, we regret any inconvenience. Based on checking, the app is operating as usual. Please refer the following steps: Settings > 'Apps' > MAE > Force stop > Storage > Clear data/cache. Do reach us if the issue persists via Maybank Facebook PM / X (Twitter)/Instagram DM/ M2U Live Chat (website)/ email to mgcc@maybank.com.my for further assistance.
",2026-06-16 01:59:48,True,138,False,False,4,Google Play,English,Neutral,General,1699
7eaf5712-4821-49e6-bc17-8ec829794009,Gan Chun Hue,User friendly,5,0,0.9.47,2026-06-13 17:44:18,"Appreciate your support! Happy to know our app is making your banking experience smooth and easy. 💛
",2026-06-16 01:59:06,True,13,False,False,4,Google Play,English,Neutral,General,1700
f449370c-cb73-4c04-bf9e-0e9e3be51f95,Blues Achai Channel,Sangat baik,5,0,0.9.47,2026-06-13 16:41:18,"Hi, terima kasih atas sokongan padu anda! Kami gembira aplikasi ini memberi pengalaman yang baik kepada anda dan akan terus menambah baik perkhidmatan kami. 🐯💛
",2026-06-20 13:06:08,True,11,False,False,4,Google Play,English,Neutral,General,1701
97e15a93-23d5-4d20-8b08-83ebac5cd4d2,Muhd Arieff,"always have problem with secure2u whenever you update the apps MAE!! i must disable secure2u, then register again. Then when update apps again, i will MUST DOING IT AGAIN, WHAT THE HECK within 2 days i did that 👆🏻 now do it again!! u guys crazy?? same goes to company acc too. lame on MAE. YOU SHOULD BE BETTER. btw im using samsung S25 Ultra.",1,1,0.9.47,2026-06-13 15:18:51,"Thank you for your feedback and we apologise for the inconvenience caused.Rest assured,we will channel your feedback to the relevant team for further review.If you are still facing the same issue,kindly reach out to us via Maybank Facebook PM, X(Twitter),Instagram DM,M2U Live Chat(website), or email us at mgcc@maybank.com.my for further assistance.",2026-06-20 13:04:21,True,343,True,True,4,Google Play,English,Negative,General,1702
c8624def-6625-4ef4-9811-2b796f6f4fbe,Isyaa,keep display be right back. we're experiencing communication error. can't use this app,1,0,0.9.47,2026-06-13 11:57:12,"Hi, we regret any inconvenience. Based on checking, the app is operating as usual. Please refer the following steps: Settings > 'Apps' > MAE > Force stop > Storage > Clear data/cache. Do reach us if the issue persists via Maybank Facebook PM / X (Twitter)/Instagram DM/ M2U Live Chat (website)/ email to mgcc@maybank.com.my for further assistance.
",2026-06-16 01:46:41,True,86,False,True,4,Google Play,English,Negative,General,1703
94d410f6-48d4-4315-ba0f-274e0ad042ef,Meimei Lee,keep it up for the better future,5,0,0.9.47,2026-06-13 11:31:56,"Thank you for your trust and support! We truly appreciate it and will continue to do our best to serve you. ✨
",2026-06-16 01:45:44,True,32,False,False,4,Google Play,English,Neutral,General,1704
254730ef-a378-4b11-8deb-6c14ed7a0743,Aiman Shafiq,"13 jun 2026,dri pukul 12, 12jun2026 sampai pagi 13jun2026 pukul 8.18 tak boleh transfer duittttt !!!! maintenance apa kau lama² ????",1,0,0.9.47,2026-06-13 08:18:59,"Maaf atas kesulitan yang dialami.Harap maklum bahawa aplikasi MAE sedang beroperasi seperti biasa pada ketika ini.Sekiranya anda masih mengalami isu yang sama,kami amat menghargai jika anda dapat menghubungi kami melalui Facebook PM Maybank, X (Twitter), Instagram DM, M2U Live Chat atau emel ke mgcc@maybank.com.my untuk bantuan lanjut.Terima kasih.",2026-06-16 01:42:39,True,132,False,False,4,Google Play,English,Neutral,General,1705
29169c92-b55b-4724-8922-d7994b06dc73,Fzn,Convenient banking app that makes transactions easy.,5,0,0.9.47,2026-06-13 06:47:02,"Thank you for your feedback! We’re pleased that MAE is making banking and payments easier for you.
",2026-06-16 01:41:55,True,52,True,False,4,Google Play,English,Positive,General,1706
83c50ad4-43bd-4d58-b0df-99f959321461,Sinzpk Pk,"The best online Banking apps... easy and fast, love you maybank.. long live Maybank! yehaaa",5,0,0.9.47,2026-06-13 06:29:17,We sincerely appreciate you taking the time to share your experience. It is great to hear that our service has met your expectations. Thank you for your valuable feedback and support.✨,2026-06-16 01:41:26,True,91,True,False,4,Google Play,English,Positive,General,1707
4af08b75-c7ad-4692-a758-6b7d0fc1bcca,Xybca 2233,still problem when connection fast,1,0,0.9.47,2026-06-12 23:43:58,"We regret any inconvenience. If you experience any slowness, kindly follow the troubleshooting below:Android: 'Settings' > 'Apps' > MAE & click 'force stop'. Then please choose 'storage' & click 'clear data/clear cache'.Kindly reach us via Maybank Facebook PM/X(Twitter)/Instagram DM/M2U live chat/email to mgcc@maybank.com.my for further assistance.",2026-06-16 01:40:30,True,34,True,True,4,Google Play,English,Negative,General,1708
e392fa09-0124-4294-8808-46e5fad3a92a,Selvi Raman,very useful app...easy to use,5,0,0.9.47,2026-06-12 23:35:43,"Thanks a bunch for the great review! We're happy to know you’re satisfied with our service.
",2026-06-16 01:34:59,True,29,True,False,4,Google Play,English,Positive,General,1709
2cc51559-b834-4654-af8b-14038107c42e,Jeffery Mangul,good,5,0,0.9.47,2026-06-12 22:15:49,"Hi, thank you for your 5-star rating! We’re happy to know you’re enjoying the MAE app. Your support means a lot to us! 🐯💛
",2026-06-16 01:34:11,True,4,True,False,4,Google Play,English,Positive,General,1710
f5073ca5-bb12-4e04-84cf-6e23150e7464,Eswari Sekar,"Maybank2u is a convenient and reliable online banking platform that makes managing finances easy. The app and website are user-friendly, allowing me to transfer funds, pay bills, check account balances, and perform banking transactions anytime and anywhere. I appreciate the security features and the overall smooth banking experience. Overall, Maybank2u is an efficient platform for everyday banking needs.",5,0,,2026-06-12 14:47:53,"Thank you for your feedback! We’re pleased that MAE is making banking and payments easier for you.
",2026-06-16 00:27:37,True,407,True,False,4,Google Play,English,Positive,General,1711
aed47ec3-5a48-4edf-8b65-5a254631b5bb,Krishna Warma,im very disappointed. suddenly transaction receipts not in file management. can share the receipt but cannot save,2,0,0.9.47,2026-06-12 09:51:44,Hi. We regret any inconvenience caused. Please note that you can reprint your transaction receipts through our MAE app by following these steps: Login > Accounts > View Transactions > M2U History. The receipts will be stored for 60 days. Thank you.,2026-06-16 00:18:52,True,113,False,False,4,Google Play,English,Neutral,General,1712
e5b79a2e-a76d-4818-b368-db44a7399ccc,NURFATEHAH,just 250 myr to open bank account very easy to apply,5,0,0.9.47,2026-06-12 09:03:49,Thank you for your review! We're glad to hear that you found the account opening process easy and convenient. We appreciate your support and look forward to continuing to serve your banking needs. 💛,2026-06-16 00:16:36,True,52,True,False,4,Google Play,English,Positive,General,1713
48bf1dae-fca7-4380-b711-7b5d74cd4dee,Hawwa Najihah Nordin,"I've been using the Maybank2u app for a long time, and it makes managing my banking much easier. Checking my balance, transferring money, and paying bills can all be done quickly from my phone. The app is convenient, easy to navigate, and works well for my daily banking needs.",5,0,,2026-06-11 22:25:47,"We sincerely appreciate you taking the time to share your experience. It is great to hear that our service has met your expectations. Thank you for your valuable feedback and support.✨
",2026-06-15 07:02:03,True,277,True,False,4,Google Play,English,Positive,General,1714
c735c4d2-3379-4a08-a972-205fd25e336a,Safiera Isa,easy and convinient for my business transaction.,5,0,0.9.46,2026-06-11 20:14:03,Appreciate your support! Happy to know our app is making your banking experience smooth and easy. 💛,2026-06-15 06:57:25,True,48,True,False,4,Google Play,English,Positive,General,1715
9fe6021c-7c07-4f28-a090-61f6ba60d5da,Ajees Gani,unable to open latest version MAE app with Samsung S24 after UI 8.5 update,1,0,0.9.47,2026-06-11 19:01:01,We regret any inconvenience caused. Please try the following steps: Android: 'Settings' > 'Apps' > MAE & click 'force stop'. Then please choose 'storage' & click 'clear data/clear cache'. If the issue still persists reach us via Maybank Facebook PM / X (Twitter)/Instagram DM/ M2U live chat/ email to mgcc@maybank.com.my for further assistance.,2026-06-23 10:04:23,True,74,False,False,4,Google Play,English,Neutral,General,1716
a5c49d89-77fe-4204-9690-40e857e8325d,Payal Jain,very convinient banking app . QR works well and great helpful app,5,0,0.9.47,2026-06-11 15:02:26,"We are indeed delighted to note that the services rendered were up to your expectations. Thank you for rating and reviewing us.
",2026-06-15 06:47:04,True,65,True,False,4,Google Play,English,Positive,General,1717
ca5cf47f-b387-4bbb-b58b-4fa8fae228db,Elaine Telus,Convenient banking app that makes transactions simple and secure. just the back button always shows to exit app which is not so convenient.,5,0,,2026-06-11 13:43:29,"Thank you for your feedback! We’re glad you find the app convenient, simple, and secure. We also take note of your comment regarding the back button behaviour and will share it with the relevant team for review and improvement.",2026-06-15 06:45:54,True,139,True,False,4,Google Play,English,Positive,General,1718
b5b3c984-116a-4f2d-9ea3-aebfa8da47aa,NFL KZ,kenapa banyak masalah apps mae sekarang ni?,3,0,0.9.47,2026-06-11 12:53:29,"Segala kesulitan amat dikesali. Berdasarkan semakan, aplikasi MAE sedang beroperasi seperti biasa pada ketika ini. Kami amat menghargai sekiranya anda dapat kongsikan isu yang anda hadapi untuk semakan dan bantuan lanjut melalui Maybank Facebook PM, X (Twitter), Instagram DM, M2U Live Chat atau email mgcc@maybank.com.my. Terima kasih.",2026-06-15 06:44:27,True,43,False,False,4,Google Play,English,Neutral,General,1719
6986c23b-9b27-4a56-9b5b-9f2024eb12d3,amer wanie,"Apps paling x berguna..x mcm apps maybank2u dulu..yg ni tiba2 dia suruh tukar password kita x reset password pun...saya dalam masa 2 bulan kena tukar 3x password smpai dah lupa dah password yg terbaru ni....pttnya dia x layak dapat satu bintang pun..menyusahkan penguna,apps bank kot ni..bukan apps parking majlis perbandaran. .sepertia biasa kepala hotak hang...aku ni guna maybank dah lama..maybank 2u dulu x mcm ni..ni hr ni kena lg tukaq password...bodo la dr elok2 guna maybank2u..system bodo",1,0,0.9.47,2026-06-11 12:34:29,"Hai, segala kesulitan amat dikesali. Berdasarkan semakan kami, status aplikasi MAE beroperasi seperti biasa.
Kami hargai jika anda dapat berikan kami nama penuh, no. tel & 'screenshot' melalui Maybank Facebook PM/Twitter DM/ M2U live chat/email
to mgcc@maybank.com.my untuk semakan dan bantuan lanjut.",2023-02-22 10:05:16,True,497,False,False,4,Google Play,English,Neutral,General,1720
d41dfe2d-1ea4-4e94-8f0a-81ffdfd3303f,Ab zahid Sulaiman,satisfield,5,0,0.9.46,2026-06-11 10:18:57,"Thanks a bunch for the great review! We're happy to know you’re satisfied with our service.
",2026-06-15 06:40:38,True,10,False,False,4,Google Play,English,Neutral,General,1721
28ea5563-c419-463e-aad5-428346421550,Md shipon Hassan,good,5,0,0.9.47,2026-06-11 09:15:42,"Hi. Thank you for rating and reviewing us. Have a pleasant experience using our MAE App. We thank you for the support. 👍
",2026-06-15 06:40:06,True,4,True,False,4,Google Play,English,Positive,General,1722
26c218d4-5087-4345-94cc-f2481e1033e2,Azy Azuman,trusted tq mybank,5,0,0.9.47,2026-06-11 09:03:25,Thank you for your trust and support! We truly appreciate it and will continue to do our best to serve you. ✨,2026-06-15 06:39:19,True,17,False,False,4,Google Play,English,Neutral,General,1723
b72c75c8-1c79-4098-a1a5-50e396512d8c,Hairul Izham,Maybank.... boleh tak letak Option untuk tulis reference bila bayaq guna QR code... terima kasih,4,0,0.9.47,2026-06-11 08:36:57,Terima kasih atas cadangan anda! Maklum balas mengenai penambahan ruangan rujukan untuk pembayaran QR telah kami ambil maklum dan akan dikongsi dengan pihak berkaitan untuk semakan dan penambahbaikan. Terima kasih kerana membantu kami meningkatkan perkhidmatan.,2026-06-15 06:38:01,True,96,False,False,4,Google Play,English,Neutral,General,1724
67d93d86-f5a2-446c-9b10-017bb1ae7556,Shabil Sabri,good apps,5,0,0.9.47,2026-06-11 07:49:43,"Hi. We appreciate your 5-star rating and your support for the MAE by Maybank2u app. Wishing you a seamless and enjoyable experience every time you use it! 🐯💛
",2026-06-15 06:16:43,True,9,True,False,4,Google Play,English,Positive,General,1725
01be7873-faaa-4075-82df-1dee63cf727d,এম বি চ্যালেন,good,5,0,0.9.46,2026-06-11 04:06:46,"Hi. Thank you for rating and reviewing us. Have a pleasant experience using our MAE App. We thank you for the support. 👍
",2026-06-15 04:26:06,True,4,True,False,4,Google Play,English,Positive,General,1726
13c5fef4-6a42-4f3a-8d75-1b79dfe7bf0e,azah azura,"MAE is reliable and convenient for everyday banking. Most transactions can be done within a few taps. I like their Tabung feature, where money can be automatically deducted from my main account and transferred to my savings account.",5,0,0.9.47,2026-06-11 00:18:13,"Thank you for your kind feedback! We’re glad you’re enjoying a smooth and secure banking experience with the MAE app.
",2026-06-15 04:25:22,True,232,True,False,4,Google Play,English,Positive,General,1727
3d1093c1-dcd7-4dbd-a9e0-a323f159aabf,New,"Maybank2u makes banking simple and convenient. Transactions are quick, and managing finances has never been easier.",5,0,,2026-06-10 22:08:41,"Hi. We are glad to note that our MAE app is up to your expectations. Thank you for rating & reviewing us.
",2026-06-15 04:24:37,True,115,True,False,4,Google Play,English,Positive,General,1728
76d00d7a-7c15-4828-a939-42a592ece1e9,lukhman ismail,"​A highly reliable banking app with excellent security features. The layout is clean, transfers are instant, and paying bills is incredibly convenient.",5,0,0.9.47,2026-06-10 20:52:08,"We sincerely appreciate you taking the time to share your experience. It is great to hear that our service has met your expectations. Thank you for your valuable feedback and support.✨
",2026-06-15 04:23:32,True,151,True,False,4,Google Play,English,Positive,General,1729
2016241c-5422-421c-b0d6-bd6f5c3c326d,Al Hafiz,fav bank all time,5,0,0.9.46,2026-06-10 20:38:30,"Thanks a bunch for the great review! We're happy to know you’re satisfied with our service.
",2026-06-15 04:22:55,True,17,False,False,4,Google Play,English,Neutral,General,1730
c7f890a5-cb86-4ca6-9c4a-c1b648b13607,Vinnothini Makendra Vijaya Barathi,Easy banking and secure transactions anytime,5,0,0.9.47,2026-06-10 17:38:51,"It’s wonderful to hear that our services lived up to your expectations. Thank you for your kind review and rating, we truly
",2026-06-15 04:20:37,True,44,True,False,4,Google Play,English,Positive,General,1731
88c019c1-f9e6-4011-9b48-25ad66849785,Nur ain azuwa Binti rabu,senang Dan mudah urusan,5,1,0.9.47,2026-06-10 17:36:15,"Hi, any inconvenience experienced is much regretted. We would appreciate it if you could share how we may
improve on MAE app and the issue that you are facing. Feel free to drop us a message via Maybank Facebook PM/Twitter DM/M2U live chat/email to mgcc@maybank.com with your suggestion and issue for the betterment of the app. Thank you.",2023-12-06 10:09:43,True,23,False,False,4,Google Play,English,Neutral,General,1732
01eea410-ea4c-49a4-85a2-4bcc69d16aa0,Erika Enot,i can use my withdrawal method now thank u... and people who read my review if u guys want to withdraw your money on atm u need to apply for the visa card first so u can withdraw your money on atm machine... And if u need help just chat there Facebook page...,5,1,0.9.46,2026-06-10 13:30:38,"Hi. We apologise for the inconvenience. Rest assured. Alternatively, we would appreciate it if you could share more details regarding the issue you experienced via Maybank - Facebook PM / X (Twitter)/Instagram DM/ Maybank Customer Care hotline 1300 88 6688/ +603-7844 3696 (Overseas) & our team will review advise you accordingly.",2026-05-12 18:24:35,True,259,False,False,4,Google Play,English,Neutral,General,1733
1c9f71f5-a80f-4ace-b346-2ed588bbe301,Tgrem Diana,"better switching to other bank now, app will force android 11 update soon..",1,3,0.9.47,2026-06-10 12:06:01,"Hi, we understand your frustration. However, older mobile OS versions no longer receive essential security updates, making them more vulnerable to risks. To help safeguard the online banking experience & ensure uninterrupted access, we strongly encourage you to update your mobile operating system to the latest supported versions.
",2026-06-23 08:47:39,True,75,False,False,4,Google Play,English,Neutral,General,1734
cbffbf1a-cd19-45d4-af2e-d0d8eca638d7,Just a Guy,Why hotlink is not available to purchase a credit?,3,0,0.9.47,2026-06-10 11:05:55,"We sincerely apologize for any inconvenience caused.Based on our checks, Maxis Hotlink is listed under the ‘Reload’ option in the MAE app.We would greatly appreciate it if you could provide your full name and contact number via Maybank Facebook PM, X(Twitter), Instagram DM, M2U Live Chat,or email mgcc@maybank.com.my for further checking&assistance.",2026-06-15 04:01:02,True,50,False,False,4,Google Play,English,Neutral,General,1735
82b5e403-666e-404b-8925-f6b6674f951d,Alan Ling,bad services,1,0,0.9.47,2026-06-10 11:01:27,"Hi, we understand your concern & sorry for the inconvenience. We would appreciate if you could elaborate in details pertaining to the issue you have experienced & drop us your details via Maybank Facebook PM / X (Twitter)/Instagram DM/ M2U live chat/ email to mgcc@maybank.com.my for further assistance. Thank you.
",2026-06-15 03:58:32,True,12,False,True,4,Google Play,English,Negative,General,1736
bcabe482-a06c-4cfe-bd33-9ce23c184b20,shan shan,Cant Register MAE in LenovoIdea Tab. Installed the app from play store and installation is success. But cant click anything in the field as the system not responding. How to fix this issue? I have tried the same in Samsung Tablet as well but the same issue. Im using the latest Android version 16 but still failed in both android tablet. Dissapointing big name Bank Maybank. :(,1,0,0.9.47,2026-06-10 10:49:51,"Hi. We regret any inconvenience caused. Thank you for your feedback. We would greatly appreciate it if you could contact us via Maybank Facebook PM, X (Twitter), Instagram DM, M2U Live Chat, or email mgcc@maybank.com.my, and provide your device model and OS version for further checking and assistance if you are still facing the same issue.",2026-06-15 03:57:41,True,377,False,True,4,Google Play,English,Negative,General,1737
fd2a4e58-93df-4654-9b97-e656156c875c,Syahrul 93,now very good 👍🏻😊,5,0,0.9.46,2026-06-10 01:55:49,"Maaf atas kesulitan. Harap maklum bahawa isu berkenaan telah pun pulih. Jika anda masih mengalaminya, lakukan 'kill app', dengan menutup semua aplikasi yang sedang berjalan & cuba semula. Rujuk kami melalui Maybank - Facebook PM, X (Twitter)/Instagram DM, M2U Live Chat (website) atau emel: mgcc@maybank.com.my jika masih memerlukan sebarang bantuan.",2026-05-18 17:15:41,True,17,True,False,4,Google Play,English,Positive,General,1738
2e400e70-cae1-4b30-8be7-6b66ed3e23f4,Alamgir hossen,good Maybank,5,0,0.9.47,2026-06-10 00:06:33,"Thank you for choosing our MAE App! We hope you have a wonderful experience using it, and we truly appreciate your support.
",2026-06-15 03:50:51,True,12,True,False,4,Google Play,English,Positive,General,1739
ffb98562-1ead-4819-bdec-739fb287e0a3,Salbiah Idris,always lag,1,0,0.9.47,2026-06-09 17:28:55,"Hi, sorry for the inconvenience. Rest assured, please refer the following steps: Android: Settings > 'Apps' > MAE > Force stop > Storage > Clear data/cache. Then, restart the device. Do reach us if the issue persists via Maybank - Facebook PM / X (Twitter)/Instagram DM/ M2U Live chat (website)/ email to mgcc@maybank.com.my for further assistance.
",2026-06-15 03:42:11,True,10,False,False,4,Google Play,English,Neutral,General,1740
49670bd7-0361-452b-a738-97fe579cfb56,Zahid Hasan,good,1,0,,2026-06-09 11:42:32,"Hi. Thank you for rating and reviewing us. We appreciate the feedback given. Have a pleasant
experience using our MAE app.",2026-06-15 03:39:04,True,4,True,False,4,Google Play,English,Positive,General,1741
3d4df610-9e95-42fe-a253-6333afa6cc97,Vanessa Kaili,"Maybank2u is very convenient for daily banking. I can do transfers, pay bills, and check transactions easily from my phone. I like using Maybank2u because it makes banking simple and securely",5,0,0.9.46,2026-06-09 06:18:28,Thank you for your valuable rating and review. We truly appreciate your feedback! We're glad you're enjoying the MAE App and hope you continue to have a great experience with it. Thank you for your support! 👍,2026-06-15 03:35:02,True,191,True,False,4,Google Play,English,Positive,General,1742
b9847b4f-a5b0-4794-9992-395973f97769,Nur Alea,why always say update not from play store.,5,0,,2026-06-09 04:18:58,"Hi, we hear your concern. Please try the following steps: Go to Settings > Apps > Google Play Store > Storage > Clear cache & Clear data. Then repeat the same steps for Google Play Services. If the issue still persists reach us via Maybank Facebook PM / X (Twitter)/Instagram DM/ M2U live chat/ email to mgcc@maybank.com.my for further assistance.",2026-06-08 16:26:09,True,42,False,False,4,Google Play,English,Neutral,General,1743
b141d03a-d40e-45d9-b52a-5b4626a02967,Kaliq,The app is super friendly and reliable. Can be trusted and all transactions very smoothly done. This app is own by the biggest bank in Malaysia.,5,0,,2026-06-09 04:03:59,"We are indeed delighted to note that the services rendered were up to your expectations. Thank you for rating and reviewing us.
",2026-06-15 03:33:04,True,144,True,False,4,Google Play,English,Positive,General,1744
