review_id,user_name,review_text,rating,thumbs_up_count,app_version,review_date,developer_reply_text,developer_reply_date,developer_reply,review_length,positive_review,negative_review,app_id,review_source,language,sentiment,complaint_category,review_user_id
3d72ab61-0535-4223-a49b-55b8e4ad4507,Noor Azlina Zulkefli,"Aplikasi perbankan terbaik untuk saya. Memudahkan setiap urusan melibatkan pengurusan kewangan saya, seperti bayar bil, tranfer duit ke pihak ke3 dan sebagainya.",5,0,0.9.46,2026-06-01 16:01:39,Hai. Kami sememangnya berbesar hati mengetahui bahawa perkhidmatan yang diberikan menepati jangkaan anda. Terima kasih kerana memberi penilaian dan ulasan kepada kami. 🐯💛,2026-06-09 09:50:35,True,161,False,False,4,Google Play,English,Neutral,General,1842
e29343e6-c952-46f9-990c-6a378f9afe05,Ijad Aizad,incredible,5,0,0.9.47,2026-06-01 15:09:04,"Hi, thanks for your 5-stars rating! We’re glad to hear you’re having a good experience. More improvements coming your way! 🐯💛",2026-06-09 09:49:41,True,10,False,False,4,Google Play,English,Neutral,General,1843
75eff266-42aa-4bdb-bd8d-045fda7274d2,Ravinderjit Singh,the app is crashing on realme 14 pro.,3,0,,2026-06-01 13:40:42,"Hi, we hear your concern. Please try the following steps: Go to Settings > Apps > Google Play Store > Storage > Clear cache & Clear data. Then repeat the same steps for Google Play Services. If the issue still persists reach us via Maybank Facebook PM / X (Twitter)/Instagram DM/ M2U live chat/ email to mgcc@maybank.com.my for further assistance.",2026-06-08 16:31:04,True,37,False,True,4,Google Play,English,Negative,General,1844
7321f7dd-948d-4a6c-a6f8-4d455ff7a76a,Vicky Riyaa,very nice,5,0,0.9.47,2026-06-01 13:36:53,"Hi, thank you for the 5 stars! We’re delighted that you’re enjoying the MAE by Maybank2u app. Your support keeps us going! 🐯💛",2026-06-09 09:40:42,True,9,False,False,4,Google Play,English,Neutral,General,1845
f832c608-68d4-4bce-bff4-b9ae0e31961d,Mohd Shahril Seliaman,nice,5,0,0.9.47,2026-06-01 13:08:57,"Hi, we appreciate your 5-star rating! Great to know you’re having a good experience with MAE by Maybank2u. Thank you for choosing us! 🐯💛",2026-06-09 09:39:04,True,4,False,False,4,Google Play,English,Neutral,General,1846
309ec58d-ace8-487a-aa80-8669858375e1,N Z,currently need to reinstall few times a day... not sure what the main issue..,1,0,0.9.46,2026-06-01 12:38:13,"Hi, we hear your concern. Please try the following steps: Go to Settings > Apps > Google Play Store > Storage > Clear cache & Clear data. Then repeat the same steps for Google Play Services. If the issue still persists reach us via Maybank Facebook PM / X (Twitter)/Instagram DM/ M2U live chat/ email to mgcc@maybank.com.my for further assistance.",2026-06-08 16:30:35,True,77,False,True,4,Google Play,English,Negative,General,1847
1c5616b1-5bfc-4114-97ef-f62268e0d739,Samsudin Sudin,good,5,0,0.9.47,2026-06-01 12:05:12,"Hi, thank you for your support and 5-star rating! We’re glad you’re enjoying the app and hope to serve you even better. 🐯💛",2026-06-09 09:38:19,True,4,True,False,4,Google Play,English,Positive,General,1848
54ec8225-ca2c-494e-aca9-d0909e570f09,Faizal Ayob Faizal,very good,5,0,0.9.47,2026-06-01 10:01:57,"Hi, thanks for your 5-star review! Your feedback encourages us to keep enhancing the MAE app for a better experience. 🐯💛",2026-06-09 09:35:49,True,9,True,False,4,Google Play,English,Positive,General,1849
0f496979-ba43-440d-b1e9-a775f88f1623,cog Sedie,nice,5,0,0.9.47,2026-06-01 09:25:31,"Hi, thank you for your great rating! We’re pleased to know the app is meeting your expectations. Appreciate your support! 🐯💛",2026-06-09 09:35:27,True,4,False,False,4,Google Play,English,Neutral,General,1850
e476e1e9-93ef-4e00-88d5-7384380cc633,Santro Sondy,"Today, June 1, 2026, at 8:42 a.m., I just wanted to check my loan balance, but it took more than 6 minutes. This happens very often. Now, I can't take it anymore. Imagine how many opportunities are missed due to this problem. Please use the 1-minute rule.",1,0,0.9.46,2026-06-01 08:50:08,"Hi, sorry for the inconvenience. Rest assured, please refer the following steps: Android: 'Settings' > 'Apps' > MAE & click 'force stop'. Then, choose 'storage' & click 'clear data/clear cache'. Do reach us if the issue persists via Facebook PM / X (Twitter)/Instagram DM/ M2U Live chat (website)/ email to mgcc@maybank.com.my for further assistance.",2026-06-08 16:29:33,True,255,False,True,4,Google Play,English,Negative,General,1851
8cbad6d8-78d6-4038-a3a3-c2ec1bb0bf26,Addin Jailani,"the app keep crashing and showing ""we unable to retrieve the information you've requested."" please fix this",1,0,0.9.46,2026-06-01 08:41:35,"Hi, we regret any inconvenience. Based on checking, the app is operating as usual. Please refer the following steps: Settings > 'Apps' > MAE > Force stop > Storage > Clear data/cache. Do reach us if the issue persists via Maybank Facebook PM / X (Twitter)/Instagram DM/ M2U Live Chat (website)/ email to mgcc@maybank.com.my for further assistance.",2026-06-08 16:29:16,True,107,False,True,4,Google Play,English,Negative,General,1852
d3c797f0-5ce9-44cb-b126-db7977c656c7,Khairul Nizam80,good app,5,0,0.9.47,2026-06-01 08:11:05,"Hi, thanks for the 5 stars! We’re glad you’re having a positive experience with MAE by Maybank2u. Stay tuned for more improvements! 🐯💛",2026-06-09 09:34:50,True,8,True,False,4,Google Play,English,Positive,General,1853
c1caed12-97e8-4654-85a2-755a70c699b4,Siti Mariam Atiq,The best,5,0,0.9.47,2026-06-01 08:09:43,"Hi, thank you for your 5-star rating! We’re happy to know you’re enjoying the MAE by Maybank2u app. Your support means a lot to us! 🐯💛",2026-06-09 09:33:58,True,8,True,False,4,Google Play,English,Positive,General,1854
727bfe16-84a7-4366-8920-fbb5505b6ee7,Azrin Affandy,hello admin why i cannot log in ya ?,1,0,0.9.46,2026-06-01 08:04:13,"Hi, sorry for the inconvenience. Based on checking, the app is operating as usual. However, we would appreciate it if you could share more details regarding the issue you experienced via Maybank - Facebook PM / X (Twitter)/Instagram DM/ M2U Live Chat (website)/ email to mgcc@maybank.com.my & our team will be happy to assist you. Thank you.",2026-06-08 16:28:31,True,36,False,False,4,Google Play,English,Neutral,General,1855
6e094682-efd3-4458-9446-bf92fb0e4769,Centi Meter,"MAE apps getting out of order. Even to most basic KWSP I-Sara, I-Suri is almost cannot be find. I has tried all payment options, search keywords Kumpul, KWSP, EPF, Employee, Employer.. none return",1,0,0.9.46,2026-06-01 08:01:47,"Hi, thank you for rating and reviewing us. We're sorry for the inconvenience cause. Please be informed that EPF payment is not available via MAE, kindly log in to the full website for the payment. Rest assured, we appreciate the feedback and it has been shared with our internal team for further improvement and enhancement in the future.",2026-06-09 09:27:09,True,196,False,False,4,Google Play,English,Neutral,General,1856
fd0fe2a5-1080-42dd-86b2-1bb1290e8c65,Fahmi Aiman,"Mcm gampang 3 dengan 4 pagi pun nk offline org minyak dh lh x de memang aku boikot siot maybank ni, jam 12 jam 3 sampai 4 pun nk offline but*",1,0,,2026-06-01 04:27:34,"Maaf atas kesulitan. Berdasarkan semakan, tiada isu dilaporkan pada masa tersebut. Tidak perlu bimbang, jika anda masih lagi mengalaminya, sila kongsikan butiran lanjut berkaitan isu tersebut melalui Maybank - Facebook PM, X (Twitter)/Instagram DM, M2U Live Chat (website), atau emel ke mgcc@maybank.com.my, & pasukan kami sedia membantu anda.",2026-06-08 16:27:56,True,141,False,False,4,Google Play,English,Neutral,General,1857
04e2fa9d-2bd0-4f42-9928-8fdcc849dc2a,ApihDIY Project,very bad service maybank menyusahkan rakyat betol xboleh nk transfer or QR,1,0,0.9.9,2026-06-01 04:24:39,"Hi, maaf atas kesulitan. Tidak perlu bimbang, kami amat menghargai sekiranya anda dapat berkongsi butiran lanjut berkaitan isu yang dialami & hubungi kami melalui Maybank - Facebook PM, X (Twitter)/Instagram DM, M2U Live Chat (website), atau emel ke mgcc@maybank.com.my, dan pasukan kami sedia membantu anda.",2026-06-08 16:27:39,True,74,False,True,4,Google Play,English,Negative,General,1858
82ed42de-63a7-4a47-b5e7-ce52f0547b6e,Wira Ismail,"App MAE tidak dapat digunakan selepas update. Maybank2u sila semak masalah ini. Sudah dua kali berlaku dalam tempoh terdekat ini. Bila klik update tidak berfungsi. Kena uninstall dan install semula, kena login semula baru boleh digunakan. App MAE tidak pernah berlaku perkara seperti selama saya gunakan. Tolong selesai masalah ini segera kerana sangat menyusahkan pengguna jika app MAE tidak dapat digunakan.",1,0,0.9.47,2026-06-01 02:00:39,"Hi, maaf di atas kesulitan. Kami hargai anda cuba langkah berikut: Settings > Apps > Google Play Store > Storage > Clear cache & Clear data. Kemudian, ulangi langkah yang sama untuk Google Play Services. Sila hubungi kami jika isu masih berterusan melalui Maybank - Facebook PM/ X (Twitter)/Instagram DM/ M2U Live Chat/ emel ke mgcc@maybank.com.my.",2026-06-08 16:27:15,True,409,False,False,4,Google Play,English,Neutral,General,1859
4fde0abf-b5b9-43ca-9b08-5a158eabdeda,Shan Sharvin,recent time can't open,3,0,0.9.47,2026-06-01 00:51:54,"Hi. Thank you for your feedback & we apologise for the inconvenience. Rest assured. Alternatively, we would appreciate it if you could share more details regarding the issue you experienced via Maybank - Facebook PM / X (Twitter)/Instagram DM/ M2U Live Chat (website)/ email to mgcc@maybank.com.my, & our team will be happy to assist you. Thank you.",2026-06-08 16:26:47,True,22,False,False,4,Google Play,English,Neutral,General,1860
0f204b86-e708-4a56-ad69-4a0b70d2a417,Mhdlqman 6561,nice apps,5,0,0.9.47,2026-06-01 00:40:01,"Hi, thank you for your 5 stars! Your support is truly appreciated! 🐯💛",2026-06-08 16:26:37,True,9,False,False,4,Google Play,English,Neutral,General,1861
a747d692-ba03-4b40-9e82-cfef012d4096,A Google user,deactivated total,1,0,0.9.46,2026-06-01 00:34:15,"Hi. We apologise for the inconvenience. Rest assured. Alternatively, we would appreciate it if you could share more details regarding the issue you experienced via Maybank - Facebook PM / X (Twitter)/Instagram DM/ M2U Live Chat (website)/ email to mgcc@maybank.com.my, & our team will review your case and assist you accordingly as soon as possible.",2026-06-08 16:26:27,True,17,False,False,4,Google Play,English,Neutral,General,77
474e7087-8818-4a17-ae82-dbb0b16093d3,Eddie,good,5,0,0.9.47,2026-05-31 23:31:09,"Hi, thank you for your 5 stars! Your support is truly appreciated! 🐯💛",2026-06-02 13:37:37,True,4,True,False,4,Google Play,English,Positive,General,1862
b98c7974-6a0c-485c-a8ef-5591cfc24736,Llynn 773,why cannot update. already 2days,1,0,0.9.47,2026-05-31 22:36:19,"Hi, we hear your concern. Please try the following steps: Go to Settings > Apps > Google Play Store > Storage > Clear cache & Clear data. Then repeat the same steps for Google Play Services. If the issue still persists reach us via Maybank Facebook PM / X (Twitter)/Instagram DM/ M2U live chat/ email to mgcc@maybank.com.my for further assistance.",2026-06-02 13:41:17,True,32,False,False,4,Google Play,English,Neutral,General,1863
8f361cc5-63dd-4523-a1a2-19c79c10fed7,Mohamad azahar Azahar,terbaik,5,0,0.9.47,2026-05-31 22:19:13,"Hi, terima kasih banyak atas 5 bintang yang diberikan. Kami berbesar hati kerana aplikasi MAE memenuhi keperluan anda. Maklum balas anda sangat bermakna buat kami. 🐯💛",2026-06-02 13:41:53,True,7,False,False,4,Google Play,English,Neutral,General,1864
b77e5bbd-5ab9-4be3-9864-38d777f93143,Asmaly Auni,cannot login mae,1,0,0.9.47,2026-05-31 22:13:46,"Hi. Thank you for your feedback & we apologise for the inconvenience. Rest assured. Alternatively, we would appreciate it if you could share more details regarding the issue you experienced via Maybank - Facebook PM / X (Twitter)/Instagram DM/ M2U Live Chat (website)/ email to mgcc@maybank.com.my, & our team will be happy to assist you. Thank you.",2026-06-02 13:45:41,True,16,False,False,4,Google Play,English,Neutral,General,1865
e67713f0-4b22-4518-940e-4733b3a26df9,Rosli S,good experience,5,0,0.9.47,2026-05-31 21:34:30,"Hi, thanks for the 5-star feedback! We’re glad you’re enjoying the app and we’ll continue to improve for you. 🐯💛",2026-06-02 13:51:49,True,15,True,False,4,Google Play,English,Positive,General,1866
832c7d0c-d767-4840-aab7-609ec09c2000,Nordalila Borhanuddin,"i don't know about these apps repeating the same thing to ask for installation ,when we already install they can't open.blank",1,0,0.9.47,2026-05-31 21:19:30,"Hi, sorry for the inconvenience. Rest assured, please refer the following steps: Android: Settings > 'Apps' > MAE > Force stop > Storage > Clear data/cache. Then, restart the device. Do reach us if the issue persists via Maybank - Facebook PM / X (Twitter)/Instagram DM/ M2U Live chat (website)/ email to mgcc@maybank.com.my for further assistance.",2026-06-02 13:53:08,True,125,False,False,4,Google Play,English,Neutral,General,1867
4dc248e3-3578-447d-8711-f56607001b55,Nanthini Devi,"I'm not sure why, when I click on Maybank app, it straight bring me to the play store, to continue get it on play. But I did install it from Google play. please fix this issue and get back to me.",1,0,0.9.47,2026-05-31 17:55:53,"Hi, we hear your concern. Please try the following steps: Go to Settings > Apps > Google Play Store > Storage > Clear cache & Clear data. Then repeat the same steps for Google Play Services. If the issue still persists reach us via Maybank Facebook PM / X (Twitter)/Instagram DM/ M2U live chat/ email to mgcc@maybank.com.my for further assistance.",2026-06-02 14:00:40,True,195,False,True,4,Google Play,English,Negative,General,1868
ad50212e-68e6-443a-b17d-48be6c5b8eb7,Hasnita Musa,can't update,2,0,0.9.47,2026-05-31 16:45:59,"Hi, we hear your concern. Please try the following steps: Go to Settings > Apps > Google Play Store > Storage > Clear cache & Clear data. Then repeat the same steps for Google Play Services. If the issue still persists reach us via Maybank Facebook PM / X (Twitter)/Instagram DM/ M2U live chat/ email to mgcc@maybank.com.my for further assistance.",2026-06-02 14:01:42,True,12,False,False,4,Google Play,English,Neutral,General,1869
ff068612-5610-44d0-9e8f-45481327667d,Simi Li,Extremely slow response to login into the Maybank website for banking activity. Need to improve on website processing time response.,1,0,,2026-05-31 16:40:31,"Hi, sorry for inconvenience. Alternatively, please refresh the browser by performing clear cache/delete browsing history /cookie/data. *Select 'All Time' from the time range column. Try again. Do reach us if the issue persists via Maybank - Facebook PM / X (Twitter)/Instagram DM/ M2U Live Chat/ email to mgcc@maybank.com.my for further assistance.",2026-06-02 14:05:30,True,132,False,True,4,Google Play,English,Negative,General,1870
c8fade35-5f4a-4115-8075-0914a10604d8,Kurnia Pem,good,5,0,0.9.47,2026-05-31 15:31:25,"Hi, thank you for your 5-star rating! We’re happy to know you’re enjoying the MAE app. Your support means a lot to us! 🐯💛",2026-06-02 17:22:05,True,4,True,False,4,Google Play,English,Positive,General,1871
3511865d-fb91-45dd-9355-7fbdf662b543,Nyan Saad,senang sudah ada mae ni semua dihujung jari,5,0,0.9.47,2026-05-31 13:12:59,"Hi, terima kasih atas sokongan dan 5 bintang yang diberikan! Kami akan terus berusaha memastikan pengalaman perbankan anda lebih mudah dan menyenangkan. 🐯💛",2026-06-05 07:40:19,True,43,False,False,4,Google Play,English,Neutral,General,1872
63775219-d3a0-40f3-8673-899b20419a30,Wei Kang Lee,Share to google drive is not working edit: share receipt share button is not working agaib,1,0,0.9.46,2026-05-31 11:19:21,"Hi, sorry for the inconvenience. Rest assured, please refer the following steps: Android: Settings > 'Apps' > MAE > Force stop > Storage > Clear data/cache. Then, restart the device. Do reach us if the issue persists via Maybank - Facebook PM / X (Twitter)/Instagram DM/ M2U Live chat (website)/ email to mgcc@maybank.com.my for further assistance.",2026-06-05 07:41:32,True,90,False,False,4,Google Play,English,Neutral,General,1873
a3c4a7b3-909b-4581-8afb-f5c9c499c9c1,Syaa,best apps for saving money long term money,5,0,0.9.46,2026-05-31 11:17:16,"Hi, thank you for your 5-star rating! Your positive experience means a lot to us and inspires our team to keep enhancing the app to make everyday banking even smoother and more enjoyable. Thank you for choosing Maybank! 🐯💛",2026-06-05 07:41:48,True,42,True,False,4,Google Play,English,Positive,General,1874
331e1640-75ac-461a-a1ac-53c23d89849c,Yahaya Johari,very good,5,0,0.9.47,2026-05-31 11:15:38,Hi. Many thanks for your kind 5-star rating. We’re happy to have you with us and glad you’re enjoying the MAE app. Your support matters to us! 🐯💛,2026-06-05 07:42:01,True,9,True,False,4,Google Play,English,Positive,General,1875
bf080302-1b02-4f3d-b0ce-c1dd3cb558ba,Ninana,Kenapa selalu suruh update from google store. bila nak update tak boleh!,1,0,0.9.1,2026-05-31 11:05:43,"Hi, maaf di atas kesulitan. Kami hargai anda cuba langkah berikut: Settings > Apps > Google Play Store > Storage > Clear cache & Clear data. Kemudian, ulangi langkah yang sama untuk Google Play Services. Sila hubungi kami jika isu masih berterusan melalui Maybank - Facebook PM/ X (Twitter)/Instagram DM/ M2U Live Chat/ emel ke mgcc@maybank.com.my.",2026-06-05 07:42:54,True,72,False,False,4,Google Play,English,Neutral,General,1876
57d6ca0f-421e-4eb0-9928-876df18e4eec,Hadibah Othman,Good,5,0,,2026-05-31 10:56:14,"Hi. Your 5-star review made our day. We’re delighted that you’re enjoying the MAE app, and we appreciate your continued support. 🐯💛",2026-06-05 07:43:12,True,4,True,False,4,Google Play,English,Positive,General,1877
e44cafc8-b0d1-4c9e-9e0f-17fd3148aff8,Zatil Rashid,very good,5,0,0.9.47,2026-05-31 10:53:21,"Hi. Thank you for the 5 stars! We’re glad the MAE app is serving you well, and we truly value your feedback and encouragement. 🐯💛",2026-06-05 07:43:28,True,9,True,False,4,Google Play,English,Positive,General,1878
5a7bb170-4152-447a-bf37-6bf46221f006,Tajul Muluk,Sebelum ini boleh updated di App Market dan Google Play. kini bila updated di App Market terus tidak boleh buka app maybank2u. ini membeban dan menyusahkan pengguna...,1,0,0.9.47,2026-05-31 10:06:54,"Hi, maaf di atas kesulitan. Kami hargai anda cuba langkah berikut: Settings > Apps > Google Play Store > Storage > Clear cache & Clear data. Kemudian, ulangi langkah yang sama untuk Google Play Services. Sila hubungi kami jika isu masih berterusan melalui Maybank - Facebook PM/ X (Twitter)/Instagram DM/ M2U Live Chat/ emel ke mgcc@maybank.com.my.",2026-06-05 07:44:20,True,167,False,False,4,Google Play,English,Neutral,General,1879
56221957-214e-40d6-a1fa-54655641f451,Jamli Drahman,capaian kurang memuaskan..,1,0,0.9.47,2026-05-31 09:30:34,"Hi, maaf atas kesulitan. Tidak perlu bimbang, kami amat menghargai sekiranya anda dapat berkongsi butiran lanjut berkaitan isu yang dialami & hubungi kami melalui Maybank - Facebook PM, X (Twitter)/Instagram DM, M2U Live Chat (website), atau emel ke mgcc@maybank.com.my, dan pasukan kami sedia membantu anda.",2026-06-05 07:45:24,True,26,False,False,4,Google Play,English,Neutral,General,1880
662fad1f-2634-438e-b58c-80b30925d982,FOO CS,"Why this app keep want me to update ? But go to the app store can't update need to uninstall & reinstall to keep the app running smoothly What's going on , please fix it Really bad experience 😡🤦",1,0,,2026-05-31 09:25:21,"Hi, we hear your concern. Please try the following steps: Go to Settings > Apps > Google Play Store > Storage > Clear cache & Clear data. Then repeat the same steps for Google Play Services. If the issue still persists reach us via Maybank Facebook PM / X (Twitter)/Instagram DM/ M2U live chat/ email to mgcc@maybank.com.my for further assistance.",2026-06-05 07:45:41,True,194,True,True,4,Google Play,English,Negative,General,1881
0b04ef03-d7b1-4f57-a5f4-632ea243cd8a,Azlinah Azlinahabdulrashid,good very easy to pay.,5,0,0.9.47,2026-05-31 08:05:58,Hi. Thanks a lot for the 5-star rating! We’re happy to know you’re enjoying the MAE app. Your support truly means a great deal to us. 🐯💛,2026-06-05 07:46:57,True,22,True,False,4,Google Play,English,Positive,General,1882
52742ad4-e8aa-449b-8fcc-bbe30986bf47,सोम लोप्चन,good app mobile banking,5,0,0.9.47,2026-05-31 07:36:20,Hi. We’re delighted to see your 5-star rating. Your support keeps us motivated. Happy to hear you’re enjoying the MAE App! 🐯💛,2026-06-05 07:48:00,True,23,True,False,4,Google Play,English,Positive,General,1883
d64fb69d-7515-42a7-9726-2409ee823cf4,aurora emith,one of my main bank account..easy and convenient,5,0,0.9.46,2026-05-31 06:23:07,Hi. Thank you for your positive feedback! We’re glad you’re enjoying the MAE App experience.🐯💛,2026-06-05 07:49:13,True,48,True,False,4,Google Play,English,Positive,General,1884
4dc3894d-2ffb-4ae1-970f-efa723b96b87,Saraí,"Una aplicación bancaria muy práctica y confiable. Me permite realizar transferencias, pagos y consultas de saldo de forma rápida y segura. La interfaz es intuitiva y facilita mucho la gestión de mis finanzas a diario.",5,0,0.9.47,2026-05-31 03:36:33,"Hi, thank you for the 5-star review! We’re thrilled to hear that MAE by Maybank2u have been making your banking experience smooth, secure, and convenient. Your continued trust and support over the years mean a lot to us, and we’ll keep working hard to deliver the reliable service you deserve. 🐯💛",2026-06-05 07:49:27,True,217,False,False,4,Google Play,English,Neutral,General,1885
a5d26571-a071-4bee-958a-5052e7254e38,Syafiq Hisham,my phone fold 7 could not load app after latest phone update... can help pleaseee??? need to do payment for bills and etc,1,0,0.9.47,2026-05-31 02:52:49,"Hi, sorry for the inconvenience. Rest assured, please refer the following steps: Android: Settings > 'Apps' > MAE > Force stop > Storage > Clear data/cache. Then, restart the device. Do reach us if the issue persists via Maybank - Facebook PM / X (Twitter)/Instagram DM/ M2U Live chat (website)/ email to mgcc@maybank.com.my for further assistance.",2026-06-05 07:49:45,True,121,False,False,4,Google Play,English,Neutral,General,1886
cc5f1e22-33e4-4d5d-a1a1-5a0705176a9d,Mike G,"everytime I make a fund transfer I have to key in my password 3-4 times? on top of the 6 digit pin, so that makes a total of keying in a code 4-5 times? please look into this because it's honestly ridiculous and makes the app so frustrating to use",1,0,0.9.46,2026-05-31 01:13:50,"Hi. We sincerely apologise for the inconvenience caused. Rest assured. To assist you with this matter, kindly reach out to us with more details via Maybank - Facebook PM, X (Twitter)/Instagram DM, M2U Live Chat, or email us at mgcc@maybank.com.my. Our team will review your case and assist you accordingly as soon as possible.",2026-06-05 07:50:43,True,247,False,False,4,Google Play,English,Neutral,General,1887
01812946-0094-4442-a435-748e861ebd2e,比尔LoopeyVinz,A new and fun UI.... Easier to understand. Definitely better than the old Web page mbb2u.,5,0,,2026-05-31 00:49:09,Hi. It warms our hearts to receive such positive feedback. We are delighted to find that our mobile app is user-friendly. 🐯💛,2026-06-05 07:50:56,True,89,False,False,4,Google Play,English,Neutral,General,1888
f9450ee1-339d-4fb9-9e71-d89dc8cb1cae,Hafiz Leo,good,4,0,0.9.47,2026-05-31 00:09:49,Hi. Thank you for the 5 stars rating! Your review brightened our day. Happy banking with the MAE App! 🐯💛,2026-06-05 07:51:07,True,4,True,False,4,Google Play,English,Positive,General,1889
7fe579bf-48a3-4eff-9e42-40bf5bc45fa1,Narita Mashito,kenapa setiap kali nk guna kne log in ni? susah btul nk guna. tolong jawap kenapa,2,0,0.9.46,2026-05-30 23:58:21,"Lazimnya, bagi tujuan keselamatan anda perlu lakukan log masuk. Tidak perlu bimbang, kami amat menghargai sekiranya anda dapat berkongsi butiran lanjut berkaitan isu yang dialami & hubungi kami melalui Maybank - Facebook PM, X (Twitter)/Instagram DM, M2U Live Chat (website), atau emel ke mgcc@maybank.com.my, dan pasukan kami sedia membantu anda.",2026-06-04 23:42:31,True,81,False,False,4,Google Play,English,Neutral,General,1890
3614c2b1-4c63-48ed-a669-790250f18b17,Mohd Rofzan Yong,Part lain semua ok cuma part takleh screen shot betul2 menyusah kan.,1,0,,2026-05-30 23:22:42,"Hi. Maaf di atas kesulitan. Inisiatif ini merupakan salah satu langkah mitigasi terkini kami dalam memastikan keselamatan akses serta maklumat akaun pelanggan melalui platform aplikasi MAE. Sekiranya anda perlu berkongsi resit pindahan wang kepada penerima, anda dikehendaki menggunakan fungsi 'Share Receipt'. Terima kasih.",2026-06-04 23:40:09,True,68,False,False,4,Google Play,English,Neutral,General,1891
1ff0b836-b4e2-4812-b822-56a763ee2370,Junaidi Sjofjan,this apps keep asking to update tapi x boleh update ... hampeh betul la,1,0,,2026-05-30 22:57:40,"Hi, maaf di atas kesulitan. Kami hargai anda cuba langkah berikut: Settings > Apps > Google Play Store > Storage > Clear cache & Clear data. Kemudian, ulangi langkah yang sama untuk Google Play Services. Sila hubungi kami jika isu masih berterusan melalui Maybank - Facebook PM/ X (Twitter)/Instagram DM/ M2U Live Chat/ emel ke mgcc@maybank.com.my.",2026-06-04 23:39:39,True,71,False,False,4,Google Play,English,Neutral,General,1892
