review_user_id,app_id,app_version,rating,review_text,review_source,language,sentiment,complaint_category,developer_reply,thumbs_up_count,review_date,developer_reply_date,positive_review,negative_review
1705,4,0.9.47,1,"13 jun 2026,dri pukul 12, 12jun2026 sampai pagi 13jun2026 pukul 8.18 tak boleh transfer duittttt !!!! maintenance apa kau lama² ????",Google Play,English,Neutral,None,True,0,2026-06-13 08:18:59,2026-06-16 01:42:39,False,False
1706,4,0.9.47,5,Convenient banking app that makes transactions easy.,Google Play,English,Positive,None,True,0,2026-06-13 06:47:02,2026-06-16 01:41:55,True,False
1707,4,0.9.47,5,"The best online Banking apps... easy and fast, love you maybank.. long live Maybank! yehaaa",Google Play,English,Positive,None,True,0,2026-06-13 06:29:17,2026-06-16 01:41:26,True,False
1708,4,0.9.47,1,still problem when connection fast,Google Play,English,Negative,Other,True,0,2026-06-12 23:43:58,2026-06-16 01:40:30,True,True
1709,4,0.9.47,5,very useful app...easy to use,Google Play,English,Positive,None,True,0,2026-06-12 23:35:43,2026-06-16 01:34:59,True,False
1710,4,0.9.47,5,good,Google Play,English,Positive,None,True,0,2026-06-12 22:15:49,2026-06-16 01:34:11,True,False
1711,4,,5,"Maybank2u is a convenient and reliable online banking platform that makes managing finances easy. The app and website are user-friendly, allowing me to transfer funds, pay bills, check account balances, and perform banking transactions anytime and anywhere. I appreciate the security features and the overall smooth banking experience. Overall, Maybank2u is an efficient platform for everyday banking needs.",Google Play,English,Positive,None,True,0,2026-06-12 14:47:53,2026-06-16 00:27:37,True,False
1712,4,0.9.47,2,im very disappointed. suddenly transaction receipts not in file management. can share the receipt but cannot save,Google Play,English,Neutral,None,True,0,2026-06-12 09:51:44,2026-06-16 00:18:52,False,False
1713,4,0.9.47,5,just 250 myr to open bank account very easy to apply,Google Play,English,Positive,None,True,0,2026-06-12 09:03:49,2026-06-16 00:16:36,True,False
1714,4,,5,"I've been using the Maybank2u app for a long time, and it makes managing my banking much easier. Checking my balance, transferring money, and paying bills can all be done quickly from my phone. The app is convenient, easy to navigate, and works well for my daily banking needs.",Google Play,English,Positive,None,True,0,2026-06-11 22:25:47,2026-06-15 07:02:03,True,False
1715,4,0.9.46,5,easy and convinient for my business transaction.,Google Play,English,Positive,None,True,0,2026-06-11 20:14:03,2026-06-15 06:57:25,True,False
1716,4,0.9.47,1,unable to open latest version MAE app with Samsung S24 after UI 8.5 update,Google Play,English,Neutral,None,True,0,2026-06-11 19:01:01,2026-06-23 10:04:23,False,False
1717,4,0.9.47,5,very convinient banking app . QR works well and great helpful app,Google Play,English,Positive,None,True,0,2026-06-11 15:02:26,2026-06-15 06:47:04,True,False
1718,4,,5,Convenient banking app that makes transactions simple and secure. just the back button always shows to exit app which is not so convenient.,Google Play,English,Positive,None,True,0,2026-06-11 13:43:29,2026-06-15 06:45:54,True,False
1719,4,0.9.47,3,kenapa banyak masalah apps mae sekarang ni?,Google Play,English,Neutral,None,True,0,2026-06-11 12:53:29,2026-06-15 06:44:27,False,False
1720,4,0.9.47,1,"Apps paling x berguna..x mcm apps maybank2u dulu..yg ni tiba2 dia suruh tukar password kita x reset password pun...saya dalam masa 2 bulan kena tukar 3x password smpai dah lupa dah password yg terbaru ni....pttnya dia x layak dapat satu bintang pun..menyusahkan penguna,apps bank kot ni..bukan apps parking majlis perbandaran. .sepertia biasa kepala hotak hang...aku ni guna maybank dah lama..maybank 2u dulu x mcm ni..ni hr ni kena lg tukaq password...bodo la dr elok2 guna maybank2u..system bodo",Google Play,English,Neutral,None,True,0,2026-06-11 12:34:29,2023-02-22 10:05:16,False,False
1721,4,0.9.46,5,satisfield,Google Play,English,Neutral,None,True,0,2026-06-11 10:18:57,2026-06-15 06:40:38,False,False
1722,4,0.9.47,5,good,Google Play,English,Positive,None,True,0,2026-06-11 09:15:42,2026-06-15 06:40:06,True,False
1723,4,0.9.47,5,trusted tq mybank,Google Play,English,Neutral,None,True,0,2026-06-11 09:03:25,2026-06-15 06:39:19,False,False
1724,4,0.9.47,4,Maybank.... boleh tak letak Option untuk tulis reference bila bayaq guna QR code... terima kasih,Google Play,English,Neutral,None,True,0,2026-06-11 08:36:57,2026-06-15 06:38:01,False,False
1725,4,0.9.47,5,good apps,Google Play,English,Positive,None,True,0,2026-06-11 07:49:43,2026-06-15 06:16:43,True,False
1726,4,0.9.46,5,good,Google Play,English,Positive,None,True,0,2026-06-11 04:06:46,2026-06-15 04:26:06,True,False
1727,4,0.9.47,5,"MAE is reliable and convenient for everyday banking. Most transactions can be done within a few taps. I like their Tabung feature, where money can be automatically deducted from my main account and transferred to my savings account.",Google Play,English,Positive,None,True,0,2026-06-11 00:18:13,2026-06-15 04:25:22,True,False
1728,4,,5,"Maybank2u makes banking simple and convenient. Transactions are quick, and managing finances has never been easier.",Google Play,English,Positive,None,True,0,2026-06-10 22:08:41,2026-06-15 04:24:37,True,False
1729,4,0.9.47,5,"​A highly reliable banking app with excellent security features. The layout is clean, transfers are instant, and paying bills is incredibly convenient.",Google Play,English,Positive,None,True,0,2026-06-10 20:52:08,2026-06-15 04:23:32,True,False
1730,4,0.9.46,5,fav bank all time,Google Play,English,Neutral,None,True,0,2026-06-10 20:38:30,2026-06-15 04:22:55,False,False
1731,4,0.9.47,5,Easy banking and secure transactions anytime,Google Play,English,Positive,None,True,0,2026-06-10 17:38:51,2026-06-15 04:20:37,True,False
1732,4,0.9.47,5,senang Dan mudah urusan,Google Play,English,Neutral,None,True,1,2026-06-10 17:36:15,2023-12-06 10:09:43,False,False
1733,4,0.9.46,5,i can use my withdrawal method now thank u... and people who read my review if u guys want to withdraw your money on atm u need to apply for the visa card first so u can withdraw your money on atm machine... And if u need help just chat there Facebook page...,Google Play,English,Neutral,None,True,1,2026-06-10 13:30:38,2026-05-12 18:24:35,False,False
1734,4,0.9.47,1,"better switching to other bank now, app will force android 11 update soon..",Google Play,English,Neutral,None,True,3,2026-06-10 12:06:01,2026-06-23 08:47:39,False,False
1735,4,0.9.47,3,Why hotlink is not available to purchase a credit?,Google Play,English,Neutral,None,True,0,2026-06-10 11:05:55,2026-06-15 04:01:02,False,False
1736,4,0.9.47,1,bad services,Google Play,English,Negative,Other,True,0,2026-06-10 11:01:27,2026-06-15 03:58:32,False,True
1737,4,0.9.47,1,Cant Register MAE in LenovoIdea Tab. Installed the app from play store and installation is success. But cant click anything in the field as the system not responding. How to fix this issue? I have tried the same in Samsung Tablet as well but the same issue. Im using the latest Android version 16 but still failed in both android tablet. Dissapointing big name Bank Maybank. :(,Google Play,English,Negative,Other,True,0,2026-06-10 10:49:51,2026-06-15 03:57:41,False,True
1738,4,0.9.46,5,now very good 👍🏻😊,Google Play,English,Positive,None,True,0,2026-06-10 01:55:49,2026-05-18 17:15:41,True,False
1739,4,0.9.47,5,good Maybank,Google Play,English,Positive,None,True,0,2026-06-10 00:06:33,2026-06-15 03:50:51,True,False
1740,4,0.9.47,1,always lag,Google Play,English,Neutral,None,True,0,2026-06-09 17:28:55,2026-06-15 03:42:11,False,False
1741,4,,1,good,Google Play,English,Positive,None,True,0,2026-06-09 11:42:32,2026-06-15 03:39:04,True,False
1742,4,0.9.46,5,"Maybank2u is very convenient for daily banking. I can do transfers, pay bills, and check transactions easily from my phone. I like using Maybank2u because it makes banking simple and securely",Google Play,English,Positive,None,True,0,2026-06-09 06:18:28,2026-06-15 03:35:02,True,False
1743,4,,5,why always say update not from play store.,Google Play,English,Neutral,None,True,0,2026-06-09 04:18:58,2026-06-08 16:26:09,False,False
1744,4,,5,The app is super friendly and reliable. Can be trusted and all transactions very smoothly done. This app is own by the biggest bank in Malaysia.,Google Play,English,Positive,None,True,0,2026-06-09 04:03:59,2026-06-15 03:33:04,True,False
1745,4,0.9.46,5,maybank2u is great banking apps with friendly user functions,Google Play,English,Positive,None,True,0,2026-06-09 01:58:02,2026-06-15 03:30:37,True,False
1746,4,0.9.47,3,sluggish money transfer and qr payment it is not instant has delays hope u can guys can optimize it,Google Play,English,Neutral,None,True,0,2026-06-09 00:51:26,2026-06-15 02:30:27,False,False
1747,4,,5,"I have had a pleasant experience using this app. Its main highlight is the secure and user-friendly online banking platform, which makes managing finances simple and efficient. It enables me to carry out a wide range of banking activities with ease. The app is reliable and offers strong security features that help protect users' transactions.",Google Play,English,Positive,None,True,0,2026-06-08 18:43:12,2026-06-15 02:16:49,True,False
1748,4,0.9.47,5,very good,Google Play,English,Positive,None,True,0,2026-06-08 18:18:41,2026-06-15 02:14:44,True,False
1749,4,0.9.47,5,App is highly reliable smooth and handle my daily transaction,Google Play,English,Positive,None,True,0,2026-06-08 17:58:33,2026-06-15 02:10:57,True,False
1750,4,0.9.47,4,bagus sebab sentiasa up to date tingkatkan keselamatan..cuma dari segi keburukannya leceh sebab ada masa kena setiap masa kena masukkan password 3 4 kali...,Google Play,English,Neutral,None,True,0,2026-06-08 17:45:39,2026-06-15 02:10:20,False,False
1751,4,0.9.47,5,"Maybank2u makes banking simple and convenient. Fast transactions and a user-friendly interface.""",Google Play,English,Positive,None,True,0,2026-06-08 17:43:26,2026-06-15 02:07:05,True,False
1752,4,0.9.47,5,Maybank2u is a reliable banking app that makes online transactions quick and easy. I appreciate the secure system and smooth user experience. Paying bills and transferring money is very convenient with this app.,Google Play,English,Positive,None,True,0,2026-06-08 17:10:04,2026-06-15 02:06:22,True,False
1753,4,0.9.46,5,good apps for sure,Google Play,English,Positive,None,True,0,2026-06-08 16:35:22,2026-06-15 02:04:13,True,False
1754,4,,1,"This app keep having problem with ""some features are temporarily unavailable"" issue which is not once but it happens many times.",Google Play,English,Negative,Other,True,0,2026-06-08 16:15:54,2026-06-15 02:03:19,False,True
1755,4,0.9.47,5,"user-friendly interface and useful features. The app makes it easy to transfer funds, pay bills, check account balances, and manage finances anytime. Transactions are processed smoothly, and the security features give me confidence when using the service. Highly recommended for everyday banking needs.",Google Play,English,Positive,None,True,0,2026-06-08 15:23:43,2026-06-15 02:01:48,True,False
1756,4,0.9.47,1,واجهة التطبيق سيئة ومحاولة الرجوع تظهر خيار غلق التطبيق,Google Play,English,Neutral,None,True,2,2026-06-08 13:54:47,2025-06-08 16:47:48,False,False
1757,4,0.9.47,5,"Aplikasi perbankan yang sangat mudah dan praktikal. Semua urusan boleh dibuat dalam satu tempat.""",Google Play,English,Neutral,None,True,0,2026-06-08 12:12:14,2026-06-15 01:53:44,False,False
1758,4,0.9.47,5,Reliable banking app with easy access to everyday financial transactions.,Google Play,English,Positive,None,True,0,2026-06-08 11:47:27,2026-06-15 01:53:07,True,False
1759,4,,5,Reliable and convenient for everyday banking. The app helps me manage my finances anytime and anywhere.,Google Play,English,Positive,None,True,0,2026-06-08 09:19:00,2026-06-15 01:49:50,True,False
1760,4,0.9.47,3,"recently my Mae app suddenly crashed. Whenever I try to get into the app to pay, it won't let me be and I get kicked out instead for several times then only after a multiple try I can finally use it. It's hard to use when needed. I love this app please try to fix it thanks.",Google Play,English,Negative,Payment Issues,True,0,2026-06-08 09:01:57,2026-06-15 01:48:09,True,True
1761,4,,5,"Excellent banking app with smooth transactions, secure features, and user friendly interface. Easy to transfer money, pay bills, and manage accounts anytime, anywhere.",Google Play,English,Positive,None,True,0,2026-06-08 07:32:25,2026-06-15 01:41:56,True,False
1762,4,0.9.46,5,"Maybank is a reliable and well-designed banking app that makes managing finances simple and convenient. The app offers a wide range of features such as fund transfers, bill payments, account monitoring, and card management, all in one place. I appreciate the secure login system and smooth performance, which make banking transactions quick and hassle-free. Overall, Maybank provides an excellent digital banking experience. Highly recommended!",Google Play,English,Positive,None,True,0,2026-06-08 02:21:49,2026-06-15 01:40:54,True,False
1763,4,0.9.46,5,Reliable banking app with secure transactions and useful financial management tools. Very convenient for daily banking.,Google Play,English,Positive,None,True,0,2026-06-08 01:43:17,2026-06-15 01:39:42,True,False
1764,4,0.9.35,5,"Maybank2u is reliable and convenient for online banking. It allows easy transfers, bill payments, and account management anytime.",Google Play,English,Positive,None,True,0,2026-06-08 00:06:55,2026-06-15 01:31:29,True,False
1765,4,,5,This app is very fast and responsive. I use this all the times for qr buying and transfers. Very secure for saving and transfers. The page is very neat and easy to use.,Google Play,English,Positive,None,True,0,2026-06-07 23:53:31,2026-06-15 01:29:44,True,False
1766,4,0.9.47,1,System sangat menyebalkan..tarik duit loan kereta sampai 2 kali untuk sebulan..memang x bole buat saving kat sini..suka2 hati tarik lebih 😡😡😤,Google Play,English,Neutral,None,True,0,2026-06-07 21:07:49,2026-06-15 01:14:21,False,False
1767,4,,5,easy to use,Google Play,English,Positive,None,True,0,2026-06-07 20:22:25,2026-06-15 01:11:46,True,False
1768,4,0.9.46,5,good app mybank,Google Play,English,Positive,None,True,0,2026-06-07 19:44:34,2026-06-15 01:10:32,True,False
1769,4,0.9.47,1,How come my MAE app won't pop out the transaction approval page for me to approve transactions when online purchase?,Google Play,English,Neutral,None,True,0,2026-06-07 11:40:19,2026-06-15 01:07:50,False,False
1770,4,0.9.47,1,terrible,Google Play,English,Neutral,None,True,0,2026-06-06 21:52:54,2026-06-09 16:19:08,False,False
1771,4,0.9.47,1,what is wrong with this apps many times can't open,Google Play,English,Neutral,None,True,0,2026-06-06 20:12:58,2026-06-09 16:18:38,False,False
1772,4,,3,it's not good..saya apply E-wallet lepastu tak blh log in..padahal username sama password betul sudah..lepastu masa first daftar e wallet dia dapat masuk tapi setting scan semua tu tidak dapat... please fix that..,Google Play,English,Positive,None,True,0,2026-06-06 18:24:19,2026-06-09 16:16:53,True,False
1773,4,0.9.47,1,"It's been about a month since the app started acting up when I tried to log in, I updated it but it's still the same thing, I've uninstalled and reinstalled it and it's still the same thing",Google Play,English,Neutral,None,True,0,2026-06-06 13:18:49,2026-06-09 16:12:59,False,False
1774,4,0.9.46,5,Perbank kan yg sy suka,Google Play,English,Neutral,None,True,0,2026-06-06 04:46:34,2026-06-09 16:10:25,False,False
1775,4,0.9.46,1,stupid service down makes me can't paid for burger,Google Play,English,Neutral,None,True,0,2026-06-06 01:00:29,2026-06-09 16:09:09,False,False
1776,4,0.9.47,1,cant use qr and transfer..1 day waiting for the service,Google Play,English,Neutral,None,True,0,2026-06-05 23:56:31,2026-06-09 16:07:26,False,False
1777,4,0.9.47,1,error most of the time,Google Play,English,Negative,Performance,True,0,2026-06-05 22:48:55,2026-06-09 16:03:10,False,True
1778,4,0.9.47,1,nak redeem tp pun susah.,Google Play,English,Neutral,None,True,1,2026-06-05 20:27:08,2026-06-09 16:02:31,False,False
1779,4,0.9.46,1,call customer service tak pernah jawab🤡,Google Play,English,Neutral,None,True,0,2026-06-05 14:07:28,2026-06-09 15:58:20,False,False
1780,4,0.9.46,1,"Your banking app is one of the worst banking app available and that I have ever use. always wasting my phone storage space by non stop upgrading, but the service?👎🏻👎🏻👎🏻everytime queueing to pay for food or shopping, the whole qr system will just hang or lagging or simply don't work!!! need to keep uninstalling and installing again. what's the point of upgrading if the service is this lousy?!?!🤬🤬🤬🤬 if there are negative star rating, I would have give -100 ratings!",Google Play,English,Negative,Account Access,True,1,2026-06-05 13:43:48,2026-06-09 15:55:21,False,True
289,4,0.9.47,1,macam anjir nak qr pun susah nak scan.. sampah punya app,Google Play,English,Neutral,None,True,0,2026-06-05 13:26:10,2026-06-09 15:53:54,False,False
1781,4,,3,I'm not sure why I couldn't receive money through my qr code. I've registered my duitnow id already.. idk what I did wrong..,Google Play,English,Neutral,None,True,0,2026-06-05 13:13:28,2026-06-09 15:52:53,False,False
1782,4,0.9.46,5,The app is good and glad that they have new updates 😃,Google Play,English,Positive,None,True,0,2026-06-05 12:59:35,2026-06-09 15:51:18,True,False
1783,4,0.9.47,5,👍💯,Google Play,English,Neutral,None,True,0,2026-06-05 10:33:23,2026-06-09 15:45:07,False,False
1784,4,0.9.47,5,"Best apps, recommend for those want planning monthly budget, hopefully will improving better for everyone. May you all Maybank members success , if you need some help , tell me yahh, May god bless all of us any.",Google Play,English,Positive,None,True,0,2026-06-05 08:57:21,2026-06-09 15:43:32,True,False
1785,4,,5,smooth back to normal as before ..,Google Play,English,Positive,None,True,0,2026-06-05 08:09:11,2026-06-09 15:41:46,True,False
1786,4,,1,can't open keep exit from the app,Google Play,English,Neutral,None,True,0,2026-06-05 07:56:03,2026-06-09 15:40:33,False,False
1787,4,0.9.46,5,GOOD EASY FOR COMMUNICATION,Google Play,English,Positive,None,True,0,2026-06-05 06:57:25,2026-06-09 15:38:27,True,False
1788,4,,5,"Maybank2u (MAE) is an exceptional digital banking tool that becomes your all-in-one lifestyle assistant. As a daily user, this app helps me alot regarding how to handle my money. Such as the ""Expenses"" tracker that automatically categorises my spending to keep my budget on point, while the ""Tabung"" feature makes saving much easier and effortlessly automated. The security is also top-notch with features like biometric login and Secure2u ensure every transaction is fast yet safely authenticated.",Google Play,English,Positive,None,True,0,2026-06-05 03:46:31,2026-06-09 15:36:11,True,False
1789,4,0.9.46,5,"With maybank2u i can transfer money,pay bills and manage my finance quickly.",Google Play,English,Neutral,None,True,0,2026-06-05 00:10:38,2026-06-09 15:30:56,False,False
1790,4,0.9.47,1,how come the app so laggy sometimes ?????,Google Play,English,Neutral,None,True,0,2026-06-04 21:59:26,2026-06-09 15:30:00,False,False
1791,4,0.9.46,5,"MAE by Maybank2u sangat memudahkan urusan perbankan harian. Transfer DuitNow Instant laju dan percuma, scan QR untuk bayar pun mudah. Aplikasi stabil, ciri keselamatan seperti Secure2u dan Secure Verification buat transaksi rasa selamat. Antara muka kemas, semua maklumat kewangan jelas di satu tempat.",Google Play,English,Positive,None,True,0,2026-06-04 21:10:48,2026-06-09 15:28:19,True,False
1792,4,,5,very good service,Google Play,English,Positive,None,True,0,2026-06-04 17:36:08,2026-06-09 15:19:10,True,False
1793,4,0.9.46,5,I love this app because it's very convenient to use and have a lot of features that i can use.,Google Play,English,Positive,None,True,0,2026-06-04 17:07:08,2026-06-09 15:16:55,True,False
1794,4,0.9.47,1,I can't open it now. Evrytime I click on it it load and close. It crash,Google Play,English,Negative,Performance,True,0,2026-06-04 17:01:34,2026-06-09 15:15:52,False,True
1795,4,0.9.47,5,paduu🔥🔥,Google Play,English,Neutral,None,True,0,2026-06-04 16:45:59,2026-06-09 15:15:11,False,False
1796,4,0.9.47,1,cannot share receipt. why?,Google Play,English,Neutral,None,True,0,2026-06-04 15:54:01,2026-06-09 15:10:07,False,False
1797,4,0.9.46,5,Mae apps sngt memudahkan pengguna Dan tidak menyusahkan pengguna sngt terbaik...,Google Play,English,Neutral,None,True,0,2026-06-04 13:16:40,2026-06-09 15:04:25,False,False
1798,4,,5,"Maybank2u is a reliable banking app with comprehensive features for online banking. Transactions are fast, secure, and convenient for daily financial needs.",Google Play,English,Positive,None,True,0,2026-06-04 11:18:47,2026-06-09 15:02:42,True,False
1799,4,0.9.47,1,"I'm very sure I key in the correct MAE pin several times; it keeps showing 'Wrong pin, please try again.' "" I've reset the pin through MyKad validation several times, and it's still the same. It causes me to have difficulties making transfers.",Google Play,English,Neutral,None,True,1,2026-06-04 10:09:53,2026-06-09 15:00:29,False,False
1800,4,,1,Why do I need to uninstall daily and install back ?,Google Play,English,Neutral,None,True,0,2026-06-04 08:39:53,2026-06-09 14:57:25,False,False
1801,4,0.9.47,2,xboleh log in,Google Play,English,Neutral,None,True,0,2026-06-03 22:50:59,2026-06-08 16:48:11,False,False
1802,4,0.9.46,5,"My first Online Bank that I use to take Salary,to transfer to my Family and To buy Top up. Great and Try to Improve to make it More Convenient in the Future",Google Play,English,Positive,None,True,0,2026-06-03 21:59:27,2026-06-09 10:31:09,True,False
1803,4,0.9.47,1,skit² update,Google Play,English,Neutral,None,True,0,2026-06-03 21:59:22,2026-06-08 16:47:59,False,False
1804,4,0.9.19,1,Banking apps that have so many problems. When you/customer complain MAE just know how denial,Google Play,English,Negative,Other,True,0,2026-06-03 21:45:35,2026-06-08 16:47:47,False,True
1805,4,,4,"After I followed your instructions to go to settings & clear all cache memory, then it's Okay now.",Google Play,English,Neutral,None,True,0,2026-06-03 21:35:52,2026-06-09 10:29:27,False,False
1806,4,0.9.39,5,good,Google Play,English,Positive,None,True,0,2026-06-03 18:44:40,2026-06-09 10:25:18,True,False
1807,4,0.9.47,1,Can't updated on my realme c33.,Google Play,English,Neutral,None,True,0,2026-06-03 18:04:03,2026-06-08 16:47:03,False,False
1808,4,0.9.47,2,can use this app in my phone,Google Play,English,Neutral,None,True,0,2026-06-03 16:12:37,2026-06-08 16:46:03,False,False
1809,4,0.9.46,2,"Since the last update, it keeps stating that it wasn't installed from the Play store and cannot be updated. Deleted and reinstalled a few times already just to do some transaction is quiet inconvenience.",Google Play,English,Neutral,None,True,0,2026-06-03 16:10:09,2026-06-08 16:45:52,False,False
1810,4,,1,this time the apps are unable to update from google play. can anyone assist,Google Play,English,Neutral,None,True,0,2026-06-03 14:43:42,2026-06-08 16:45:41,False,False
1811,4,0.9.46,5,"MAE is a convenient and user-friendly banking app that makes managing finances simple. The interface is clean and easy to navigate, and features such as fund transfers, bill payments, and expense tracking work smoothly. Overall, it provides a secure and efficient digital banking experience.",Google Play,English,Positive,None,True,0,2026-06-03 13:29:11,2026-06-09 10:20:33,True,False
1812,4,0.9.47,1,good,Google Play,English,Positive,None,True,0,2026-06-03 13:18:36,2026-06-09 10:19:42,True,False
1813,4,0.9.47,1,not friendly user after change the apps .prefer the old apps easier to scan and immediately no need all the time re updtd login the web apps,Google Play,English,Neutral,None,True,0,2026-06-03 12:07:55,2026-06-08 16:45:06,False,False
1814,4,0.9.47,5,terbaikkk,Google Play,English,Neutral,None,True,0,2026-06-03 11:08:03,2026-06-09 10:19:00,False,False
1815,4,0.9.47,1,"the UI itself is not working, fix it",Google Play,English,Neutral,None,True,0,2026-06-03 09:23:56,2026-06-08 16:44:08,False,False
1816,4,0.9.47,2,"hi, i have a problem with the apps. i tried to login but it directed me to playstore and required me to update the mae apps. but when i try to update, it cannot proceed. please help.",Google Play,English,Negative,Account Access,True,0,2026-06-03 07:42:26,2026-06-08 16:43:48,False,True
1817,4,0.9.46,5,"Maybank2u is a reliable banking app that makes managing finances easy. Transactions are quick, secure, and convenient",Google Play,English,Positive,None,True,0,2026-06-03 07:06:02,2026-06-09 10:15:53,True,False
1818,4,,1,"after recently update on 3/6/26 immediately say I didn't install this app from the Google play store? what? I have using it and installed form 3 years already after updating it just say that? Maybank is getting worse every year, please fix this!",Google Play,English,Neutral,None,True,0,2026-06-03 06:54:03,2026-06-08 16:43:36,False,False
1819,4,0.9.46,5,good,Google Play,English,Positive,None,True,0,2026-06-03 02:15:58,2026-06-09 10:14:45,True,False
1820,4,0.9.47,2,asal dia auto ke home screen weii susah la mcm ni,Google Play,English,Neutral,None,True,0,2026-06-03 00:08:56,2026-06-08 16:42:57,False,False
1821,4,0.9.47,5,guna apss ni bole tahan tapi klu suda hilang na update d bank lgi I'd n passwords..,Google Play,English,Neutral,None,True,0,2026-06-02 22:41:33,2026-06-09 10:14:05,False,False
1822,4,0.9.46,2,"Transaction unable to show time, I was not able to prove my time of payment, which sucks. pls fix",Google Play,English,Neutral,None,True,0,2026-06-02 21:15:10,2026-06-08 16:41:15,False,False
