review_user_id,app_id,app_version,rating,review_text,review_source,language,sentiment,complaint_category,developer_reply,thumbs_up_count,review_date,developer_reply_date,positive_review,negative_review
1823,4,0.9.47,1,"In 2023, I complained about MAE/secure2u not able to link 2 a/c on one device. Maybank reason, for your security. Poor excuse. Today, they make it worse. To link 1 a/c, you need to go to atm. Unlink and relink another, you need to go to ATM. If you intend to have two accounts at Maybank, DON't DO IT. TAKE YOUR BUSINESS TO ANOTHER BANK. It makes no sense to have 2 a/c with Maybank coz you need to have two phones You need to spend more money to access your own money. Illogical.",Google Play,English,Positive,None,True,0,2026-06-02 21:10:00,2026-06-08 16:41:02,True,False
1824,4,,1,tahap keselamatan mudah diceroboh,Google Play,English,Neutral,None,True,0,2026-06-02 20:18:11,2026-06-08 16:40:37,False,False
1825,4,,5,great,Google Play,English,Positive,None,True,0,2026-06-02 19:18:37,2026-06-09 10:11:09,True,False
1826,4,0.9.47,5,easy to transfer money and pay bills,Google Play,English,Positive,None,True,0,2026-06-02 16:32:50,2026-06-09 10:06:16,True,False
1827,4,0.9.47,3,bila nk bayar qr lag lepas kejap ok kejap x,Google Play,English,Neutral,None,True,0,2026-06-02 12:34:55,2026-06-08 16:37:35,False,False
1828,4,0.9.46,5,bagoi,Google Play,English,Neutral,None,True,0,2026-06-02 11:51:09,2026-06-09 10:03:38,False,False
1829,4,0.9.47,2,why always still can't made update the apps.....???,Google Play,English,Neutral,None,True,0,2026-06-02 10:37:54,2026-06-08 16:36:38,False,False
1830,4,0.9.47,5,keep it up Maybank,Google Play,English,Neutral,None,True,0,2026-06-02 10:27:23,2026-06-09 10:02:55,False,False
1831,4,0.9.47,3,To Maybank app y suddenly the app no work. need to check play store I already 3 times delete then download all settings... 2 3days ok then again ask me to check play store. why???,Google Play,English,Neutral,None,True,0,2026-06-02 10:03:19,2026-06-08 16:36:03,False,False
1832,4,0.9.47,1,stupid now update cannot make screenshot,Google Play,English,Neutral,None,True,0,2026-06-02 09:58:44,2026-06-08 16:35:41,False,False
1833,4,0.9.47,5,making it easier for users to manage bank,Google Play,English,Neutral,None,True,0,2026-06-02 08:47:33,2026-06-09 10:01:06,False,False
1834,4,0.9.46,1,after the new update.. can't launch the app..stupid!,Google Play,English,Neutral,None,True,0,2026-06-02 08:34:30,2026-06-08 16:35:27,False,False
1835,4,,1,app ni Banyak problem...saya sanggup Ke ATM dan bank .. penat dengan apps teknologi tak boleh pakai,Google Play,English,Negative,Other,True,0,2026-06-02 00:13:47,2026-06-08 16:34:31,False,True
1836,4,0.9.47,1,lepas update aku punya akuan langsung tak boleh buka!!! menyusahkan orang la,Google Play,English,Neutral,None,True,0,2026-06-01 23:04:19,2026-06-08 16:33:47,False,False
1837,4,,5,"This app is easy to use and has a clean interface. So far, it works smoothly and provides the features I need. Great experience overall.",Google Play,English,Positive,None,True,0,2026-06-01 22:32:44,2026-06-09 09:55:04,True,False
1838,4,0.9.47,1,Not able to execute this latest app. Stated that the app is not coming from Google play. Previous versions do not hv problem. Tried updating with this new version couple of days but unsuccessful.,Google Play,English,Negative,Other,True,0,2026-06-01 21:49:13,2026-06-08 16:33:29,False,True
1839,4,0.9.47,1,poor,Google Play,English,Neutral,None,True,0,2026-06-01 20:14:00,2026-06-08 16:32:33,False,False
1840,4,,1,"why they said this app cannot update using Google play, please fix this and I cannot open this app",Google Play,English,Neutral,None,True,0,2026-06-01 16:58:40,2026-06-08 16:31:41,False,False
1841,4,0.9.47,1,kenapa sering terjadi apps MAE tidak dapat di update kerana apps bukan Dari play store sedangkan apps di install Dari play store..Dan ini menyebabkan apps maybank tidak dapat digunakan.,Google Play,English,Neutral,None,True,0,2026-06-01 16:23:06,2026-06-08 16:31:35,False,False
1842,4,0.9.46,5,"Aplikasi perbankan terbaik untuk saya. Memudahkan setiap urusan melibatkan pengurusan kewangan saya, seperti bayar bil, tranfer duit ke pihak ke3 dan sebagainya.",Google Play,English,Neutral,None,True,0,2026-06-01 16:01:39,2026-06-09 09:50:35,False,False
1843,4,0.9.47,5,incredible,Google Play,English,Neutral,None,True,0,2026-06-01 15:09:04,2026-06-09 09:49:41,False,False
1844,4,,3,the app is crashing on realme 14 pro.,Google Play,English,Negative,Performance,True,0,2026-06-01 13:40:42,2026-06-08 16:31:04,False,True
1845,4,0.9.47,5,very nice,Google Play,English,Neutral,None,True,0,2026-06-01 13:36:53,2026-06-09 09:40:42,False,False
1846,4,0.9.47,5,nice,Google Play,English,Neutral,None,True,0,2026-06-01 13:08:57,2026-06-09 09:39:04,False,False
1847,4,0.9.46,1,currently need to reinstall few times a day... not sure what the main issue..,Google Play,English,Negative,Other,True,0,2026-06-01 12:38:13,2026-06-08 16:30:35,False,True
1848,4,0.9.47,5,good,Google Play,English,Positive,None,True,0,2026-06-01 12:05:12,2026-06-09 09:38:19,True,False
1849,4,0.9.47,5,very good,Google Play,English,Positive,None,True,0,2026-06-01 10:01:57,2026-06-09 09:35:49,True,False
1850,4,0.9.47,5,nice,Google Play,English,Neutral,None,True,0,2026-06-01 09:25:31,2026-06-09 09:35:27,False,False
1851,4,0.9.46,1,"Today, June 1, 2026, at 8:42 a.m., I just wanted to check my loan balance, but it took more than 6 minutes. This happens very often. Now, I can't take it anymore. Imagine how many opportunities are missed due to this problem. Please use the 1-minute rule.",Google Play,English,Negative,Other,True,0,2026-06-01 08:50:08,2026-06-08 16:29:33,False,True
1852,4,0.9.46,1,"the app keep crashing and showing ""we unable to retrieve the information you've requested."" please fix this",Google Play,English,Negative,Performance,True,0,2026-06-01 08:41:35,2026-06-08 16:29:16,False,True
1853,4,0.9.47,5,good app,Google Play,English,Positive,None,True,0,2026-06-01 08:11:05,2026-06-09 09:34:50,True,False
1854,4,0.9.47,5,The best,Google Play,English,Positive,None,True,0,2026-06-01 08:09:43,2026-06-09 09:33:58,True,False
1855,4,0.9.46,1,hello admin why i cannot log in ya ?,Google Play,English,Neutral,None,True,0,2026-06-01 08:04:13,2026-06-08 16:28:31,False,False
1856,4,0.9.46,1,"MAE apps getting out of order. Even to most basic KWSP I-Sara, I-Suri is almost cannot be find. I has tried all payment options, search keywords Kumpul, KWSP, EPF, Employee, Employer.. none return",Google Play,English,Neutral,None,True,0,2026-06-01 08:01:47,2026-06-09 09:27:09,False,False
1857,4,,1,"Mcm gampang 3 dengan 4 pagi pun nk offline org minyak dh lh x de memang aku boikot siot maybank ni, jam 12 jam 3 sampai 4 pun nk offline but*",Google Play,English,Neutral,None,True,0,2026-06-01 04:27:34,2026-06-08 16:27:56,False,False
1858,4,0.9.9,1,very bad service maybank menyusahkan rakyat betol xboleh nk transfer or QR,Google Play,English,Negative,Payment Issues,True,0,2026-06-01 04:24:39,2026-06-08 16:27:39,False,True
1859,4,0.9.47,1,"App MAE tidak dapat digunakan selepas update. Maybank2u sila semak masalah ini. Sudah dua kali berlaku dalam tempoh terdekat ini. Bila klik update tidak berfungsi. Kena uninstall dan install semula, kena login semula baru boleh digunakan. App MAE tidak pernah berlaku perkara seperti selama saya gunakan. Tolong selesai masalah ini segera kerana sangat menyusahkan pengguna jika app MAE tidak dapat digunakan.",Google Play,English,Neutral,None,True,0,2026-06-01 02:00:39,2026-06-08 16:27:15,False,False
1860,4,0.9.47,3,recent time can't open,Google Play,English,Neutral,None,True,0,2026-06-01 00:51:54,2026-06-08 16:26:47,False,False
1861,4,0.9.47,5,nice apps,Google Play,English,Neutral,None,True,0,2026-06-01 00:40:01,2026-06-08 16:26:37,False,False
77,4,0.9.46,1,deactivated total,Google Play,English,Neutral,None,True,0,2026-06-01 00:34:15,2026-06-08 16:26:27,False,False
1862,4,0.9.47,5,good,Google Play,English,Positive,None,True,0,2026-05-31 23:31:09,2026-06-02 13:37:37,True,False
1863,4,0.9.47,1,why cannot update. already 2days,Google Play,English,Neutral,None,True,0,2026-05-31 22:36:19,2026-06-02 13:41:17,False,False
1864,4,0.9.47,5,terbaik,Google Play,English,Neutral,None,True,0,2026-05-31 22:19:13,2026-06-02 13:41:53,False,False
1865,4,0.9.47,1,cannot login mae,Google Play,English,Neutral,None,True,0,2026-05-31 22:13:46,2026-06-02 13:45:41,False,False
1866,4,0.9.47,5,good experience,Google Play,English,Positive,None,True,0,2026-05-31 21:34:30,2026-06-02 13:51:49,True,False
1867,4,0.9.47,1,"i don't know about these apps repeating the same thing to ask for installation ,when we already install they can't open.blank",Google Play,English,Neutral,None,True,0,2026-05-31 21:19:30,2026-06-02 13:53:08,False,False
1868,4,0.9.47,1,"I'm not sure why, when I click on Maybank app, it straight bring me to the play store, to continue get it on play. But I did install it from Google play. please fix this issue and get back to me.",Google Play,English,Negative,Other,True,0,2026-05-31 17:55:53,2026-06-02 14:00:40,False,True
1869,4,0.9.47,2,can't update,Google Play,English,Neutral,None,True,0,2026-05-31 16:45:59,2026-06-02 14:01:42,False,False
1870,4,,1,Extremely slow response to login into the Maybank website for banking activity. Need to improve on website processing time response.,Google Play,English,Negative,Account Access,True,0,2026-05-31 16:40:31,2026-06-02 14:05:30,False,True
1871,4,0.9.47,5,good,Google Play,English,Positive,None,True,0,2026-05-31 15:31:25,2026-06-02 17:22:05,True,False
1872,4,0.9.47,5,senang sudah ada mae ni semua dihujung jari,Google Play,English,Neutral,None,True,0,2026-05-31 13:12:59,2026-06-05 07:40:19,False,False
1873,4,0.9.46,1,Share to google drive is not working edit: share receipt share button is not working agaib,Google Play,English,Neutral,None,True,0,2026-05-31 11:19:21,2026-06-05 07:41:32,False,False
1874,4,0.9.46,5,best apps for saving money long term money,Google Play,English,Positive,None,True,0,2026-05-31 11:17:16,2026-06-05 07:41:48,True,False
1875,4,0.9.47,5,very good,Google Play,English,Positive,None,True,0,2026-05-31 11:15:38,2026-06-05 07:42:01,True,False
1876,4,0.9.1,1,Kenapa selalu suruh update from google store. bila nak update tak boleh!,Google Play,English,Neutral,None,True,0,2026-05-31 11:05:43,2026-06-05 07:42:54,False,False
1877,4,,5,Good,Google Play,English,Positive,None,True,0,2026-05-31 10:56:14,2026-06-05 07:43:12,True,False
1878,4,0.9.47,5,very good,Google Play,English,Positive,None,True,0,2026-05-31 10:53:21,2026-06-05 07:43:28,True,False
1879,4,0.9.47,1,Sebelum ini boleh updated di App Market dan Google Play. kini bila updated di App Market terus tidak boleh buka app maybank2u. ini membeban dan menyusahkan pengguna...,Google Play,English,Neutral,None,True,0,2026-05-31 10:06:54,2026-06-05 07:44:20,False,False
1880,4,0.9.47,1,capaian kurang memuaskan..,Google Play,English,Neutral,None,True,0,2026-05-31 09:30:34,2026-06-05 07:45:24,False,False
1881,4,,1,"Why this app keep want me to update ? But go to the app store can't update need to uninstall & reinstall to keep the app running smoothly What's going on , please fix it Really bad experience 😡🤦",Google Play,English,Negative,Other,True,0,2026-05-31 09:25:21,2026-06-05 07:45:41,True,True
1882,4,0.9.47,5,good very easy to pay.,Google Play,English,Positive,None,True,0,2026-05-31 08:05:58,2026-06-05 07:46:57,True,False
1883,4,0.9.47,5,good app mobile banking,Google Play,English,Positive,None,True,0,2026-05-31 07:36:20,2026-06-05 07:48:00,True,False
1884,4,0.9.46,5,one of my main bank account..easy and convenient,Google Play,English,Positive,None,True,0,2026-05-31 06:23:07,2026-06-05 07:49:13,True,False
1885,4,0.9.47,5,"Una aplicación bancaria muy práctica y confiable. Me permite realizar transferencias, pagos y consultas de saldo de forma rápida y segura. La interfaz es intuitiva y facilita mucho la gestión de mis finanzas a diario.",Google Play,English,Neutral,None,True,0,2026-05-31 03:36:33,2026-06-05 07:49:27,False,False
1886,4,0.9.47,1,my phone fold 7 could not load app after latest phone update... can help pleaseee??? need to do payment for bills and etc,Google Play,English,Neutral,None,True,0,2026-05-31 02:52:49,2026-06-05 07:49:45,False,False
1887,4,0.9.46,1,"everytime I make a fund transfer I have to key in my password 3-4 times? on top of the 6 digit pin, so that makes a total of keying in a code 4-5 times? please look into this because it's honestly ridiculous and makes the app so frustrating to use",Google Play,English,Neutral,None,True,0,2026-05-31 01:13:50,2026-06-05 07:50:43,False,False
1888,4,,5,A new and fun UI.... Easier to understand. Definitely better than the old Web page mbb2u.,Google Play,English,Neutral,None,True,0,2026-05-31 00:49:09,2026-06-05 07:50:56,False,False
1889,4,0.9.47,4,good,Google Play,English,Positive,None,True,0,2026-05-31 00:09:49,2026-06-05 07:51:07,True,False
1890,4,0.9.46,2,kenapa setiap kali nk guna kne log in ni? susah btul nk guna. tolong jawap kenapa,Google Play,English,Neutral,None,True,0,2026-05-30 23:58:21,2026-06-04 23:42:31,False,False
1891,4,,1,Part lain semua ok cuma part takleh screen shot betul2 menyusah kan.,Google Play,English,Neutral,None,True,0,2026-05-30 23:22:42,2026-06-04 23:40:09,False,False
1892,4,,1,this apps keep asking to update tapi x boleh update ... hampeh betul la,Google Play,English,Neutral,None,True,0,2026-05-30 22:57:40,2026-06-04 23:39:39,False,False
1893,4,0.9.46,1,bad day..can't log in..already deleted and downloaded again..still can't use...disappointed,Google Play,English,Negative,Account Access,True,0,2026-05-30 22:57:17,2026-06-04 23:38:56,False,True
1894,4,,1,Kenapa tak boleh update.. Update apps hilang,Google Play,English,Neutral,None,True,0,2026-05-30 22:49:33,2026-06-04 23:38:28,False,False
1895,4,0.9.47,1,"I don't know why these apps always crash when I check for updates on Google Play, there is no update, but when I open these apps, they ask me to update. Please, Maybank, fix all this. I've uninstalled and reinstalled dozens of times, but it's still the same.",Google Play,English,Negative,Performance,True,2,2026-05-30 22:11:20,2026-06-04 23:38:00,False,True
1896,4,,5,"Aplikasi yang sangat membantu untuk urusan perbankan. Mudah, selamat dan menjimatkan masa. Sangat berpuas hati!",Google Play,English,Neutral,None,True,0,2026-05-30 22:08:59,2026-06-04 23:36:35,False,False
1897,4,,5,"Maybank2u is a reliable banking app with convenient features for transfers, payments, and account management. It saves a lot of time.",Google Play,English,Positive,None,True,0,2026-05-30 21:40:42,2026-06-04 23:33:48,True,False
1898,4,0.9.46,5,"Secure, reliable mobile banking. Transfers, bill payments, and QR scans work instantly. Interface keeps improving.",Google Play,English,Positive,None,True,0,2026-05-30 21:13:39,2026-06-04 23:32:20,True,False
1899,4,0.9.47,5,good service,Google Play,English,Positive,None,True,0,2026-05-30 20:48:25,2026-06-04 23:32:08,True,False
1900,4,0.9.47,5,gteat,Google Play,English,Neutral,None,True,0,2026-05-30 20:47:20,2026-06-04 23:31:44,False,False
1901,4,0.9.47,1,"xdapat nak update,apehalllll",Google Play,English,Neutral,None,True,0,2026-05-30 20:14:25,2026-06-04 23:31:11,False,False
1902,4,,5,good,Google Play,English,Positive,None,True,0,2026-05-30 18:28:53,2026-06-04 23:27:20,True,False
1903,4,0.9.47,5,"Maybank2u memang sangat memudahkan urusan harian. Nak transfer duit, semak baki, bayar bil atau top up semuanya cepat dan mudah. Interface pun senang faham dan mesra pengguna. Memang sangat membantu!urusan jual beli semua melalui fon & hujung jari sahaja.",Google Play,English,Neutral,None,True,0,2026-05-30 18:03:08,2026-06-04 23:27:07,False,False
1904,4,,5,Apps is very interesting and friendly user!,Google Play,English,Neutral,None,True,0,2026-05-30 17:35:43,2026-06-04 23:26:45,False,False
1905,4,0.9.47,1,xdpt nk update Dan bukak,Google Play,English,Neutral,None,True,0,2026-05-30 17:25:24,2026-06-04 23:26:20,False,False
1906,4,0.9.47,1,"100 time uninstall & download, stupid",Google Play,English,Neutral,None,True,0,2026-05-30 16:16:48,2026-06-04 23:25:42,False,False
1907,4,0.9.47,5,"Maybank2u allows me to check my account balance, transfer money, pay bills, and other bank transaction easily. There are occasional glitches and loading delays, I think it is because of my poor signals. The UI is user friendly, navigation to trascation menu is easy to understand.",Google Play,English,Positive,None,True,10,2026-05-30 16:14:25,2026-06-04 23:25:19,True,False
1908,4,0.9.47,5,why cannot update mae maybank apps ?????,Google Play,English,Neutral,None,True,0,2026-05-30 16:13:53,2026-06-04 23:24:57,False,False
1909,4,0.9.46,5,Secure and convenient banking app that makes managing finances simple and efficient.,Google Play,English,Positive,None,True,0,2026-05-30 16:00:08,2026-06-04 23:24:32,True,False
1910,4,0.9.47,5,ok,Google Play,English,Neutral,None,True,0,2026-05-30 15:58:43,2026-06-04 22:48:42,False,False
1911,4,0.9.47,5,good,Google Play,English,Positive,None,True,0,2026-05-30 15:34:50,2026-06-04 22:48:28,True,False
1912,4,0.9.47,1,why can't I open it?? it suddenly came out to update using the play store. o already download and the apps already updated laa,Google Play,English,Neutral,None,True,0,2026-05-30 15:29:02,2026-06-04 22:48:07,False,False
1913,4,0.9.47,5,What is the problem with my May yMAE now. I have Updated and I still can't use online May Bank now.,Google Play,English,Negative,Other,True,0,2026-05-30 14:55:23,2026-06-04 22:46:55,False,True
1914,4,0.9.47,5,ok,Google Play,English,Neutral,None,True,0,2026-05-30 14:22:18,2026-06-04 22:44:52,False,False
1915,4,0.9.47,1,I can't update the app and it kept saying it didn't come from Google play therefore they can't update. I installed this from the Google play!,Google Play,English,Neutral,None,True,0,2026-05-30 13:53:04,2026-06-03 18:58:45,False,False
1916,4,0.9.46,5,"bagus mudah di guna, dan menyenangkan dalam proses pembayaran tidak merumitkan, cepat menjimatkn masa dan tenaga, app mae ini yang amat berguna.",Google Play,English,Neutral,None,True,0,2026-05-30 13:23:40,2026-06-03 18:58:10,False,False
1917,4,0.9.47,1,Is MAE app having a problem right now? Google Play informed that the app installed on my device didn't come from Google Play & won't get updates from Google Play.,Google Play,English,Negative,Other,True,0,2026-05-30 13:17:09,2026-06-03 18:57:42,False,True
1918,4,0.9.46,3,y cant update? terpaksa uninstall and install balik beberapa kali bila nak pakai. waste my time.,Google Play,English,Neutral,None,True,0,2026-05-30 12:52:15,2026-06-03 18:56:26,False,False
1919,4,0.9.47,1,suddenly cannot open my mae,Google Play,English,Neutral,None,True,0,2026-05-30 12:49:44,2026-06-03 18:56:00,False,False
1920,4,0.9.47,5,nice app,Google Play,English,Neutral,None,True,0,2026-05-30 12:45:26,2026-06-03 18:55:42,False,False
1921,4,0.9.46,1,Why is the app hard to load. I am always stuck at the startup yellow screen.,Google Play,English,Neutral,None,True,0,2026-05-30 12:25:29,2026-06-03 18:54:37,False,False
1922,4,0.9.47,1,"It keeps saying I cannot update cause i did not download through play store which is false cause I always updated my MAE thru playstore, what happened?",Google Play,English,Neutral,None,True,0,2026-05-30 12:24:08,2026-06-03 18:44:41,False,False
1923,4,0.9.47,1,"used one time then unable to use. said need to get the app from play store. reinstall , same thing happend",Google Play,English,Neutral,None,True,0,2026-05-30 12:07:11,2026-06-03 18:43:26,False,False
1924,4,0.9.47,5,ok,Google Play,English,Neutral,None,True,0,2026-05-30 10:16:27,2026-06-03 18:42:22,False,False
1925,4,0.9.47,5,good,Google Play,English,Positive,None,True,0,2026-05-30 10:02:43,2026-06-03 18:42:08,True,False
1926,4,0.9.47,5,okay,Google Play,English,Neutral,None,True,0,2026-05-30 09:43:24,2026-06-03 18:37:58,False,False
1927,4,0.9.47,3,I was asked to update this app via Google Play and I did. The next day I was asked again to update the app.It prompted that the app was not downloaded via Google Play and can't be updated. I have to uninstall the app and reinstall it again but I have to create new password.It was running fine but the next day it asked me to update the app again. What is happening? Please advise.,Google Play,English,Neutral,None,True,0,2026-05-30 09:37:59,2026-06-03 18:35:01,False,False
1928,4,,1,tiba2 apps tak boleh guna ..kenapa...,Google Play,English,Neutral,None,True,0,2026-05-30 08:28:53,2026-06-03 18:33:22,False,False
1929,4,0.9.46,4,Not able to activate Mae account and daily need to reinstall app. why?,Google Play,English,Neutral,None,True,0,2026-05-30 08:25:19,2026-06-03 18:32:58,False,False
1930,4,0.9.46,5,bagus,Google Play,English,Neutral,None,True,0,2026-05-30 02:40:22,2026-06-03 18:31:00,False,False
1931,4,0.9.46,2,what happened to MAE I can't open the is crash..,Google Play,English,Negative,Performance,True,0,2026-05-30 02:37:02,2026-06-03 18:30:44,False,True
1932,4,,1,lag 😡,Google Play,English,Neutral,None,True,0,2026-05-30 01:10:23,2026-06-03 18:29:04,False,False
1933,4,,5,kena update,Google Play,English,Neutral,None,True,0,2026-05-29 23:00:27,2026-06-03 18:18:13,False,False
1934,4,0.9.46,1,idk why it takes so long to open my mae app for these past few days. i even uninstall this app and still i can't even open this app. do review and fixed the problem ASAP.,Google Play,English,Negative,Other,True,0,2026-05-29 22:25:34,2026-06-03 18:17:43,False,True
1935,4,0.9.47,5,good,Google Play,English,Positive,None,True,0,2026-05-29 21:35:05,2026-06-03 18:15:30,True,False
1936,4,0.9.47,5,good,Google Play,English,Positive,None,True,0,2026-05-29 21:15:35,2026-06-03 18:07:47,True,False
1937,4,0.9.47,5,awesome,Google Play,English,Neutral,None,True,0,2026-05-29 21:05:24,2026-06-03 18:07:29,False,False
1938,4,0.9.47,5,no good 💯,Google Play,English,Positive,None,True,0,2026-05-29 20:50:47,2026-06-03 18:07:12,True,False
1939,4,,1,sudah update nak buka tak boleh..bongokkkk,Google Play,English,Neutral,None,True,0,2026-05-29 20:48:08,2026-06-03 18:06:51,False,False
1940,4,0.9.46,1,"kenapa dia minta unlink M2U pupa, bengap app ni, x dpt login langsung, xda ribut xda angin, tiba² mcm ni.. bila dah uninstall dan reinstall , app pula keep stopping x boleh login",Google Play,English,Neutral,None,True,4,2026-05-29 20:32:36,2026-06-03 18:06:28,False,False
1941,4,0.9.47,1,keep request to update. once update unable to open the mae apps,Google Play,English,Neutral,None,True,0,2026-05-29 20:30:17,2026-06-03 18:05:29,False,False
1942,4,,5,"I like using Maybank2u because it makes online banking easy and convenient. I can check my account, transfer money, and pay bills quickly anytime.",Google Play,English,Positive,None,True,0,2026-05-29 20:17:11,2026-06-03 18:05:10,True,False
1943,4,0.9.47,1,why i can't update this apps??,Google Play,English,Neutral,None,True,0,2026-05-29 19:48:37,2026-06-03 17:58:07,False,False
1944,4,0.9.47,4,easy tu use,Google Play,English,Positive,None,True,0,2026-05-29 19:42:51,2026-06-03 17:57:55,True,False
1945,4,0.9.47,2,app can't get update n thus cannot open.,Google Play,English,Neutral,None,True,0,2026-05-29 19:08:34,2026-06-03 17:57:31,False,False
1946,4,,5,nice,Google Play,English,Neutral,None,True,0,2026-05-29 19:00:09,2026-06-03 17:56:42,False,False
1947,4,0.9.26,5,wht poblm maybank,Google Play,English,Neutral,None,True,0,2026-05-29 18:42:55,2026-06-03 17:56:25,False,False
1948,4,0.9.46,5,Very good,Google Play,English,Positive,None,True,0,2026-05-29 17:55:12,2026-06-03 17:55:00,True,False
1949,4,0.9.47,1,stupid n fraustrated system.wasting my time to use tis app,Google Play,English,Neutral,None,True,0,2026-05-29 17:16:18,2026-06-03 17:54:05,False,False
1950,4,0.9.47,3,mae i tak boleh bukak..dia mintak update..betul kea...mengyusahkan orang lah macam nie,Google Play,English,Neutral,None,True,0,2026-05-29 17:04:10,2026-06-03 17:53:26,False,False
1951,4,0.9.46,1,hi i have an issue using the apps for this month ... it's said that the apps are having a communication error..help me...I also cannot log in through the browser in my phone,Google Play,English,Negative,Account Access,True,0,2026-05-29 15:45:44,2026-06-03 17:51:35,False,True
1952,4,0.9.46,5,good finance Bank apps,Google Play,English,Positive,None,True,0,2026-05-29 15:09:01,2026-06-03 17:50:13,True,False
1953,4,0.9.47,4,okey,Google Play,English,Neutral,None,True,0,2026-05-29 14:24:24,2026-06-03 17:49:10,False,False
1954,4,0.9.47,5,nice,Google Play,English,Neutral,None,True,0,2026-05-29 14:04:44,2026-06-03 17:48:53,False,False
1955,4,0.9.47,1,the app making prblm can't update from play store 😡😡,Google Play,English,Neutral,None,True,0,2026-05-29 13:37:49,2026-06-03 17:47:53,False,False
1956,4,0.9.47,5,improvement,Google Play,English,Neutral,None,True,0,2026-05-29 13:17:48,2026-06-03 17:46:22,False,False
1957,4,,1,"ingtkan buat kad sng je,secara online,dah masuk rm9,nk daftar kad fizikal mae,pastu dia suruh aktifkan secure2u,suruh call bagai,last"" kene aktifkan dkt bank jugak,baik buat dkt bank terus je,burn mcmtu jela rm9,nak transfer apa"" kne aktifkan secure2u",Google Play,English,Positive,None,True,0,2026-05-29 13:17:12,2026-06-03 17:45:59,True,False
1958,4,0.9.47,5,good,Google Play,English,Positive,None,True,0,2026-05-29 12:45:01,2026-06-03 17:45:17,True,False
1959,4,0.9.47,5,great 👍 we'll done service,Google Play,English,Positive,None,True,0,2026-05-29 12:36:50,2026-06-03 17:44:39,True,False
1960,4,0.9.47,5,"Sort out your savings, spending, cravings and more with by Maybank2u. This has all your M2U banking features and beyond. Apart from viewing, tracking, and managing your finances, the app helps you to manage tasks and plan your lifestyle with just a few taps.",Google Play,English,Neutral,None,True,0,2026-05-29 12:35:07,2026-06-03 17:44:22,False,False
1961,4,0.9.47,5,ok,Google Play,English,Neutral,None,True,0,2026-05-29 11:43:29,2026-06-03 17:34:44,False,False
